cid,name,type,difficulty,value,pre_id,special,todo,description
成就cid,成就名,成就类型,成就难度,成就数值需求,前置成就需求id,是否为特殊成就,是否未实装,成就介绍
int,str,str,int,int,int,int,int,str
0,1,1,0,0,0,0,0,1
成就数据表,,,,,,,,
1,醒来,周目,1,1,0,0,0,首次创建角色
2,再次醒来,周目,2,2,1,1,0,进入第二周目
51,爱意萌芽,关系,1,1,0,0,0,首次与干员进入爱情路线
52,情定终身,关系,2,1,51,0,0,首次与干员的关系达成爱侣
53,风流倜傥,关系,5,100,52,0,0,累计与100名干员的关系达成爱侣
61,归属初现,关系,1,1,0,0,0,首次与干员进入隶属路线
62,忠诚誓约,关系,2,1,61,0,0,首次与干员的关系达成奴隶
63,众星拱月,关系,5,100,62,0,0,累计与100名干员的关系达成奴隶
101,入职报道,招募,1,1,0,0,0,招募1名新干员
102,群英荟萃,招募,4,100,103,0,0,累计招募100名干员
111,初次来访,访客,1,1,0,0,0,首次邀请访客
112,宾客如云,访客,3,30,111,0,0,累计邀请30位访客
121,秘密关押,囚犯,1,1,0,0,0,首次将干员关押为囚犯
122,暗黑地牢,囚犯,4,8,121,0,0,同时关押了8名囚犯干员
201,小有积蓄,龙门币,1,10000,0,0,0,拥有10000龙门币
202,资产一鸭,龙门币,5,100000000,201,0,0,拥有100000000龙门币
203,泰拉首富,龙门币,6,1000000000,202,0,0,拥有1000000000龙门币
211,好货到手,道具,1,1,0,0,1,首次购买道具
212,道具通鉴,道具,4,50,211,0,1,累计购买50种不同道具
221,贴身衣物,服装,1,1,0,0,1,收藏1件干员服装
222,塞爆衣柜,服装,4,100,221,0,1,收藏100件干员服装
223,Panty & Stocking,服装,5,1000,222,0,1,收藏1000件干员服装
301,出门一趟,外勤,1,1,0,0,1,完成第一次外勤委托
302,外勤精英,外勤,4,100,301,0,1,累计完成100次外勤委托
303,万事屋,外勤,5,1000,302,0,1,累计完成1000次外勤委托
311,新手上路,载具,1,1,0,0,1,首次拥有载具
312,豪车收藏,载具,4,20,311,0,1,拥有20辆载具
321,换个配件,维修,1,1,0,0,1,首次维修装备
322,巧手修复,维修,2,100,321,0,1,累计维修100件装备
323,万能胶水,维修,3,1000,322,0,1,累计维修1000件装备
331,擦拭干净,保养,1,1,0,0,1,首次保养装备
332,养护达人,保养,4,100,331,0,1,累计保养100件装备
333,能传三代,保养,5,1000,332,0,1,累计保养1000件装备
401,强身健体,锻炼,1,1100,0,0,1,博士的体力与气力最大值均大于1100
402,体能大师,锻炼,4,3000,401,0,1,博士的体力与气力最大值均大于3000
403,肉身巅峰,锻炼,5,5000,402,0,1,博士的体力与气力最大值均大于5000
501,吐字清晰,技能,1,1,0,0,1,博士的话术技能达到1级
502,舌灿莲花,技能,3,4,501,0,1,博士的话术技能达到4级
503,谈笑风生,技能,5,8,502,0,1,博士的话术技能达到8级
506,列队站好,技能,1,1,0,0,1,博士的指挥技能达到1级
507,运筹帷幄,技能,3,4,506,0,1,博士的指挥技能达到4级
508,号令三军,技能,5,8,508,0,1,博士的指挥技能达到8级
511,中杯,技能,1,1,0,0,1,博士的战斗技能达到1级
512,大杯,技能,3,4,511,0,1,博士的战斗技能达到4级
513,超大杯,技能,5,8,512,0,1,博士的战斗技能达到8级
516,做熟就行,技能,1,1,0,0,1,博士的料理技能达到1级
517,油盐酱醋,技能,3,4,516,0,1,博士的料理技能达到4级
518,灶里乾坤,技能,5,8,517,0,1,博士的料理技能达到8级
521,看懂曲谱,技能,1,1,0,0,1,博士的音乐技能达到1级
522,心扉之乐,技能,3,4,521,0,1,博士的音乐技能达到4级
523,金律乐章,技能,5,8,522,0,1,博士的音乐技能达到8级
526,义务教育,技能,1,1,0,0,1,博士的学识技能达到1级
527,博闻强记,技能,3,4,526,0,1,博士的学识技能达到4级
528,学贯泰拉,技能,5,8,527,0,1,博士的学识技能达到8级
531,绷带包扎,技能,1,1,0,0,1,博士的医术技能达到1级
532,回春妙手,技能,3,4,531,0,1,博士的医术技能达到4级
533,冥土追魂,技能,5,8,532,0,1,博士的医术技能达到8级
536,出芽新绿,技能,1,1,0,0,1,博士的农业技能达到1级
538,百谷长青,技能,3,4,537,0,1,博士的农业技能达到4级
540,离离枯荣,技能,5,8,539,0,1,博士的农业技能达到8级
541,巧手学徒,技能,1,1,0,0,1,博士的制造技能达到1级
542,工坊新秀,技能,3,4,541,0,1,博士的制造技能达到4级
543,工艺大师,技能,5,8,542,0,1,博士的制造技能达到8级
546,涂涂画画,技能,1,1,0,0,1,博士的绘画技能达到1级
547,泼墨淋漓,技能,3,4,546,0,1,博士的绘画技能达到4级
548,写意胜形,技能,5,8,547,0,1,博士的绘画技能达到8级
601,荒时之匙,时停,1,1,0,0,1,累计时间停止1分钟
602,序时之锁,时停,2,60,601,0,1,累计时间停止60分钟
603,白锁与黑匙,时停,4,1440,602,0,1,累计时间停止1440分钟
621,梦境呓语,催眠,1,1,0,0,1,初次催眠1名角色
622,安眠旋律,催眠,2,5,621,0,1,完全催眠1名角色
623,梦乡摇篮,催眠,5,50,623,0,1,完全催眠50名角色
701,新生命,生育,1,1,0,0,1,首次生育孩子
702,再要一胎,生育,2,2,701,0,1,累计生育2个孩子
703,种马,生育,4,10,702,0,1,累计生育10个孩子
704,大种马,生育,5,100,703,0,1,累计生育100个孩子
706,一发入魂,生育,5,1,0,1,1,角色在破处当天受精怀孕
707,女儿的女儿,生育,5,1,0,1,1,与女儿生育了孩子
708,产假接产假,生育,5,1,0,1,1,育儿中的角色受精怀孕
801,生产起步,生产,1,1,0,0,1,首次生产产品
802,生产专家,生产,4,100,801,0,1,累计生产100件产品
803,工业巨擘,生产,5,1000,802,0,1,累计生产1000件产品
811,播种新手,种植,1,1,0,0,1,首次收获农作物
812,五谷丰登,种植,4,100,811,0,1,累计收获100份农作物
813,嘉禾盈仓,种植,5,1000,812,0,1,累计收获1000份农作物
1001,签字盖章,公务,1,1,0,0,1,首次处理公务
1002,公文如山,公务,4,100,1001,0,1,累计处理100次公务
1003,日理万机,公务,5,1000,1002,0,1,累计处理1000次公务
1011,书香初现,读书,1,1,0,0,1,首次读书
1012,合上书页,读书,2,1,1011,0,1,读完1本书
1013,博览群书,读书,5,100,1012,0,1,累计读完100本书
1021,初试锅铲,烹饪,1,1,0,0,1,首次制作食物
1022,千锅百味,烹饪,4,100,1021,0,1,累计制作100次食物
1023,泰拉饭,烹饪,5,1000,1022,0,1,累计制作1000份食物
1031,初次赠礼,礼物,1,1,0,0,1,首次赠送礼物
1032,礼尚往来,礼物,5,100,1031,0,1,累计赠送100次礼物
1041,身高体重,体检,1,1,0,0,1,首次进行身体检查
1042,内外体格,体检,2,100,1041,0,1,累计进行了100次身体检查
1043,影像拍片,体检,3,1000,1042,0,1,累计进行了1000次身体检查
1051,出具报告,体检,1,1,0,0,1,首次对干员出具身体检查报告
1052,档案汇总,体检,2,100,1051,0,1,累计对干员出具100份身体检查报告
1061,香气初现,香薰,1,1,0,0,1,首次对干员进行香薰疗愈
1062,芳香使者,香薰,3,100,1061,0,1,累计香薰疗愈100次
