cid,fater_type,son_type,qa,text
编号id,父类id(0系统，1日常，2攻略，3H，4经营),子类id,问题还是回答,内容
int,int,int,str,str
0,0,0,0,1
教程的问题及回答,,,,
1,0,0,q,经常看到的部位字母缩写分别代表什么意思？
2,0,0,a,Ｂ：Breast  ，胸部\nＣ：Clitoris，阴蒂\nＰ：Penis   ，阴茎\nＶ：Vagina  ，阴道\nＡ：Anus    ，肛门\nＵ：Urethra ，尿道\nＷ：Womb    ，子宫\nＮ：Normal  ，身体其他部位通用（如耳朵、尾巴、口腔、脖子、肚子、大腿等）
3,0,1,q,刻印是什么东西？有什么用？如何获得或消除？
4,0,1,a,刻印是干员的一种特殊属性，在干员经历对她影响足够大的事件时才会获得/升级，除无觉刻印外为最高六级以外，其他刻印最高为三级\n目前共实装了6个刻印，分别是快乐刻印、屈服刻印、无觉刻印、苦痛刻印、恐怖刻印、反发刻印\n其中负面刻印（恐怖刻印和反发刻印），可以使用博士的源石技艺来降低刻印等级，降低到零级即为消除\n\n快乐刻印：在干员体验到足够强烈的性快感时会获得/升级该刻印\n          一旦体验过性的快乐，就会发自内心的想要更多品尝这份快感，不停地堕落下去\n          能够在博士对干员进行性骚扰/H指令时增加实行值，关系到部位敏感度提升与淫乱系素质获得\n\n屈服刻印：在干员做了足够卑微或耻辱的事时会获得/升级该刻印\n          逐渐放弃不需要的自尊和骄傲，开始服从于你的每个命令，以满足你的意志为人生的全部目的\n          能够在博士对干员进行所有指令时增加实行值，并且是隶属系攻略路线的前置条件\n\n无觉刻印：干员在意识薄弱或无意识中体验到足够强烈的性快感时会获得/升级该刻印\n          尽管脑海里没有印象，但身体依旧会忠实地记住并习惯于这美好的感觉，直到为时已晚的那一刻的到来\n          能够在博士对干员进行性骚扰/H指令时增加实行值，并显著增强无意识奸下的快感\n\n苦痛刻印：在干员受到了足够多的物理疼痛时会获得/升级该刻印\n          适度的鞭打作为教育的一环，能够让身体一点点理解疼痛也是一种快感\n          能够在博士对干员进行SM指令时增加实行值，但在进行爱情指令时减少实行值\n\n恐怖刻印：在干员遭受了足够大的精神打击时会获得/升级该刻印\n          不断累积的精神创伤会逐渐封闭人的心灵，并最终把人格推向无底的深渊\n          负面刻印，在博士对干员进行所有指令时减少实行值，刻印等级的提高会使干员的AI无法正常行动直至完全错乱\n\n反发刻印：在干员对博士产生了足够大的愤怒、怀疑和仇恨时会获得/升级该刻印\n          信任的裂隙逐渐扩大，其反面就是刻骨的仇恨\n          非常严重的负面刻印，在博士对干员进行所有指令时极大的减少实行值，一级会拒绝大部分互动指令，二级会有意避免与博士接触，三级会伺机攻击博士
5,0,2,q,如何进行催眠？都有哪些催眠？
6,0,2,a,当博士通过开局选取或者使用至纯源石来学习催眠的源石技艺素质后，即可对干员进行催眠\n\n初期可以在与干员两人独处的时候进行【单人催眠】，在升级到高级催眠就可以直接对房间内全员进行【集体催眠】\n\n每次对干员进行催眠时会提升对方的催眠程度，到50%、100%、200%时分别对应浅层、深层、完全催眠\n\n当前催眠的种类共有平然、空气、体控、心控四种，分别更强的催眠效果，需要的深度也依次提升，默认手动选取每次进行催眠的种类，也可以在【源石技艺】更改为指定种类

101,1,0,q,干员每天的日常行动是什么样的？
102,1,0,a,大体上可以分为工作和非工作（无工作或有工作但今天休息）两种状态\n\n对工作的干员来说，早上起床，然后去食堂吃早饭，上午工作，中午吃午饭，下午工作，下班后娱乐，晚饭，去大浴室洗澡，回宿舍睡觉\n非工作的干员则把工作的部分全部换成娱乐，其他都是一样的\n\n除了上述根据时间而来的主要行动之外，疲劳值和尿意值的逐渐累积也会影响干员的临时行动\n前者会使干员去休息或者睡觉来减轻疲惫，后者在让干员每一段时间就要去一次洗手间\n\n如果博士对干员的行动有干预，比如助理或者跟随的相关指令，则以博士的指令为优先，同时也会说一声然后去解决吃饭/休息/解手之类个人需求，解决后再回来\n\n以上所有行为都会基于动态权重和flag状态槽来梳理干员的行为树，尽可能模拟较为智能和合理的AI行动

201,2,0,q,如何和干员处好关系？
202,2,0,a,正常的和干员相处就会自然而然的关系要好起来了，最简单的方式就是把要攻略的目标设为助理，这样平常就一直在一起行动了\n一开始还是陌生的状态下，就不要急于进行性骚扰甚至做更过分的事情，日常系的指令都是不会出问题的，等到熟悉起来了再逐步尝试吧
203,2,1,q,惹干员生气了怎么办？
204,2,1,a,去诚恳的道歉，不行的话就多道几次歉，总会原谅你的。\n如果生气很严重，获得反发刻印或者恐怖刻印了的话，可以用源石技艺进行消除，然后再去道歉。
205,2,2,q,攻略路线是怎么样的？
206,2,2,a,攻略分为【爱情系】和【隶属系】两条路线，只能二选其一，两条路线在抵达第三阶段时均可获得该干员的【信物】。\n\n爱情系：以和干员相亲相爱为主要目标，通过日常中的点点滴滴拉近感情，最终坠入爱河，从低到高共有[思慕]、[恋慕]、[恋人]、[爱侣]四个阶段\n隶属系：以博士的意志为主要目标，通过强迫性指令和肉体快感调教等方式等方式，最终达到干员对博士的绝对服从，从低到高共有[屈从]、[驯服]、[宠物]、[奴隶]四个阶段\n\n最开始路线的选择是博士在属性提升中手动选择的，之后当前周目内就不能再更改了，请慎重选择

301,3,0,q,如何才能与干员H？
302,3,0,a,首先，需要关系足够亲密，当随便性骚扰都没关系的时候，就可以尝试性地邀请与干员H了。\n如果邀请失败了，说明还需要再努努力，比如在当天多一起互动互动，或者营造一下比较好的氛围，或者干脆使用药物等辅助工具\n邀请成功了的话，H时也要一步一步慢慢来，前戏做好、润滑足够，这样干员才会同意插入，如果润滑不足的话，即使同意了，也会极大的增加苦痛值\n以及要插入的话，需要提前准备好避孕措施，如果不想避孕的话，可能需要极大的努力才能说服干员同意
303,3,1,q,如何用道具来H？
304,3,1,a,在贸易区里有一个成人用品商店，消耗粉红凭证就可以购买对应道具\n大部分道具购买后即可在H中使用，部分特殊道具（如搾乳机等）需要对应部位已经开发到满足条件才可以使用
305,3,2,q,干员会怀孕吗？可以真的生出小孩吗？
306,3,2,a,除去还没有来初潮的干员之外，其他所有人都是可以怀孕的。虽然耗时比较长，最后生出来的小孩在成长后也会成为新的干员\n\n干员的生理周期以七天为一个循环，包含安全日、普通日、危险日和排卵日四种日子\n在每个生理周期的排卵日(第6天)会根据整个周期内，安全日以外的其他日被射入精液总量来判断是否[受精]\n\n在[受精]后，过一个月左右的时间会变成[妊娠]状态，获得[孕肚]和[泌乳]\n再过两个月左右，会[临盆]，接着过不了几天就会[生产]\n生出孩子后，母亲会进入[育儿]状态，养育需要一个月左右，孩子就会从[婴儿]成长为可以初步自理的[幼女]\n结束了[育儿]后，母亲会恢复孕前状态，也会失去[泌乳]，而孩子还会依次成长为[萝莉]再到[少女]，每次成长会耗时两个月左右\n\n孩子的性别仅为女性，在成长到[少女]后即完全成为一名正常的干员\n女儿会继承母亲包括种族在内大部分生理特征，也会在[育儿]期间学到部分来自母亲的后天知识和技能

401,4,0,q,如何便捷地查看整个罗德岛每个部门的经营情况？
402,4,0,a,在博士办公室使用【管理罗德岛】指令，可以总览基地的情况，快捷管理每个部门，以及调整人员的工作安排
403,4,1,q,如何招募新的干员？
404,4,1,a,需要在文职区的办公室进行【招募干员】，虽然博士可以亲自上场，不过还是建议任命干员来做。\n\n在进行招募干员的工作时，可以增长招募条，增长速度主要由话术等级决定\n当招募条到100%时，即招募到一名新的干员并重置招募条，此时会向博士发送提示信息，博士就可以到博士办公室里确认并欢迎新干员的加入\n\n可以使用【招募情况】来查看招募进度或调整招募策略
405,4,2,q,如何建造/升级设施？
406,4,2,a,在工程区的基建部可以使用【基建系统】指令，消耗龙门币来兴建或升级设施。\n其中[控制中枢]的等级影响所有区块的等级上限，[动力区]的等级影响供电量，其他各区块则影响各自区块内部的效果或功能解锁
407,4,3,q,都有哪些获得龙门币的方法？
408,4,3,a,目前主要的获取途径有两个。\n①，医疗部每天治疗病人，能够获得稳定的龙门币收入\n②，将资源在制造加工区将其加工成药品或奢侈品，再在贸易区的[资源交易所]中卖出，能够获得较高的利润
409,4,4,q,都有哪些获得粉红凭证的方法？
410,4,4,a,①，每日的干员好感度提升会换算为一定的粉红凭证\n②，已攻略的干员会根据攻略程度每日提供固定的粉红凭证
411,4,5,q,都有哪些获得至纯源石的方法？
412,4,5,a,目前的主要获得办法是在图书馆的藏品馆中进行收集解锁，获得至纯源石奖励

