key,type,value,get_text,info
键,类型,值,多语言化处理(前面的类型里int则为0，str则为1),备注
AdvNpc,int,180,0,角色编号
Name,str,艾雅法拉,1,角色姓名
Sex,int,1,0,角色性别
Profession,int,4,0,角色职业为术师
Race,int,16,0,角色种族为卡普里尼
Nation,int,81,0,角色势力为莱塔尼亚
Birthplace,int,8,0,角色出身地为莱塔尼亚
Hp,int,1300,0,角色初始体力
Mp,int,1600,0,角色初始气力
Dormitory,str,无,1,角色初始宿舍
Token,str,小巧的理发剪。柄的位置细心地缠绕着隔热的布料。,1,角色信物
Introduce_1,str,艾雅法拉，火山学家，天灾信使。于高等源石技艺、高能量法术释放等领域展现出了卓越的天赋。现于罗德岛接受治疗，同时为罗德岛提供天灾研究、环境观察与评估、危险地形航行保障等相关服务。,1,角色介绍
TextColor,str,#ffadc4,1,角色字体颜色为#ffadc4
A|2,int,2,0,角色阴蒂感度为2
A|45,int,3,0,角色学识技能为3
A|48,int,3,0,角色制造技能为3
E|82,int,600,0,角色学识经验为600
T|0,int,1,0,角色有阴道处女素质
T|1,int,1,0,角色有肛门处女素质
T|2,int,1,0,角色有尿道处女素质
T|3,int,1,0,角色有子宫处女素质
T|4,int,1,0,角色有无接吻经验素质
T|61,int,1,0,角色有周期性发情素质
T|64,int,1,0,角色有容易湿素质
T|86,int,1,0,角色有阴蒂敏感素质
T|98,int,1,0,角色有兽部敏感素质
T|104,int,1,0,角色有少女素质
T|112,int,1,0,角色有兽角素质
T|111,int,1,0,角色有兽耳素质
T|113,int,1,0,角色有兽尾素质
T|123,int,1,0,角色有普乳素质
T|127,int,1,0,角色有普臀素质
T|129,int,1,0,角色有细腿素质
T|131,int,1,0,角色有小足素质
T|150,int,1,0,角色有源石病感染者素质
T|156,int,1,0,角色有视力障碍素质
T|157,int,1,0,角色有听力障碍素质
T|162,int,1,0,角色有体表源石结晶素质
T|353,int,1,0,角色有酒量差素质
C|2,str,助听器,1,角色耳饰为助听器
C|3-0,str,呼吸器,1,角色脖饰为呼吸器
C|3-1,str,拾音降噪耳机,1,角色脖饰为拾音降噪耳机
C|5-0,str,白色单边长袖兜帽斗篷,1,角色上衣为白色单边长袖兜帽斗篷
C|5-1,str,灰粉色无袖蓬蓬连衣裙,1,角色上衣为灰粉色无袖蓬蓬连衣裙
C|7,str,黑色绷带,1,角色手套为黑色绷带
C|8,str,灰粉色无袖蓬蓬连衣裙,1,角色下衣为灰粉色无袖蓬蓬连衣裙
C|10,str,黑色过膝长袜,1,角色袜子为黑色过膝长袜
C|11,str,红黑系带羊蹄靴,1,角色鞋子为红黑系带羊蹄靴
C|12,str,黑色长柄法杖,1,角色武器为黑色长柄法杖
C|13,str,护目镜,1,角色附属物为护目镜
