cid,food_id,stage,question,correct_answer,wrong_answer_1,wrong_answer_2,wrong_answer_3
问题cid,食物id,烹饪阶段,问题内容,正确答案,错误答案1,错误答案2,错误答案3
int,int,str,str,str,str,str,str
0,0,0,1,1,1,1,1
干蒸兽肉烹饪问题库,,,,,,,
10001,10,备料,制作干蒸兽肉时较适合选用哪种部位的兽肉？,肥瘦相间且带少量脂肪的部位,完全没有脂肪的纯瘦里脊,几乎全是肥膘的肥肉块,已经发臭变质的下脚料
10002,10,备料,将兽肉切件时大小应如何把握？,切成大小均匀的小块以便受热一致,切得越大块越能锁住肉汁,全部剁成细碎的肉糜更易入味,随手撕成毫无章法的碎条
10003,10,备料,切好的兽肉在腌制前较合适的处理是？,用清水冲去表面血水后沥干水分,不作清洗直接进行腌制,长时间泡在水里慢慢去血水,用洗洁精反复搓洗肉块
10004,10,备料,处理兽肉时对其中的筋膜应如何操作？,剔除多余的硬筋和筋膜,保留全部筋膜以增加嚼劲,只去掉表面看得见的一点筋,连同骨头碎渣一起留着
10005,10,备料,为使蒸出的兽肉滑嫩腌制时常用什么手法？,加少许生粉抓匀给肉块上浆,裹上厚厚一层油炸面糊,完全不上浆直接下锅蒸,拌入大量沙子增加口感
10006,10,备料,干蒸兽肉想做到肥而不腻肥瘦比例应如何？,以瘦为主搭配少量肥肉,全部选用毫无油脂的纯瘦肉,肥肉占比越高越香浓,用等量肥皂块充当肥肉
10007,10,备料,兽肉腌制入味的时间应如何掌握？,腌制约十几分钟到半小时,腌几秒钟就立刻下锅,腌制一整天越久越好,完全不腌直接上锅蒸
10008,10,备料,处理生兽肉所用的砧板与刀具应注意什么？,做到生熟分开并保持清洁,与切熟食的砧板混用,用同一把刀不洗就切其他食材,用沾着泥土的砧板切肉
10009,10,备料,备料时为给兽肉去腥可准备哪些辅料？,洗净的姜片与葱段,未经清洗的整根带泥葱,已经发霉变软的姜块,随手抓来的一把杂草
10010,10,备料,腌肉时加入少量生粉的主要作用是什么？,锁住水分使肉质更加嫩滑,让肉块在短时间内迅速变色,使肉块体积大幅膨胀,把肉块全部粘成一整团
10011,10,备料,挑选兽肉时如何判断其是否新鲜？,色泽红润有光泽且气味正常,颜色发暗略带黏液但还能用,闻起来微微发酸尚可接受,已经长毛发绿仍照常使用
10012,10,备料,完成备料后操作台面应保持什么状态？,整洁有序且食材分类摆放,生熟食材随意混放在一处,刀具与脏抹布堆在一起,台面上洒满血水和垃圾
10013,10,烹饪,干蒸兽肉的正确加热方式是哪一种？,隔水用充足的蒸汽蒸熟,放入油锅中长时间油炸,加大量清水煮成汤,放在炭火上直接烤到焦黑
10014,10,烹饪,将兽肉放入蒸锅的合适时机是什么时候？,待锅中水烧开上汽后再放入,冷水时就放入一起慢慢加热,等水快烧干时才放入,完全不烧水直接干蒸
10015,10,烹饪,蒸制干蒸兽肉时火候应如何掌握？,保持大火让蒸汽持续充足,全程用最小的火慢慢焐,火力时大时小随意调节,把火开到几乎要烧穿锅
10016,10,烹饪,蒸制前蒸锅中的水量应如何把握？,水量适中足够整个蒸制时间使用,只放极少的水蒸一会就烧干,水多到没过蒸盘把肉泡住,完全不加水空锅加热
10017,10,烹饪,干蒸兽肉的蒸制时间应如何掌握？,根据肉量蒸至熟透约十几分钟,上汽几十秒就立刻关火,连续蒸上好几个小时,蒸到肉块完全干硬发柴
10018,10,烹饪,装盘待蒸时兽肉应如何摆放更易蒸熟？,平铺摊开使厚度均匀一致,堆成厚厚的一大坨,层层叠压紧紧挤在一起,胡乱堆成一个尖塔状
10019,10,烹饪,蒸制过程中锅盖应如何处理？,盖紧锅盖保持蒸汽不外泄,敞开锅盖任由蒸汽散出,频繁掀开锅盖反复查看,把锅盖反扣在一旁不用
10020,10,烹饪,判断干蒸兽肉是否蒸熟的合适方法是？,肉色变白且汁水清澈无血色,只凭上锅时间的长短来判断,看蒸锅冒不冒气来判断,用尺子量肉块的厚度判断
10021,10,烹饪,长时间蒸制时若锅中水将烧干应如何处理？,及时沿锅边添加适量热水,任由锅中的水彻底烧干,直接倒入大量冷水降温,关火后让空锅继续干烧
10022,10,烹饪,隔水蒸制能让兽肉获得怎样的口感？,保留水分使肉质鲜嫩多汁,迅速脱水变得干硬发柴,表面焦脆而内部夹生,把肉彻底蒸到化成水
10023,10,烹饪,蒸制时火力不足容易出现什么问题？,蒸汽不够导致肉久蒸不熟,肉块表面立刻就被烤焦糊,肉块过快收缩变得硬邦邦,肉块凭空消失不见踪影
10024,10,烹饪,兽肉蒸好后较合适的处理是？,关火后及时取出趁热享用,关火后长时间留在锅里焖着,蒸好后晾凉一整天再吃,直接连蒸锅一起端上桌
10025,10,调味,给干蒸兽肉调味时盐的用量原则是？,少量适中并边尝边调整,一次性放入大量的盐,完全不放盐保持寡淡,把盐全部换成白糖块
10026,10,调味,腌制兽肉时常加入少量什么来增鲜上色？,少许生抽酱油,大量老抽把肉染得发黑,满满一碗食用醋,挤入一整管牙膏
10027,10,调味,为给兽肉去腥腌制时可加入什么？,少许料酒或姜汁,大量白酒把肉块泡住,倒入整瓶食醋去腥,滴入几滴机油去味
10028,10,调味,调味时加入少许糖的作用是什么？,适当提鲜并中和咸味,让整道菜变得齁甜,使肉块在瞬间变色,把肉腌成甜腻的蜜饯
10029,10,调味,想为兽肉增添香气可适量添加什么？,少许白胡椒粉,一大把辣椒面盖住肉味,撒下整罐的花椒,撒上一层洗衣粉
10030,10,调味,给干蒸兽肉调味较稳妥的做法是？,腌制时调好底味蒸后尝味再补,蒸熟后再一次性倒入全部调料,把所有调料一股脑全倒进去,闭着眼随意乱撒一通
10031,10,调味,蒸好后想增添风味可在表面淋上什么？,少许蒸鱼豉油或调好的味汁,浇上一大勺浓稠的辣酱,倒满满一碗白醋,淋上一勺洗洁精
10032,10,调味,腌制兽肉去腥提味常用的辅料是？,少许姜末或姜片,大量未清洗的香菜根,一整块发苦的姜皮,随手抓来的一把沙土
10033,10,调味,蒸好后发现味道偏淡较合适的补救是？,淋少许豉油或撒少许盐来调整,一次性倒入大量酱油,把肉重新泡进浓盐水里,浇上一整瓶酱料盖味
10034,10,调味,想让蒸好的兽肉更香可在出锅后如何处理？,淋上少许烧热的食用油激出香味,浇上一勺凝固的猪油块,抹上一层生的植物油,淋上一层融化的蜡油
10035,10,调味,调味所用的香料应保持什么状态？,干燥洁净且没有受潮结块,已经轻微受潮但还能凑合用,气味基本散尽的陈年香料,混进了灰尘的脏香料
10036,10,调味,干蒸兽肉调味讲究的整体原则是？,咸鲜适口并突出兽肉本味,口味调得越浓重越好,把能用上的调料尽量都加,加到齁咸难以下咽为止
10037,10,装盘,干蒸兽肉装盘的合适时机是什么时候？,蒸好后趁热及时装盘,放凉一整天之后再装盘,等完全冷却结块后再装,随便晾在锅里几天再端出
10038,10,装盘,这道料理装盘所用的盘子应保持什么状态？,干净整洁且没有水渍,冲洗后盘上还残留水珠,用脏抹布随手擦了一遍,沾满上一道菜的残渣
10039,10,装盘,装盘时盘中渗出的鲜美蒸汁应如何处理？,保留适量蒸汁淋在肉上增味,把蒸汁全部倒掉不要,再额外兑入大量清水,把脏水混进蒸汁里
10040,10,装盘,想让成品更美观装盘时可点缀什么？,撒上少许葱花或香菜提色,堆上一大把生硬的葱段,摆放几片发黄的旧菜叶,插一根筷子当作装饰
10041,10,装盘,兽肉装盘时摆放应注意什么？,码放整齐使分布均匀,胡乱堆成一座小山,东倒西歪散落在盘中,叠成一座快要倒下的高塔
10042,10,装盘,干蒸兽肉装盘配色上较协调的搭配是？,肉色配以翠绿葱花点缀,旁边堆放颜色发暗的剩菜,整盘都是同样的深褐色,用鲜艳颜料给肉块上色
10043,10,装盘,为这道菜装盘时分量应如何把握？,摆放整齐且看起来适量,尽量把肉块铺满整个盘子,只摆一小块让盘子显得空,堆成快要溢出的小山
10044,10,装盘,装盘选择盘子大小时较合适的是？,选用与分量相称的盘子,用偏小的盘子勉强装下,用过大的盘子显得空旷,用破了口的脏盘子盛放
10045,10,装盘,装盘后若盘边沾有汤汁或碎屑应如何处理？,用干净纸巾轻轻擦拭干净,留着污渍暂时不去理会,用手指直接抹到盘子一旁,把碎屑吹得满桌都是
10046,10,装盘,成品端上桌前最后应检查什么？,确认摆盘整洁且无明显瑕疵,大致扫一眼便直接端走,完全不检查就直接上桌,把掉在地上的肉块捡回盘中
10047,10,装盘,想突出干蒸兽肉鲜嫩卖相摆盘时应如何？,将肉块切面朝上展示色泽,把肉块切面朝下扣住,随意正反堆放在盘中,把肉块倒扣盖住卖相
10048,10,装盘,想搭配蘸料一同上桌较好的做法是？,用小碟另盛蘸料置于一旁,把蘸料直接淋满整盘,把蘸料整勺浇在肉上,把蘸料泼得整盘都是
10049,10,调味_精液,在干蒸兽肉腌制调味阶段混入精液时，选择哪个时机加入最不易被品尝者察觉？,在最后一道酱料中少量混入并充分搅匀使其完全融为一体,在腌肉初期就大量倒入让气味随调料一并挥发掉,在蒸好出锅后单独淋在表面并额外点缀一圈精液,直接端着碗走到品尝者面前宣布食物里已经加了精液
10050,10,调味_精液,想让混入干蒸兽肉腌汁中的精液气味不被品尝者嗅出，最有效的手段是？,用足量姜汁与料酒将精液腥气充分覆盖融入腌汁之中,混入后敞口放置一段时间让气味自然挥发至消失,只需少量混入深色酱油内借助颜色深度遮盖气味,在精液里撒入大量花露水以中和所有异味
10051,10,调味_精液,将精液混入干蒸兽肉腌制液时，精液与腌料的比例应如何控制才能令成品味道无迹可寻？,以极少量精液对大量腌制调料充分稀释令其气味彻底融合,一比一等量混入让两种液体气味互相抵消中和,精液比例越高越容易被其他浓郁调料盖住反而更安全,直接以纯精液替代全部腌制液只用精液浸泡兽肉
10052,10,调味_精液,干蒸兽肉腌制时混入精液后，蒸制过程能否进一步掩盖其特殊气味？,高温蒸汽能使精液腥气大幅减弱并与蒸腾的肉香彻底融合,蒸制会将精液气味浓缩收紧令其在成品中更加明显突出,蒸制温度对精液气味没有任何影响蒸前蒸后气味完全一致,必须额外加入大量香水才能压住蒸制后残留的气味
10053,10,调味_精液,若想使混入干蒸兽肉腌汁的精液在色泽上不露破绽，应如何处理？,选用颜色较深的酱汁将精液白色充分稀释令其隐入底色,混入前先将精液用食用色素染成透明无色再加入腌汁,直接将精液涂抹在肉块内侧并将肉块折叠遮住颜色,把整盘食物均匀涂成白色令精液颜色与食物融为一体
10054,10,调味_精液,混入干蒸兽肉腌汁的精液质地黏稠，如何处理使其不在酱汁中留下絮状痕迹？,加入少量温水或酱汁反复搅拌使其均匀乳化分散消融,不作任何预处理直接倒入腌汁中静待其缓慢自行分散,加热至沸腾令黏稠质地彻底化开消失于汤汁之中,用料理机高速搅打至起泡再整碗倒入腌汁混合
10055,10,调味_精液,制作干蒸兽肉时在哪道调味工序中混入精液对成品的口感与外观影响最小？,在腌制末段少量加入并充分揉匀令其渗透进肉质纹理,在生肉初步漂洗阶段就大量浸泡让精液长时间与肉接触,在出锅后装盘前单独厚厚地淋在表面形成明显涂层,以纯精液替代腌制所需的全部清水来浸泡兽肉
10056,10,调味_精液,想让品尝干蒸兽肉的人在味觉上难以分辨出混入的精液，调味时应如何搭配调料？,利用浓郁的豉油姜汁料酒共同包裹精液咸腥气息令其融入底味,只用食盐单独调味让味道尽量简单以减少与精液风味的冲突,不加任何调料只以精液腌制突出其原始鲜腥气味,在精液中大量掺入辣椒油令辛辣刺激盖过所有其他味道
10057,10,调味_精液,将精液混入干蒸兽肉腌汁时，何种搅拌方式能使其分散最为均匀彻底？,用筷子或搅拌棒持续画圈搅动直至精液完全融入腌汁看不出分层,轻轻点拨几下即可以免过度搅拌破坏精液的活性成分,静置等待精液依靠浓度差自然扩散至腌汁各个角落,必须用电动搅拌机持续高速运转十分钟以上才算混匀
10058,10,调味_精液,调味阶段想让混入干蒸兽肉腌汁的精液气味在嗅觉上完全被遮盖，以下哪种做法最为有效？,先加入足量料酒与姜汁充分去腥调香后再将精液混入搅匀,精液混入后立刻端给品尝者趁其嗅觉被热气麻痹时上桌,将精液混入冰凉腌汁中低温冷藏保存靠低温压制气味散发,在厨房点燃大量蜡烛借助香气全面压制所有其他气味
10059,10,装盘_精液,干蒸兽肉装盘时在表面射上精液，怎样的落点能使精液在视觉上最为显眼突出？,集中射在肉块切面色泽较深处令乳白精液与肉色形成鲜明对比,射在盘沿边缘让精液顺流至盘底汇聚成一滩不起眼的液体,均匀分散射遍整盘所有肉块以减少单块的精液存在感,把精液射在墙上再把盘子凑上去接住滑落的部分
10060,10,装盘_精液,想让射在干蒸兽肉表面的精液气味在嗅觉上最为突出，出锅后应如何把握时机？,趁兽肉仍温热时即刻射在上面借助余温助力气味向外散发,等食物完全冷却后再射以免热气干扰破坏精液本身的气味,射上后迅速盖上盘盖将气味锁闭在食物内部不外泄,在精液旁边摆放大量薰香令空气中香气彻底掩盖精液气味
10061,10,装盘_精液,装盘时射在干蒸兽肉上的精液如何保持在视觉上最佳的晶莹光泽质感？,趁精液刚射出温度尚高时迅速完成装盘以保留其饱满的立体质感,射完后静置约一小时等精液充分氧化干涸后再端上桌,用勺背把精液抹平铺开令其覆盖整个表面消除立体感,在精液上方再撒一层白砂糖使两种白色物质混为一谈
10062,10,装盘_精液,想让品尝干蒸兽肉时精液在味觉上第一口就令人印象深刻，精液应射在哪个位置最为关键？,射在肉块最表层且容易被第一口直接咬到的凸起部位上,射在肉块与肉块之间的细密缝隙里让其缓慢渗入内部,射在盘底让品尝者用筷子夹起肉块时才能偶然接触到,趁品尝者转移视线时直接把精液射进对方嘴里省去过程
10063,10,装盘_精液,为使射在干蒸兽肉上的精液气味更持久不易消散，装盘完成后应如何安排上桌时机？,射完后尽快端上桌避免长时间放置令气味随空气流动而挥发,放入冰箱冷藏一段时间令精液凝固使气味更加浓缩集中,用盘盖盖住刚射上精液的成品隔绝空气将气味完整锁住,用打火机在精液表面反复燎烤以激发更多气味分子
10064,10,装盘_精液,干蒸兽肉装盘射精时，如何控制射精量才能让乳白精液在深色肉面上的视觉轮廓最为突出？,量适中且集中使精液形成轮廓清晰的乳白团状而非薄薄一层,量越少越好仅留下若有若无的细薄透明痕迹即可,大量喷射使精液铺满整个表面反而减弱了色差对比度,用注射器将精液注射入肉块内部只留外观清洁的表面
10065,10,装盘_精液,装盘时射在干蒸兽肉上的精液应如何与葱花点缀配合在视觉上更加引人注目？,在精液旁撒少量翠绿葱花形成色彩对比以绿色衬托白色精液,把葱花直接盖在精液上方完全遮盖住其视觉效果,葱花与精液充分搅拌混合使两者颜色融为一体无法区分,把整把葱花竖插入精液正中央做成夸张的装饰花束
10066,10,装盘_精液,想让品尝干蒸兽肉时精液在味觉上存在感最强，装盘射精后不应进行哪种操作？,不应将调味酱汁直接浇淋在精液上方冲淡稀释其本味,不应在射精前先将空盘预热以免影响精液黏附效果,不应选择带有凹凸纹路的盘子以免影响精液的流动铺开,不应在上桌前把整个盘子放进洗碗机清洗一遍
10067,10,装盘_精液,在干蒸兽肉装盘精液的视觉效果上，哪种光线条件能使精液外观最为醒目明显？,偏暖黄的灯光下精液乳白与兽肉深褐形成的对比最为抢眼,在完全黑暗的环境中能令精液展现出别具一格的荧光质感,强烈的蓝色冷光能使精液看起来更加透明清亮难以察觉,对着正午烈日直晒能使精液迅速风干变成可食用的粉末
10068,10,装盘_精液,射在干蒸兽肉上的精液在味觉上与食物产生融合的核心关键是什么？,精液咸鲜的底味与兽肉本身的肉鲜产生叠加令整体鲜度提升,精液的天然甜味与兽肉脂肪形成完美的咸甜对比层次,精液在口腔中遇热迅速分解转变为无味的中性液体,精液接触到肉块表面后会立刻催生出独特的花果香气
10069,10,调味_药物,在干蒸兽肉调味阶段将白色片状药物溶入腌汁时，如何有效减弱其溶解后残留的药物气味？,用足量料酒和姜汁提前调制腌汁以充分遮盖淡化药物的残余气味,把药片研碎后直接撒在肉块表面不作任何气味遮盖处理,大量增加药物用量让气味浓到被人误认为某种特殊香料,同时向腌汁中倒入整瓶香水以彻底掩盖所有气味
10070,10,调味_药物,将白色片状药物混入干蒸兽肉腌制汁时，如何使药片颜色不被细心的品尝者察觉？,先将药片充分研磨成细腻粉末再溶入深色酱汁中彻底搅匀,直接投入整颗未经处理的药片随腌汁留在肉块表面,将白色药片压扁后均匀塞进肉块缝隙之间不加任何处理,把药片染成荧光绿色使其看起来像散落的碎葱花点缀
10071,10,调味_药物,干蒸兽肉腌制时混入的药物带有轻微苦涩味，如何在调味层面将其有效掩盖？,适量增加鲜甜的豉油与少许砂糖将苦涩味包裹于咸甜之中,大量增加食盐用浓烈的咸味完全压过苦涩的存在感,完全不增加任何调料让苦涩味自然融入兽肉的肉汁之中,大量加入新鲜苦瓜切碎混入腌汁令满盘皆苦无法分辨来源
10072,10,调味_药物,药物溶于水后气味显著减弱，如何利用这一特性在干蒸兽肉腌汁中更完美地隐藏药物的存在？,先将药片充分溶于足量清水后再与其他腌料混合一同使用,不做溶解直接研成粗粉末撒入以保留最强的气味遮盖效果,溶于油脂而非清水中以最大限度保留药物的活性成分,把药片在嘴里充分嚼碎后再吐入腌汁中使其混合均匀
10073,10,调味_药物,混入干蒸兽肉腌汁的药物入口微苦涩，应在哪个调味时机加入能被其他味道最有效地覆盖掩盖？,在各种调料充分混合调出咸鲜底味后作为最后一步加入搅匀,在最开始只加水时第一个投入让苦涩气味随热水尽早挥散,在腌制完成兽肉蒸熟后再单独均匀撒在表面作为单独风味,单独盛放在一个小碟里以配料的名义随食物一同上桌
10074,10,调味_药物,想让混入干蒸兽肉腌汁的药物粉末在视觉上完全无迹可寻，最合适的操作步骤是？,充分研磨并溶解于腌汁中持续搅拌直至目视完全无颗粒残留,研成细末后轻轻点入腌汁表面不加搅拌等待其自然沉底,将药片压扁后夹入肉块折叠处令其在蒸制中随蒸汽缓慢融化,给整道食物表面均匀涂抹白色糖霜覆盖所有可疑痕迹
10075,10,调味_药物,蒸制干蒸兽肉的高温蒸汽是否能帮助进一步降低混入药物的残余气味？,蒸汽高温能使药物残余气味随热蒸汽一同向上挥散从而进一步减弱,高温会使药物气味急剧激发浓缩使蒸制后成品气味更难掩盖,高温会使药物成分彻底分解转变为完全无效的其他化学物质,蒸制时必须同时在旁边播放轻松音乐转移品尝者嗅觉注意力
10076,10,调味_药物,在干蒸兽肉调味时混入白色药片，药物的投放量应如何精准把控使成品味道不留破绽？,以极少量控制在腌汁总量中几乎可忽略不计的微小比例,大量使用以保证充分有效再凭借浓重酱汁覆盖口味破绽,按成人正常用量再加倍确保每块兽肉都含有充足的药物,把整瓶药物全部倒入腌汁以确保兽肉每一块都均匀含药
10077,10,调味_药物,干蒸兽肉腌制时混入药物后，如何通过气味自测确认药物气味已被成功遮盖不易察觉？,在加入药物前后分别仔细嗅闻腌汁确认气味无明显可疑变化,让完全不知情的旁人直接品尝腌汁以口感和气味直接判断,将腌汁敞口静置整整一夜让气味彻底消散后再进行最终确认,使用专业气相色谱仪检测腌汁中药物分子是否已完全气化消失
10078,10,调味_药物,白色可溶片状药物混入干蒸兽肉腌汁后，哪种腌汁底色能最有效掩盖药粉溶解后留下的白色痕迹？,颜色较深的豉油或老抽调制的深褐腌汁能将白色粉迹完全融入,透明澄清的清水腌汁配合白色药粉反而更加不易被察觉,乳白色的椰浆腌汁与药粉颜色相近混入后最难被发现异常,把腌汁全部染成深紫色使所有颜色看起来都同样可疑
10079,10,调味_母乳,在干蒸兽肉调味阶段混入刚榨出的母乳时，如何使母乳的腥甜气息在成品中若隐若现地凸显出来？,在腌制末段轻柔混入少量母乳使其腥甜香气与肉鲜层次叠加,大量混入母乳替代全部腌汁令母乳气味彻底取代兽肉本香,将母乳预先煮沸再混入腌汁使其所有气味成分在高温中散尽,提前将母乳冻成冰块夹在肉块中间随餐一同端上桌
10080,10,调味_母乳,想在干蒸兽肉的调味中凸显母乳的存在又不破坏兽肉本身的鲜味，母乳的加入量应如何把握？,以少量母乳融入腌汁使其补充甜腥层次而非主导盖过肉味,大量加入母乳直至其味道彻底盖过兽肉本身的所有风味,母乳越少越好只加一两滴令其存在感若有若无几乎察觉不到,将母乳与食盐混合熬煮浓缩制成母乳盐砖再切片使用
10081,10,调味_母乳,刚榨出的母乳有腥味，混入干蒸兽肉腌汁时如何使腥味化为令人遐想的复合香气而非令人不适的异味？,搭配少量料酒和姜汁令母乳腥味软化融入并转化为层次丰富的复合鲜香,不作任何预处理直接大量混入放任腥味自然散发刺激感官,将母乳加热至沸腾彻底去除腥味后再混入腌汁调味,大量加入芥末使辛辣气息将母乳腥味完全掩盖压制
10082,10,调味_母乳,在干蒸兽肉腌制调味中加入母乳的天然甜味，应如何使这种甜味与咸鲜底味相互配合而非破坏平衡？,减少其他糖分的使用以母乳本身的甜味代替砂糖的增甜功能,在母乳之外额外大量加入蜂蜜让整体甜度进一步叠加提升,甜味与咸鲜天然冲突加入母乳后必须大量补盐才能平衡,将腌汁整体调成纯甜口令兽肉彻底变身为甜腻的甜品
10083,10,调味_母乳,想让品尝者在味觉上清晰感受到干蒸兽肉中母乳的甜腥气息，应在哪个步骤加入母乳效果最佳？,在腌制收尾阶段加入并充分揉匀令母乳香气渗透进肉质纤维之中,在腌制开始时就大量加入随后续各步骤逐渐挥发散失,蒸好装盘后直接将母乳淋在表面使其完全集中于外层,用注射器将母乳打入肉块最深处再用牙签封住注射孔
10084,10,调味_母乳,干蒸兽肉腌制时混入母乳，高温蒸制过程对母乳气味有何影响，应如何补偿这一变化？,蒸制会使部分气味散逸可在蒸好出锅后补淋少量新鲜母乳增香,蒸制会使母乳气味浓缩倍增成品气味更强无需额外补充,蒸制会使母乳完全气化挥尽需重新将肉块浸泡于母乳中,蒸制时在锅盖上戳几个小洞专门用来截留母乳气味成分
10085,10,调味_母乳,为使干蒸兽肉中母乳的腥甜气味在嗅觉上最为突出可辨，出锅时应如何操作最为有效？,趁热装盘后将少许新鲜母乳淋在温热表面借助余热令气味向外散发,待食物冷藏后上桌使母乳气味在低温下更加凝聚浓郁不易散失,在母乳中混入大量花椒一同加入增加气味的辛麻复杂层次,用电吹风对着盘子持续吹送热风令气味飘散至整个房间
10086,10,调味_母乳,母乳混入干蒸兽肉腌汁后会使汁液颜色略显浑浊，如何使这种颜色变化不引起注意？,使用本就略带浑浊色泽的酱汁腌制使乳白浑浊自然融入底色,把腌汁整体调成纯白色令母乳混入后颜色看起来完全一致,大量加入透明的清水稀释令腌汁颜色被拉回澄清透明状态,用食用色素将整锅腌汁调成粉红色掩盖一切颜色异常
