cid,food_id,stage,question,correct_answer,wrong_answer_1,wrong_answer_2,wrong_answer_3
问题cid,食物id,烹饪阶段,问题内容,正确答案,错误答案1,错误答案2,错误答案3
int,int,str,str,str,str,str,str
0,0,0,1,1,1,1,1
鲜能剂烹饪问题库,,,,,,,
226001,226,备料,制作鲜能剂时为获得浓郁鲜味应优先选用哪类富含谷氨酸的食材？,成熟的海带或昆布,刚采摘的鲜嫩菜叶,含水量极高的生菜,路边随手拔来的野草
226002,226,备料,鲜味物质中谷氨酸与肌苷酸搭配能产生协同增鲜下列哪种组合较合适？,昆布搭配柴鱼干,昆布只配一锅清水,柴鱼干只拌白糖,海带搭配橡皮泥
226003,226,备料,备料时选用干香菇作为鲜味来源较合适的处理是？,用温水缓慢泡发以释放鸟苷酸,直接干磨成粉不作泡发,用沸水猛冲一下便用,拿去油炸到焦黑发苦
226004,226,备料,处理用于熬汤的昆布时表面的白霜应如何对待？,用干布轻拭保留其鲜味成分,用流水彻底搓洗干净,长时间浸泡把白霜泡掉,用钢丝球用力刮除
226005,226,备料,为给鲜能剂补充能量备料时较合适的高能量原料是？,富含淀粉的谷物或薯类,几乎不含热量的清水,只剩纤维的老菜梗,不可食用的干木屑
226006,226,备料,准备动物性鲜味食材时为保证安全应先做什么？,检查新鲜度并彻底清洗,闻着没异味便直接使用,表面随意冲一下就下锅,用沾满泥土的手直接抓取
226007,226,备料,备料时为提升后续浓缩效率蔬菜原料较好处理成什么状态？,切成均匀小块增大受热面积,整颗不切直接下锅,随意撕成大小不一的块,砸成一摊稀烂的泥
226008,226,备料,挑选用于增鲜的番茄时较合适的是？,色泽红润饱满的成熟番茄,青涩坚硬的生番茄,发软渗水的腐烂番茄,塑料做的假番茄
226009,226,备料,备料阶段称量各类原料时应遵循什么原则？,按配方比例准确称量,凭感觉随手抓取,担心不够而全部加倍,把所有原料一股脑倒入
226010,226,备料,准备熬制用水时较合适的选择是？,洁净的饮用水,反复煮沸多次的老水,带有异味的存放水,浑浊发臭的污水
226011,226,备料,为保证鲜味纯正盛放食材的容器应保持什么状态？,洁净无油无异味,刚装过油尚未清洗,借用没洗的脏盆,用生锈漏底的旧桶
226012,226,备料,备料结束后对各类原料较合适的管理方式是？,分类摆放并标注用途,全部混堆在一处,随意散放在台面各角,直接丢在地上待用
226013,226,烹饪,用昆布熬制鲜味底汤时为避免产生黏滑杂味较合适的做法是？,在水将沸时捞出昆布避免久煮,全程大火长时间猛煮昆布,把昆布一直煮到完全溶烂,把昆布煮成焦黑的炭块
226014,226,烹饪,加入柴鱼干萃取鲜味时较合适的时机是？,关火后趁热浸泡片刻再滤出,冷水时就同煮很长时间,大火持续猛煮十余分钟,等汤彻底放凉后再放入
226015,226,烹饪,熬煮浓缩鲜能剂底液时火候应如何控制？,保持小火慢慢收浓,全程大火快速烧干,时大时小随意调节,开到最大火直至糊锅
226016,226,烹饪,浓缩过程中汤面出现的浮沫应如何处理？,及时撇除浮沫保持清澈,用力搅拌使浮沫沉底,任其留在汤中不去管它,再加料故意增加浮沫
226017,226,烹饪,判断鲜能剂底液浓缩到位较合适的方法是？,观察汤汁变稠且能挂勺,只看熬煮的时间长短,凭锅中沸腾的响声判断,用尺子量液面的高度
226018,226,烹饪,长时间熬煮时为减少鲜味流失应注意什么？,控制火力避免过度剧烈沸腾,始终保持汤汁剧烈翻滚,频繁掀盖让蒸汽大量散失,把空锅一直烧到干裂
226019,226,烹饪,熬煮含蛋白质的鲜味原料时温度过高容易导致什么？,蛋白质过度变性产生腥涩味,鲜味瞬间增强许多倍,汤色立刻变得格外清澈,锅里凭空多出许多食材
226020,226,烹饪,为使各种鲜味物质充分溶出下料顺序较合适的是？,难出味的先下易挥发的后下,所有原料一次性全部倒入,易挥发的最先长时间同煮,闭着眼随意先后乱放
226021,226,烹饪,浓缩到一定程度时若汤汁不慎偏少较合适的补救是？,适量补入同味的热底汤,直接加入大量冷自来水,兑入一碗凉白水稀释,倒入一瓶汽水来充数
226022,226,烹饪,熬煮过程中搅拌的合适方式是？,适时轻柔搅动防止粘底,用力快速猛搅打出泡沫,全程完全不搅任其糊底,用脏木棍胡乱搅动
226023,226,烹饪,控制熬煮总时长较合适的原则是？,熬至鲜味充分释放且不过火,时间越久越好熬上整天,草草煮一两分钟便停,一直熬到水分完全烧干
226024,226,烹饪,熬煮完成后从锅中滤取鲜液较合适的做法是？,用细滤网滤去残渣留取清液,连渣带汤一起直接盛出,用脏抹布随意一兜了事,直接伸手下锅捞取
226025,226,调味,鲜能剂调味时适量加盐对鲜味的作用主要是？,适量盐能衬托并放大鲜味,盐放得越多鲜味越被掩盖才最好,完全不放盐鲜味才最足,用细沙代替盐来调味
226026,226,调味,调味时想增鲜又不过咸较合适的做法是？,利用鲜味物质协同从而减少用盐,一味地大量加盐来提味,把盐直接换成等量白糖,加入大把味精到齁咸
226027,226,调味,为平衡鲜能剂风味少量糖的作用是？,适量糖可柔和咸味使口感圆润,糖加得越多整体就越鲜,糖会完全抵消所有鲜味,倒入半罐糖浆长时间泡着
226028,226,调味,调味鲜能剂时较合适的尝味方式是？,少量多次边尝边调整,一次加足全部调料后再尝,完全凭经验不尝便定味,闭着眼随意乱加一通
226029,226,调味,若发现成品鲜味发腻可以怎样平衡？,加入少许酸味提鲜解腻,再补一大勺浓鲜味料,额外加入大量油脂中和,倒入一管牙膏来调味
226030,226,调味,调味时酸味原料较合适的添加量是？,少量点缀起到提味作用,大量倾倒使汤汁发酸,完全不加保持原样不变,把整瓶醋全部倒进去
226031,226,调味,为提升鲜能剂层次感可少量添加什么？,一点点酿造酱油增鲜增香,满满几勺重口味酱料,多种浓味调料一起猛加,挤入一段护手霜
226032,226,调味,调味讲究咸鲜平衡下列做法较合适的是？,咸度适中让鲜味自然透出,调得越咸越能下饭才好,寡淡无味才算最健康,加到苦咸难咽为止
226033,226,调味,若鲜能剂口感偏淡较稳妥的补救是？,少量分次补入盐和鲜味料,一次性倒入大量调料,把整碗再蘸满浓酱,灌入一瓶酱油长时间泡着
226034,226,调味,调味用的酱油等液体调料应保持什么状态？,洁净无沉淀无变质,略有沉淀但仍勉强可用,已经发酸变味的陈货,混入灰尘杂质的脏料
226035,226,调味,为照顾食客满意度调味时较合适的考量是？,兼顾大众口味做到鲜咸适口,只按自己的重口味来调,把所有口味都调成极咸,故意调得令人难以下咽
226036,226,调味,鲜能剂整体调味追求的原则是？,以鲜为主诸味协调平衡,口味调得越浓重越好,把能用的调料全加一遍,越咸越甜越刺激越好
226037,226,装盘,鲜能剂作为浓缩提鲜补能食品分装时较合适的做法是？,按单次食用量分成小份盛装,一大锅不分装直接端上,全部倒进一个超大桶里,随手洒在桌面上待取
226038,226,装盘,为方便保存分装鲜能剂所用的容器应如何？,洁净干燥且能够密封,沿用没洗过的旧容器,敞口不加盖随意摆放,用漏底开裂的破碗
226039,226,装盘,暂时不食用的鲜能剂较合适的保存方式是？,密封之后冷藏保存,敞开放在常温台面,搁在阳光直射处,埋进湿润的泥土里
226040,226,装盘,分装较热的鲜能剂前较合适的处理是？,稍微晾凉后再密封分装,趁滚烫时立刻密封封死,等放凉一整天后再装,边沸腾边硬灌进瓶中
226041,226,装盘,装盘呈给食客时为提升卖相可以怎么做？,用洁净小盏盛装并点缀少许香草,随意倒在大盘中央,用沾满残渣的脏盘盛放,在表面插一根铅笔装饰
226042,226,装盘,盛装鲜能剂的器皿在使用前应保证什么？,干净整洁没有水渍异味,简单擦一下仍带着水珠,沾着上一道菜的残渣,布满油污和灰尘
226043,226,装盘,为体现浓缩提鲜的特点装盘分量较合适的是？,小份精致突出浓郁口感,满满一大碗稀释后上桌,只摆一滴显得过分吝啬,堆成快要倾倒的高塔
226044,226,装盘,分装多份鲜能剂以便日后取用时较好的管理是？,标注分装日期并分类存放,不作任何标记随意堆放,新旧混放无从分辨,散乱地丢在角落里
226045,226,装盘,装盘后若器皿边缘沾有汤渍应如何处理？,用洁净纸巾轻轻擦净,留着汤渍不去理会,用手指随意抹到一旁,任其滴落得满桌都是
226046,226,装盘,鲜能剂需要再次加热食用时较合适的做法是？,取出所需份量适度回温,把整桶反复多次煮沸,只把表层烫一下便食用,直接生冷地大口灌下
226047,226,装盘,为保证食客满意呈上鲜能剂前最后应检查什么？,确认温度适口且摆盘整洁,大致扫一眼便端走,完全不检查直接上桌,把掉在地上的捡回盛上
226048,226,装盘,长期保存鲜能剂时较合适的存放环境是？,阴凉干燥且避光的储藏处,潮湿温热的墙角,阳光直射的窗台,滚烫的炉灶旁边
