cid,food_id,stage,question,correct_answer,wrong_answer_1,wrong_answer_2,wrong_answer_3
问题cid,食物id,烹饪阶段,问题内容,正确答案,错误答案1,错误答案2,错误答案3
int,int,str,str,str,str,str,str
0,0,0,1,1,1,1,1
拉特兰圣音汤醇烹饪问题库,,,,,,,
233001,233,备料,制作拉特兰圣音汤醇应优先挑选哪种状态的主料？,新鲜饱满且无磕碰损伤的当季食材,冷冻又解冻过数次的边角料,临近保质期但外观尚可的食材,已经腐烂发黑并散发异味的食材
233002,233,备料,这道浓汤讲究纯净外观所选淡奶油较专业的标准是？,乳脂含量稳定且气味清新的淡奶油,已经轻微分层但尚未变质的奶油,开封放置多日仍未变酸的奶油,结块发黄并散发馊味的奶油
233003,233,备料,为保证浓汤口感细腻熬煮前对根茎类食材的处理应是？,去皮后切成大小均匀的小块利于软化与打浆,保留外皮整颗下锅慢慢炖煮,随意切成厚薄不一的大块,不清洗带着泥土直接投入锅中
233004,233,备料,备料时为后续过滤顺利应预先准备什么器具？,干净的细网筛或纱布,网眼较大的普通漏勺,临时找来的破洞滤网,沾满油渍的旧抹布
233005,233,备料,制作这道偏甜浓汤所用的糖较专业的选择是？,纯度高且无杂质的细砂糖,已经受潮结成硬块的砂糖,边角沾染异味但还能用的糖,混进了沙粒的脏糖
233006,233,备料,熬制汤底所需的高汤理想的状态是？,澄清无浮沫且鲜味饱满的高汤,表面浮着大量油花的浑浊高汤,冷藏多日略有酸味的剩高汤,已经发臭长膜的变质高汤
233007,233,备料,备料阶段对各类食材称量的专业做法是？,按配方精确称量保证比例稳定,凭经验大致抓取不作称量,担心不足而随意多放一些,闭着眼随手乱倒一通
233008,233,备料,想让浓汤色泽纯净挑选食材时应避免什么？,避免选用容易使汤色变暗的深色杂质食材,只要新鲜深色食材也可大量使用,颜色发暗的食材切碎后照常加入,把发霉变色的食材一并放进去
233009,233,备料,备料前对操作台与双手的卫生要求是？,彻底清洗双手并保持台面洁净干燥,只用清水快速冲一下手,不洗手但戴上未消毒的手套,用刚摸过地面的手直接操作
233010,233,备料,为使浓汤更顺滑备料时可预先处理的是？,将块状食材先焯煮或蒸软便于打成细浆,把生硬食材直接丢进汤里慢慢等它化开,只把表面稍微冲洗就整块下锅,把食材冻成冰坨再扔进锅里
233011,233,备料,制作精致浓汤所用牛奶较合适的温度状态是？,提前回温至接近室温减少下锅温差,直接使用刚从冷冻取出的冰碴牛奶,加热到剧烈沸腾后再倒入,使用已经结块发酸的隔夜牛奶
233012,233,备料,备料结束后对食材较合理的摆放是？,按下锅顺序分类摆放并保持清洁,把所有食材混作一堆随取随用,生熟食材不加区分地放在一起,把食材随手丢在沾水的地面上
233013,233,烹饪,熬煮这道浓汤为防止锅底糊化较专业的做法是？,用中小火并持续搅拌锅底,开大火快速烧开后便不再搅动,全程大火并盖紧锅盖焖煮,用喷枪对着锅底猛烧到焦黑
233014,233,烹饪,制作奶油浓汤时奶油较合适的加入时机是？,在汤底熬好后转小火再缓缓加入,一开始就把奶油与冷水一起煮沸,等汤大滚时直接倒入大量奶油,关火许久汤已冷透后才加奶油
233015,233,烹饪,想让浓汤达到细腻顺滑的质地专业上常用什么手法？,用料理棒打成细浆后再过筛,只用勺子用力压碎食材块,把整块食材留在汤里不作处理,用手直接把食材捏成糊
233016,233,烹饪,熬煮过程中浮起的浮沫应如何处理？,及时撇去浮沫保持汤色澄净,把浮沫搅回汤里让它自然融化,不去理会任由浮沫越积越多,用嘴直接把浮沫吹散到锅外
233017,233,烹饪,调整浓汤浓稠度较专业的做法是？,用文火慢慢收汁或适量补入高汤微调,一次性加入大量面粉迅速增稠,直接倒入大量清水稀释到极淡,往锅里扔一块石头让它变稠
233018,233,烹饪,为使奶油充分融合而不油水分离应如何控温？,保持小火并不断搅拌使乳脂均匀乳化,加入奶油后立刻开到最大火猛煮,加奶油后完全不搅拌任其静置,把锅端离炉火直接放进冷冻
233019,233,烹饪,用黄油炒面糊增稠时较专业的做法是？,黄油与面粉小火炒成顺滑面糊再调入汤中,把生面粉直接撒进滚汤里搅拌,把整块黄油丢进汤里等它化开,把整袋面粉直接倒进锅中
233020,233,烹饪,判断浓汤是否熬到位较专业的依据是？,汤体顺滑挂勺且香味充分释放,只看熬煮时间到点就停火,表面一冒泡就立即认定完成,拿尺子量一量汤的深度判断
233021,233,烹饪,熬汤时若发现锅底开始微微发黏应如何补救？,立即转小火并轻轻刮起锅底搅匀,继续保持大火快速收干,不作处理等它自己恢复,直接往锅里倒满冷水冲走
233022,233,烹饪,想保留食材鲜甜风味熬煮火候的原则是？,以小火慢熬避免长时间剧烈沸腾,全程猛火快煮以缩短时间,反复大滚以逼出更多味道,直接用微波炉高火轰熟
233023,233,烹饪,过滤浓汤以求口感细腻较专业的步骤是？,趁温热用细筛多次过滤去除颗粒,等汤完全冷却凝固后再勉强过滤,只用大孔漏勺草草过一遍,用沾满灰尘的破布随意滤一下
233024,233,烹饪,熬煮这道含奶含糖浓汤时尤其要警惕什么？,糖与乳脂受热易焦糊故需勤搅控温,奶糖含量高反而越煮越不易糊,只要火够大就完全不会糊锅,糊不糊全凭运气与火候无关
233025,233,调味,这道浓汤主打甜润调甜时较专业的做法是？,分次少量加糖边尝边调至甜度平衡,按最大估量一次性把糖全部倒入,凭感觉一勺接一勺地猛加,把整袋糖直接倒进锅里
233026,233,调味,想让甜味更有层次专业上常搭配什么？,少量香草荚或香草精提升甜香层次,大量重口的辣椒粉强行盖味,多种浓烈香料一起厚厚撒入,滴入几滴机械润滑油增香
233027,233,调味,调味时若浓汤偏甜腻较专业的平衡手法是？,加入极少量盐衬托并提亮甜味,继续大量加糖让它变得更甜,倒入半瓶醋强行压住甜腻,挤入一管牙膏中和味道
233028,233,调味,用盐为这道甜汤调味的专业原则是？,极少量提味为主切忌喧宾夺主,按咸汤的标准大量放盐,一次放足再看情况补加,把盐换成等量的洗衣粉
233029,233,调味,想增添奶香的圆润感调味时可如何处理？,收尾时拌入一小块黄油增加顺滑奶香,倒入大量植物油增加油润,厚厚撒上一层奶粉不作搅拌,抹入一勺凝固的蜡油
233030,233,调味,为这道精致甜汤调味较稳妥的顺序是？,先尝原味再决定糖盐与香料的增减,不尝味就把所有调料一次加足,把全部调料混合后一股脑倒入,闭着眼随意往锅里乱撒
233031,233,调味,想为浓汤增添一丝清新的香气可加入什么？,极少量柑橘皮屑提香而不夺味,大量蒜末压过原本的甜香,几大勺浓酱油改变汤色,挤入一管护手霜调味
233032,233,调味,调味后发现甜味不足较合理的补救是？,再少量补糖并搅匀后重新品尝,一次性倒入双倍分量的糖,直接把整块糖砖丢进去,倒入一整瓶蜂蜜泡着不管
233033,233,调味,为保持纯净风味调味所用的香料应是？,干燥洁净且香气纯正的新鲜香料,已经受潮结块但还能用的香料,香气变淡的多年陈旧香料,混进了灰尘与杂物的脏香料
233034,233,调味,想让甜汤口感更醇厚调味时可少量加入什么？,少许淡奶油提升醇厚顺滑度,大量清水把味道冲淡,满满一勺粗盐增加咸度,挤入一团肥皂泡沫
233035,233,调味,这道甜汤整体调味追求的核心原则是？,甜润适口并保持食材本味的纯净,把各种调料尽量都加进去,口味调得越浓越重越好,加到甜得发齁难以下咽为止
233036,233,调味,调味完成后上桌前对味道的专业检查是？,取少量复尝确认甜咸香平衡无误,大致闻一下香味便算合格,完全不尝就直接端去上桌,把掉在地上的料舀回锅里再尝
233037,233,装盘,这道精致浓汤较合适的盛器是？,干净温热的精致汤盏,沾着上一道菜残渣的脏碗,边缘已经磕出缺口的旧碗,随手捡来的破瓦罐
233038,233,装盘,盛汤前对盏具较专业的预处理是？,提前温热盏具以保持汤温,直接使用刚从冷柜取出的冰冷盏,用冷水冲一下便立即盛汤,用沾油的抹布随便擦一擦
233039,233,装盘,想让浓汤卖相纯净盛装时应注意什么？,缓缓注入避免溅起留下汤渍,高高举起猛地倒入溅得到处都是,倒满至边缘溢出也不在意,随意泼洒弄得满桌都是
233040,233,装盘,为这道甜汤点缀提升美感较专业的做法是？,表面点缀少许奶油花或薄荷叶,在汤面厚厚铺满杂乱的配料,随手撒上一把未经处理的干料,在汤里插一根铅笔当装饰
233041,233,装盘,盛装这道浓汤的分量应如何把握？,盛至盏容量七八分满显得精致,盛到满溢出边缘为止,只盛浅浅一层显得空荡,堆出高高一座快要塌的汤山
233042,233,装盘,想突出浓汤顺滑质感上桌时机应是？,趁温热及时盛装尽快端上,放凉结皮后再慢慢端出,完全冷却凝固后才上桌,搁置一整天后再端上来
233043,233,装盘,装盘后盏沿沾有汤渍应如何处理？,用干净纸巾轻轻擦净盏沿,留着汤渍不去理会便上桌,用手指直接抹到一旁,把汤渍涂得满盏都是
233044,233,装盘,想为这道甜汤搭配增添风味较精致的做法是？,另以小碟配上一两块精致点心,把点心直接丢进汤里泡着,把各种零食胡乱堆在盏边,把吃剩的残渣摆在盘上
233045,233,装盘,这道浓汤摆盘配色较协调的搭配是？,纯净汤色配以清雅的浅色器皿,搭配花纹杂乱刺眼的脏旧碗,旁边堆放颜色发暗的剩菜,往汤里滴入鲜艳颜料调色
233046,233,装盘,为保持纯净外观浮在汤面的浮沫应如何处理？,盛装前撇净浮沫保持汤面光洁,留着浮沫照常盛入盏中,把浮沫搅散后混进汤里,用嘴吹得浮沫满桌乱飞
233047,233,装盘,成品端上桌前最后应确认什么？,确认盏面整洁汤色纯净无瑕,大致扫一眼便匆匆端走,完全不检查就直接端上桌,把掉在地上的点心捡回盏中
233048,233,装盘,选用盛汤盏具大小时较合适的是？,选用与分量相称的精致盏,用偏小的盏勉强挤满,用过大的盏显得汤量稀少,用裂口漏汤的破盏盛放
