cid,food_id,stage,question,correct_answer,wrong_answer_1,wrong_answer_2,wrong_answer_3
问题cid,食物id,烹饪阶段,问题内容,正确答案,错误答案1,错误答案2,错误答案3
int,int,str,str,str,str,str,str
0,0,0,1,1,1,1,1
炎国荒地菜肉酮烹饪问题库,,,,,,,
238001,238,备料,处理兽肉切片时刀应沿哪个方向下刀更易嫩滑？,垂直于肌肉纹理逆纹切断,顺着肌肉纹理平行下刀,沿纹理斜四十五度顺切,顺着案板木纹随意乱切
238002,238,备料,这道菜要求兽肉切成什么样的厚度较为合适？,均匀的薄片便于快速断生,切成大块厚墩以求扎实,厚薄不一随手切开即可,用手把肉胡乱撕成碎泥
238003,238,备料,为锁住兽肉水分给薄片上浆时较合适的做法是？,加少许盐与淀粉抓匀上浆,只浇一勺清水草草拌一下,直接裹满厚厚一层干面粉,抹上一层鞋油腌着
238004,238,备料,清洗荒地野菜时正确的做法是？,流水冲洗并去除泥沙杂质,只在表面随手抖一抖灰,放进温水里长时间泡软,用洗洁精反复揉搓菜叶
238005,238,备料,荒地野菜带有涩味时焯水的合适方式是？,沸水快速焯烫后迅速过凉,放进冷水里长时间慢煮,完全不焯直接下锅生炒,扔进炭火里烧焦去涩
238006,238,备料,挑选用于这道菜的兽肉时较合适的部位是？,纤维细嫩适合快炒的瘦肉,筋膜厚重的硬韧部位,带大块肥膘的边角料,已经发黏变味的腐肉
238007,238,备料,冷冻兽肉解冻较为稳妥的方法是？,冷藏室低温缓慢解冻,直接放进滚水里烫开,置于灼热灶台旁催化,拿去烈日下暴晒一天
238008,238,备料,处理生兽肉与野菜时砧板应如何安排？,生熟食材分别使用不同砧板,生肉切完不洗接着切菜,把肉和菜叠在一处一起切,直接蹲在地板上切肉切菜
238009,238,备料,薄片上浆后短暂静置的目的是什么？,让浆汁均匀附着锁住水分,使肉片尽快彻底脱水,让淀粉沉底与肉分离,等浆汁长出霉点再用
238010,238,备料,野菜焯水过凉后下锅前应先做什么？,挤干或沥净多余水分,带着大量水直接倒入锅,堆在一旁敞放至发蔫,用吹风机对着菜叶猛吹
238011,238,备料,为兽肉去除腥味备料时可加入什么？,少许姜丝或料酒抓拌,用大量清水反复浸泡,加一勺白糖盖住腥味,滴几滴煤油去腥
238012,238,备料,备齐这道快炒料理的食材后下锅前应保证什么？,肉浆菜料分类摆好随取随用,所有材料堆在一处慢慢找,把生熟食材混放同一盆,把食材随意丢在地上待用
238013,238,烹饪,快炒兽肉片下锅前对锅的处理较合适的是？,先把锅烧热再下油滑锅,冷锅冷油直接放入肉片,锅未热便倒入大量凉油,往锅里加满清水来煮肉
238014,238,烹饪,这道翻炒料理对火候的要求通常是？,旺火高温快速翻炒,全程小火慢慢煨炖,中途忽大忽小反复变火,把锅端离火用嘴吹熟
238015,238,烹饪,上浆的薄肉片下锅时为避免粘连较好的做法是？,热油滑散使肉片迅速分开,一次倒入后久不翻动,堆成一团压在锅底闷,把肉片逐片贴在锅壁烤
238016,238,烹饪,兽肉与野菜同炒时较合理的下锅顺序是？,先滑炒肉片再下野菜同炒,先把野菜炒烂再放肉,肉菜一同倒入锅中乱炒,把生肉生菜端上桌等它自己熟
238017,238,烹饪,旺火翻炒时为使受热均匀手法应如何？,持续快速翻动让食材均匀受热,放下后长时间不去理会,只翻表面一层任底层焦,用扇子对着锅猛扇代替翻炒
238018,238,烹饪,想让兽肉片保持滑嫩锁住肉汁的关键是？,高温短时快速断生即出,长时间持续煸炒到干硬,反复多次回锅加热,把肉片埋进米堆里焐熟
238019,238,烹饪,焯过水的荒地野菜入锅翻炒的时间应如何把握？,快速翻炒至断生即可,长时间炒到软烂出水,只用余温焐一焐就出锅,把野菜炒成灰烬再起锅
238020,238,烹饪,判断兽肉薄片是否炒至断生的合适依据是？,肉色由红转白略带光泽,仅凭下锅秒数机械计时,等到肉片完全焦缩发硬,贴着耳朵去听锅中声响
238021,238,烹饪,滑油后锅中油偏多时较合适的处理是？,适当撇去多余油脂再炒,任由大量余油留在锅中,再额外补倒一勺新油,用纸巾把锅里连菜带油全擦掉
238022,238,烹饪,快炒过程中为防止食材外溢颠锅时应注意什么？,幅度适中让食材均匀翻转,用力过猛把食材甩出锅,只在一侧反复颠动,把整口锅高高抛向空中
238023,238,烹饪,这道快炒菜较合适的出锅时机是？,肉断生菜脆嫩时及时起锅,继续久炒到汤汁收干发柴,等食材凉透后再出锅,把炒好的菜倒回冰箱冻硬再端
238024,238,烹饪,这道料理强调高温快炒的主要原因是？,锁住水分保持鲜嫩口感,让食材表面尽快焦化变黑,使肉片彻底脱水变硬,好让锅里的菜自己飞出去
238025,238,调味,炎国菜肉酮以何种味型为基调较为常见？,咸鲜为主突出食材本味,以浓重的甜腻为主,以极酸刺激为主导,以满口苦涩为基调
238026,238,调味,快炒料理加盐调味较合适的时机通常是？,临近出锅前下盐快速翻匀,食材刚下锅时一次放足,炒到一半反复多次添加,把盐撒在桌上让菜自己沾
238027,238,调味,想提升这道菜的鲜味较稳妥的做法是？,借助肉本身与少许提鲜料,大量倾倒味精盖过本味,加一整勺白糖来增鲜,挤入一管牙膏调味
238028,238,调味,这道菜把握盐的用量时较合理的原则是？,少量分次边尝边调整,凭感觉一次性多放,担心不咸而加倍投放,往菜里倒一瓶香水提味
238029,238,调味,若想让菜肉酮的汤汁更浓挂可适当如何处理？,淋入少许水淀粉勾薄芡,直接倒大量生粉搅成糊,加满满一碗清水稀释,倒进一勺胶水增稠
238030,238,调味,为这道炒菜增添香气较合适的是？,起锅前点少许香油或葱姜,泼上大量浓烈的香精,加一把陈年受潮的香料,滴几滴机油提香
238031,238,调味,关于炎国菜肉酮甜咸之争调味时较稳妥的做法是？,依据食客口味适度调整咸甜,无论如何都加大量糖,一律调到极咸才算正宗,甜咸都加到难以入口
238032,238,调味,想为成菜增添红亮色泽可少量加入什么？,适量酱油上色提味,大量老抽染到发黑,倒入一整瓶生抽,用红墨水把菜汁染红
238033,238,调味,若野菜仍残留些许涩味调味时可如何中和？,以咸鲜与少许鲜味加以调和,再额外多加一些苦味料,大量加醋盖住涩味,往菜里撒一把沙子压涩
238034,238,调味,这道快炒菜调味后较好的确认方式是？,起锅前先尝味再微调,完全凭经验从不尝试,装盘上桌后才发觉味道,蒙上眼睛随便乱加一通
238035,238,调味,菜肉酮强调提取食材精华调味时应注意什么？,调味适度不掩盖肉菜本鲜,用浓味彻底压过原味,加入尽量多的重口调料,把所有调味料一股脑倒入
238036,238,调味,临近收尾时为使味汁裹匀食材较合适的做法是？,旺火快速收汁使味汁挂匀,加水稀释让汤汁变稀,长时间熬煮到完全干锅,把整锅菜倒进水池冲一冲再装
238037,238,装盘,这道旺火快炒的菜肴装盘时机较合适的是？,趁热及时盛盘上桌,放凉许久后再装盘,等彻底冷透才盛出,搁置一整天后再端出
238038,238,装盘,盛放菜肉酮的盘子在装盘前应保持什么状态？,洁净干燥无水渍异味,冲洗后还带着水珠就用,残留上一道菜的余渍,用刚擦过地的抹布抹一下就用
238039,238,装盘,装盘时若盘底积聚过多油汁较合适的处理是？,适当沥去多余油汁再摆盘,任由油汁汪满整个盘子,再额外淋上一大勺油,把整盘油汁泼到地上再摆菜
238040,238,装盘,为突出这道菜的卖相配色上较协调的是？,焦香肉片配翠绿野菜相衬,整盘只见单一暗沉颜色,旁边堆放发黑的剩料,用颜料给菜品胡乱上色
238041,238,装盘,菜肉酮装盘时食材的摆放较好的方式是？,堆放有形使肉菜分布均匀,胡乱倒扣在盘子中央,压成扁平一摊铺满盘底,随手甩在盘边任其散落
238042,238,装盘,想为成品略作点缀装盘时较合适的是？,撒少许葱花或香菜提色,在菜上随意插一根筷子,撒上大把干辣椒堆成堆,在盘里放一块小石子
238043,238,装盘,为这道主食装盘时分量的把握应如何？,盛放适量摆放整齐美观,尽量堆满到快要溢出,只摆薄薄一层显得寒酸,垒成摇摇欲坠的高塔
238044,238,装盘,盛装这道快炒菜选择盘具时较合适的是？,选用与分量相称的浅盘,用过小的碟子勉强堆放,用极深的大碗盛少量菜,用破口漏汤的旧盘盛放
238045,238,装盘,菜品端上桌前最后应做的检查是？,确认摆盘整洁味型到位,匆匆一瞥便端走上桌,完全不查直接送出,把掉到桌上的菜捡回盘中
238046,238,装盘,为这道炎国家常菜搭配餐具上桌较合适的是？,配上洁净的筷子与餐盘,只摆一只脏污的旧勺,什么餐具都不去准备,递上一把生锈的工具
238047,238,装盘,快炒菜讲究锅气装盘后为保持风味应如何？,尽快趁热端给食客享用,先晾在一旁放凉再端,盖严焖置许久才上桌,端到窗外吹一夜冷风再上
238048,238,装盘,想呈现菜肉酮提取的精华汤汁装盘时可如何处理？,将浓香味汁均匀浇淋于食材,把味汁全部倒掉只留干料,任味汁四处流淌满桌,把味汁灌进瓶子当饮料端上
