cid,food_id,stage,question,correct_answer,wrong_answer_1,wrong_answer_2,wrong_answer_3
问题cid,食物id,烹饪阶段,问题内容,正确答案,错误答案1,错误答案2,错误答案3
int,int,str,str,str,str,str,str
0,0,0,1,1,1,1,1
正圆月烹饪问题库,,,,,,,
36001,36,备料,制作正圆月时较合适的云腿火腿应如何挑选？,选用肥瘦相间气味醇正的优质宣威火腿,挑选几乎全是瘦肉的火腿部位,选用边角略干但尚能用的火腿,捡来已经发黏变臭的霉变火腿
36002,36,备料,云腿口味偏咸时备料阶段较好的去咸处理是？,切块后焯水或浸泡以减去部分盐分,直接原样使用不作任何处理,再额外撒上一层盐继续腌渍,泡进满是泥沙的脏水里
36003,36,备料,处理云腿火腿馅时火腿通常应切成什么状态？,切成大小均匀的小丁,留作整块直接包入饼中,胡乱剁成稀烂的肉泥,连骨带肉整条塞入
36004,36,备料,云腿月饼馅料中用于吸附油脂的熟粉应如何准备？,把面粉用小火炒熟炒香备用,直接使用未经处理的生面粉,把面粉用水调成稀面糊,抓一把受潮结块的霉面粉
36005,36,备料,制作酥皮所需的猪油较理想的状态是？,室温下软化至膏状方便揉和,刚从冷冻室取出的坚硬油块,已经哈喇变味的陈年猪油,混进了沙石的脏油渣
36006,36,备料,准备制作水油皮时需要备齐的基础材料是？,面粉猪油清水与少许糖,只用面粉和清水即可,单纯一团干面粉就够,把面粉换成等量的沙土
36007,36,备料,制作油酥时较为正确的用料组合是？,面粉与猪油按比例搓和,面粉加入大量清水调和,只用清水不加任何油脂,用泥巴代替面粉搓团
36008,36,备料,云腿馅讲究咸甜适口备料时常搭配什么来平衡咸味？,适量的白糖与蜂蜜,再加上一大把食盐,大量的酸味白醋,一整瓶机械润滑油
36009,36,备料,开酥用的擀面杖与案板使用前应保证什么？,干净干燥没有残留杂质,只用湿抹布草草擦一下,沾着上次的面渣继续用,糊满油污和厚厚灰尘
36010,36,备料,若要在烤前为饼面增色备料时可准备什么？,新鲜鸡蛋取出蛋黄打散,放置多日已变质的鸡蛋,捡来破壳渗液的坏蛋,用颜料兑水冒充蛋液
36011,36,备料,为使酥皮细腻面粉在备料时较好的处理是？,过筛去除结块与杂质,直接倒出整袋不作处理,故意混入一些粗砂,掺进碾碎的小石子
36012,36,备料,备料时对各种材料用量较稳妥的做法是？,按配方比例称量取用,全凭手感随意抓取,担心不够而成倍多取,把所有材料全倒进盆里
36013,36,烹饪,揉制水油皮时面团达到怎样的程度较为合适？,揉至光滑柔软并能拉出薄膜,稍微成团仍带干粉即可停手,只随意搅拌几下就拿去用,揉到面团发黑发臭为止
36014,36,烹饪,制作油酥面团时较正确的操作是？,将面粉与猪油充分搓擦均匀成团,只把两者轻轻一碰就分开,加入大量清水搅成稀糊,用力摔打到四处飞溅
36015,36,烹饪,水油皮与油酥分别和好后通常应如何处理？,盖上湿布静置松弛片刻,立刻拿来用力擀压开,放进冰箱冷冻至完全变硬,敞着放任其风干开裂
36016,36,烹饪,正圆月酥皮的开酥关键在于如何处理两种面团？,用水油皮包住油酥再擀卷成层,把两团面随意揉成一整团,只用水油皮完全不放油酥,把油酥单独烤成一块饼
36017,36,烹饪,为形成层层松脆的酥皮擀卷时较好的做法是？,擀成长片后卷起再重复一两次,只草草擀一下就立刻包馅,反复擀压几十次直到出筋,把面团擀穿成一张破网
36018,36,烹饪,把云腿馅包入酥皮时应注意什么？,收口捏紧避免漏馅露底,随手一捏留着一个大口,把馅料堆在酥皮外面,捏成漏底的破皮再包
36019,36,烹饪,正圆月入炉前对烤箱较合适的处理是？,提前预热到所需温度,冷炉直接放入生坯,边烤边随意调高调低温度,根本不开火就空放着
36020,36,烹饪,烘烤云腿月饼时较为合适的火候是？,中高温烘烤至表面焦黄,全程超高温把表面烤成炭,始终用极低温几乎烤不熟,用明火直接灼烧饼面
36021,36,烹饪,判断正圆月是否烤好较可靠的方法是？,观察表面呈均匀焦黄且酥皮定型,只看计时器一到点就取出,凭烤箱发出的声响来判断,隔着高温直接用手去摸饼心
36022,36,烹饪,烘烤过程中火候过大容易导致什么问题？,表皮焦糊而内馅尚未热透,饼坯始终雪白迟迟不上色,酥皮层次反而格外分明,月饼凭空消失不见踪影
36023,36,烹饪,为避免酥皮在烘烤时破裂露馅可以怎么做？,包馅时收口严实并适度松弛,把酥皮尽量擀得越薄越好,在饼面上多戳几个大洞,用力把饼坯拍扁压瘪
36024,36,烹饪,云腿月饼出炉后较合适的处理是？,移至晾架上自然冷却,趁滚烫立刻堆叠在一起,留在烤箱里继续高温焖着,直接浇上冷水强行降温
36025,36,调味,正圆月的云腿馅追求怎样的风味基调？,咸甜适中突出火腿醇香,一味追求咸到发苦,调得越甜腻越好,弄成又苦又辣的怪味
36026,36,调味,调配云腿馅时若火腿偏咸较好的补救是？,适当增加糖量并减少火腿用量,再加入更多的食盐,直接淋上一大勺生抽,倒进半瓶老陈醋
36027,36,调味,云腿馅中加入蜂蜜主要起到什么作用？,增添润泽与回甜并调和咸味,让馅料变得又干又硬,使味道变得发酸发涩,把馅料染成刺眼颜色
36028,36,调味,由于云腿本身含盐调味时对食盐应如何把握？,基本无需另加盐或仅放极少量,照常按普通菜肴加足盐,再额外多放上好几勺盐,把整罐盐都倒进去
36029,36,调味,调节云腿馅干湿与黏合度较合适的做法是？,适量加入熟面粉与猪油拌匀,直接倒入大量清水稀释,加进满满一碗酱油汤,掺入细沙增加分量
36030,36,调味,想让云腿馅咸甜更融合调味时较好的顺序是？,先尝火腿咸度再决定加糖多少,把所有糖盐一次全部倒入,完全不尝味全凭感觉乱加,闭着眼随手抓料胡乱拌
36031,36,调味,为云腿馅增添少许风味可适量搭配什么？,一点点炒香的芝麻或核桃碎,大量辛辣的生姜碎末,满满一勺浓重的五香粉,挤入一整管牙膏
36032,36,调味,调味后发现云腿馅味道偏淡较稳妥的补救是？,少量补加糖或蜂蜜后再尝,一次性倒入大量调料,把整团馅泡进浓汤里,浇上一瓶白醋盖住味道
36033,36,调味,猪油在云腿馅调味中的作用主要是？,增添油润与酥香口感,让馅料逐渐发酸变味,使味道变得苦涩难咽,把馅料凝结成硬块
36034,36,调味,云腿月饼调味用的糖较合适的状态是？,干燥洁净没有受潮结块,已经潮解成湿团的糖,混进了灰尘的脏糖,长出霉斑的变质糖
36035,36,调味,为突出云腿月饼的层次风味整体调味应把握什么？,咸甜协调而不掩盖火腿本味,把各种香料尽量都加进去,口味越浓重刺激越好,加到齁咸难以下咽为止
36036,36,调味,若想搭配饮品衬托云腿月饼的咸甜较合适的是？,一杯清淡的热茶,一大杯浓烈的烈酒,满满一杯加冰汽水,一碗滚烫的辣汤
36037,36,装盘,正圆月烤好后较合适的装盘时机是？,稍稍晾凉至酥皮定型后再装盘,趁着滚烫就直接装盘端走,放置好几天后再端出,等到完全发霉再装盘
36038,36,装盘,盛放正圆月的盘子使用前应保持什么状态？,干净整洁没有水渍油污,冲洗后还残留少量水珠,沾着上一道菜的残渣,糊满污垢和厚厚灰尘
36039,36,装盘,想展示正圆月酥皮层次时较好的处理是？,切开一个露出层层酥皮与云腿馅,把月饼整个压扁再摆盘,把酥皮全部剥掉只留馅,捏成一团烂泥放上去
36040,36,装盘,切开正圆月展示断面时较为合适的工具是？,干净锋利的刀,略微发钝的旧刀,刚切过生肉未洗的刀,生锈卷刃的破刀
36041,36,装盘,把正圆月摆入盘中时应注意什么？,焦黄饼面朝上摆放整齐,随意正反堆叠在一起,把饼面朝下盖住卖相,歪斜地挤在盘子一角
36042,36,装盘,为衬托正圆月的中式风味装盘时可搭配什么？,一旁配上一壶清茶,旁边淋上一圈番茄酱,堆满色彩浓艳的奶油,撒上一把咸菜疙瘩
36043,36,装盘,装盘时正圆月的分量应如何把握？,摆放整齐看起来适量得体,尽量铺满整个大盘子,只摆一两块显得空荡,堆成快要坍塌的高塔
36044,36,装盘,装盘后若盘边沾有酥皮碎屑应如何处理？,用干净纸巾轻轻擦净,留着碎屑暂时不去理会,用手指抹到盘子另一边,吹得满桌都是碎屑
36045,36,装盘,为正圆月装盘选择盘子大小时较合适的是？,选用与分量相称的盘子,用偏小的盘子勉强塞下,用过大的盘子显得空旷,用破口的脏盘子盛放
36046,36,装盘,装盘配色上能更好衬托焦黄酥皮的搭配是？,以素净浅色的盘子相衬,选用同样焦黄色的盘子,旁边堆放发暗的剩菜,给饼面涂上鲜艳颜料
36047,36,装盘,正圆月端上桌前最后应检查什么？,确认摆盘整洁且月饼完好,只大致扫一眼便端走,完全不看就直接上桌,把掉在地上的饼捡回盘中
36048,36,装盘,为保持正圆月酥皮松脆的口感装盘后较好的做法是？,尽量趁酥脆时及时享用,长时间敞放任其回潮,密封闷在热气里捂软,泡进汤水里再端上桌
