cid,food_id,stage,question,correct_answer,wrong_answer_1,wrong_answer_2,wrong_answer_3
问题cid,食物id,烹饪阶段,问题内容,正确答案,错误答案1,错误答案2,错误答案3
int,int,str,str,str,str,str,str
0,0,0,1,1,1,1,1
羔岩羊腿肉披萨烹饪问题库,,,,,,,
58001,58,备料,选用羔羊腿肉时较为合适的是？,色泽红润气味清淡的新鲜羔羊腿肉,略带血水但仍算新鲜的羔羊腿肉,反复冷冻又解冻多次的羔羊腿肉,已经发臭长毛的腐烂羊腿肉
58002,58,备料,处理羔羊腿肉去除膻味较有效的做法是？,加入葱姜料酒浸泡腌制去腥,只用清水反复冲洗后沥干,撒上少许食盐静置一会即可,把羊肉泡进汽油里去味
58003,58,备料,披萨饼底面团揉好后较合适的处理是？,盖上湿布静置发酵至膨胀松软,立刻擀开直接铺料使用,直接放进冷冻室冻成硬块,把面团扔进油锅里油炸
58004,58,备料,制作披萨饼底所用的面粉较合适的是？,筋度较高的高筋面粉,普通家用的中筋面粉,筋度很低的低筋面粉,已经结块发霉的陈面粉
58005,58,备料,羔羊腿肉切配前应如何处理表面筋膜？,用刀仔细剔除多余筋膜与肥油,保留全部筋膜一起切片,只去掉表面一点点浮油,连骨头带皮整块剁碎
58006,58,备料,备料时为保证卫生首先应当做什么？,洗净双手并清洁案板与刀具,只用抹布随手擦一下案板,戴上手套却不清洗双手,用刚摸过地面的脏手直接处理
58007,58,备料,准备披萨用的芝士时较合适的选择是？,选用易融化拉丝的马苏里拉芝士,选用偏硬难化的帕玛森芝士块,随手拿一种家里现成的芝士,用已经发酸结块的变质芝士
58008,58,备料,羔羊腿肉切片时较为合适的方式是？,逆着肌肉纹理切成均匀薄片,顺着肌肉纹理切成厚块,随手切成大小不一的碎块,整条羊腿不切直接摆上
58009,58,备料,准备披萨配料用的蔬菜时应如何处理？,洗净沥干后再切成合适大小,不清洗直接拿来切配,切好后长时间敞放在一旁待用,直接用没洗的带泥蔬菜铺面
58010,58,备料,发酵披萨面团时较为适宜的环境是？,温暖湿润约二十八度左右,偏凉的低温室内角落,直接放进冰箱冷藏室里,放在炉火上炙烤的高温处
58011,58,备料,准备披萨番茄酱底时较合适的做法是？,用新鲜番茄熬煮成浓稠酱底,直接用生番茄切片当酱底,用清水大量稀释的稀番茄汁,用过期变质的番茄罐头
58012,58,烹饪,正式烤制披萨前烤箱应如何处理？,提前充分预热到所需高温,冷箱放入披萨后再开始升温,只随意预热一两分钟就放入,根本不开烤箱室温放着
58013,58,烹饪,烤制羔羊腿肉披萨较为合适的炉温是？,二百度以上的高温环境,一百度左右的偏低温度,一百五十度的中等温度,只有室温的二十几度
58014,58,烹饪,擀制披萨饼底时较合适的厚度是？,中心稍薄边缘略厚且均匀,整体擀得越厚实越好,中心很厚而边缘极薄,薄得几乎透光一戳就破
58015,58,烹饪,铺放披萨配料的顺序较为合适的是？,先抹番茄酱底再铺羊肉与芝士,先铺满芝士最后才抹酱底,把所有配料一股脑倒上去,先把饼底烤熟再铺上生肉
58016,58,烹饪,判断羔羊腿肉是否烤熟可观察什么？,肉色转白且没有血水渗出,只凭烤制的时间长短判断,看饼底颜色来推测肉的熟度,直接生啃一口羊肉来判断
58017,58,烹饪,高温烤制时如何避免披萨饼底烤糊？,留意上色情况及时调整时间,全程开到最高温从不查看,一直烤到表面焦黑才取出,离开厨房几个小时再回来看
58018,58,烹饪,想让披萨芝士融化拉丝烤制时应注意什么？,高温烤至芝士融化金黄微微冒泡,低温慢烤让芝士缓缓变软,中途频繁开门反复查看,一直烤到芝士全部焦化成黑壳
58019,58,烹饪,烤制过程中披萨上色不均应如何处理？,适时把披萨转向使受热均匀,任其继续烤不作任何处理,把炉温直接调到最低再慢烤,把披萨取出翻面贴着烤盘烤
58020,58,烹饪,使用烤盘烤披萨前可怎样防止粘底？,垫上一层油纸或刷一层薄油,在烤盘里倒满油浸住饼底,完全不处理直接放上披萨,在烤盘上抹一层洗洁精
58021,58,烹饪,羔羊腿肉片较薄时烤制时机应如何把握？,与披萨一同入炉烤避免过老变柴,提前单独长时间烤干再铺上,等披萨快烤好时才匆忙放上,把肉片铺好后整整烤上一天
58022,58,烹饪,烤制完成取出披萨时应注意什么？,戴上隔热手套小心端出,徒手快速把滚烫烤盘端出,只用一块湿抹布垫着端烤盘,直接用嘴叼着烤盘拿出来
58023,58,调味,腌制羔羊腿肉去膻提香常用的香料是？,迷迭香搭配现磨黑胡椒,浓重的八角与桂皮,大量的麻味花椒粉,撒上一勺洗衣粉
58024,58,调味,给羔羊腿肉腌制调味时盐的用量原则是？,适量为宜避免过咸,尽量多放以确保入味,完全不放盐保持原味,把整袋盐全部倒进去
58025,58,调味,想中和羊肉膻味腌制时可加入什么？,少许料酒与新鲜姜汁,满满一大勺白砂糖,大量食醋长时间浸泡,滴上几滴机械机油
58026,58,调味,披萨番茄酱底调味时较合适的做法是？,加入适量盐糖与香草调和酸味,只放入大量食盐来提味,完全不调味就直接使用,倒入一管牙膏来增味
58027,58,调味,为羔羊腿肉披萨提香较合适的香草是？,少许干燥的牛至或罗勒碎,大量呛人的孜然粉,浓重盖味的咖喱粉,撒上一把彩色颜料
58028,58,调味,调味时若担心芝士本身偏咸应如何处理？,相应减少额外添加盐的用量,照常按平时的分量加盐,再额外多补一些盐提味,把整张披萨泡进盐水里
58029,58,调味,腌制羔羊腿肉较为合适的时间把握是？,腌足够时间让其充分入味,胡乱抓拌几下就立刻使用,腌上好几天放到发臭也不管,完全不腌制直接生肉上炉
58030,58,调味,想让羊肉风味更有层次腌料中可加入什么？,少许橄榄油与蒜末,大量酱油把肉染得发黑,多种重口味酱料一起堆叠,挤入一管护手霜
58031,58,调味,调味所用的各类香料应保持什么状态？,干燥洁净没有受潮结块,已经略微受潮但还能用,气味变淡的陈年旧香料,混进了灰尘的脏香料
58032,58,调味,烤制前在披萨饼边刷调味油较合适的是？,刷上薄薄一层橄榄油增香,厚厚涂上一大坨黄油,从头到尾不刷任何油脂,刷上一层凝固的蜡油
58033,58,调味,这道羔羊腿肉披萨整体调味讲究什么？,突出羊肉鲜香而不掩盖其本味,口味调得越浓重越好,把能用上的调料尽量都加,加到齁咸难以下咽为止
58034,58,装盘,烤好的披萨切分时较合适的工具是？,干净锋利的披萨滚刀,略微发钝的旧菜刀,刚切过生肉还没洗的刀,生锈卷刃的破旧刀
58035,58,装盘,披萨较为合适的切分方式是？,从中心向外均匀切成三角块,横七竖八随意切成碎块,只从正中间切成两大半,先揉成一团再用手撕开
58036,58,装盘,装盘所用的盘子应保持什么状态？,干净整洁没有水渍,用厨房纸简单擦一遍即可,冲洗后仍残留着少量水珠,沾满上一道菜的残渣
58037,58,装盘,想保持披萨芝士拉丝的卖相装盘时机应如何？,趁热及时切分并装盘,稍微放凉一会儿再装盘,等完全冷却后才装盘,放置一整天后再端出
58038,58,装盘,想让羔羊腿肉披萨成品更美观可以怎么做？,在表面点缀少许新鲜罗勒叶,沿盘边淋上一圈橄榄油增加光泽,在旁边摆放几片番茄薄片,在披萨上插一根铅笔当装饰
58039,58,装盘,装盘时披萨切块的摆放应注意什么？,切块整齐摆放展示出配料,随意叠放堆在盘子中央,把切块反扣盖住表面配料,歪歪斜斜堆成一座小山
58040,58,装盘,装盘后若盘边沾有碎屑应如何处理？,用干净纸巾轻轻擦拭干净,留着碎屑暂时不去管它,用手指直接抹到盘子一旁,把碎屑吹得满桌都是
58041,58,装盘,选择盛放披萨的盘子大小时较合适的是？,选用与披萨大小相称的盘子,用偏小的盘子勉强装下,用过大的盘子显得空荡,用破了口的脏盘子盛放
58042,58,装盘,想搭配蘸酱一同上桌较好的做法是？,用小碟另盛蘸酱置于一旁,把蘸酱直接淋在盘底,把蘸酱整勺浇满整张披萨,把蘸酱泼得整盘都是
58043,58,装盘,装盘配色上较为协调的搭配是？,金黄饼底配翠绿香草点缀,整盘搭配同样的浅黄色食材,在旁边堆放颜色发暗的剩菜,用鲜艳颜料给披萨上色
58044,58,装盘,披萨成品端上桌前最后应检查什么？,确认摆盘整洁无明显瑕疵,只大致扫一眼便端走,完全不检查就直接上桌,把掉在地上的食材捡回盘中
