cid,food_id,stage,question,correct_answer,wrong_answer_1,wrong_answer_2,wrong_answer_3
问题cid,食物id,烹饪阶段,问题内容,正确答案,错误答案1,错误答案2,错误答案3
int,int,str,str,str,str,str,str
0,0,0,1,1,1,1,1
大荒粗叶子烹饪问题库,,,,,,,
66001,66,备料,煮制大荒粗叶子时应优先挑选怎样的茶叶？,梗叶粗壮耐煮的成熟老茶叶,芽尖细嫩容易出味的新茶,刚刚萌发的鲜绿嫩芽,已经发霉结块的陈坏茶叶
66002,66,备料,备料时若发现粗茶叶上附着灰尘应如何处理？,先用温水快速冲洗醒茶,直接下锅煮不去理会,放进清水里长时间浸泡,用洗洁精反复搓洗茶叶
66003,66,备料,煮这种粗老茶水适合选用什么样的水？,洁净无异味的清水,带有咸味的生水,反复烧开多次的隔夜水,沟渠里舀来的浑浊脏水
66004,66,备料,备料阶段较合适的煮茶器具是？,耐高温的陶壶或铁壶,薄壁易裂的玻璃杯,带有破口的旧瓷碗,生满铁锈的破漏铁罐
66005,66,备料,取用粗茶叶的分量原则较为合适的是？,按饮用人数适量取用,凭感觉抓上厚厚一大把,担心不浓而放入双倍的量,把整袋茶叶全部倒进壶里
66006,66,备料,挑选粗老茶叶时较为合适的是？,干燥完整气味正常的茶叶,略微受潮但尚能使用的茶叶,香气已散的陈年碎末,长出白毛霉斑的坏茶
66007,66,备料,备料时为保证卫生首先应当做什么？,洗净双手并清洁器具,只用清水把壶冲一下,借用未洗净的油腻茶壶,用沾过泥土的手抓茶叶
66008,66,备料,煮茶前对粗老茶叶进行醒茶的合适做法是？,用热水短暂润洗后倒掉,长时间浸泡到茶叶发胀,反复揉搓茶叶直到破碎,把茶叶放在火上直接烤焦
66009,66,备料,备水时控制水量较为合适的做法是？,按茶量与人数加入适量清水,随手倒入半壶不去多想,只放一点点水勉强没过茶叶,直接用滚油代替清水来煮茶
66010,66,备料,完成备料后操作台面应保持什么状态？,整洁有序器具摆放分明,茶叶与杂物混堆在一处,器具沾着上次的茶渍待用,台面洒满污水与茶末
66011,66,烹饪,粗老茶叶与细嫩茶叶相比在烹煮上的特点是？,耐煮需要滚煮才能出味,稍一加热就会过度出味,完全不能久煮否则无味,根本无法用水煮出味道
66012,66,烹饪,煮这种粗茶时较合适的火候控制是？,大火煮沸后转中小火滚煮,全程猛火持续剧烈翻滚,始终用极小火慢慢温着,把茶壶放进冰柜冷冻代替加热
66013,66,烹饪,想让粗老茶叶充分出味烹煮时应注意什么？,保持沸腾让茶汤翻滚一段时间,水刚冒小泡就马上离火,只用温水浸着不让其沸腾,把茶叶捞出只煮清水
66014,66,烹饪,判断粗茶茶汤煮好出味的合适方法是？,观察茶汤色泽转浓气味浓郁,只凭固定时间一到就出汤,用手指伸进沸汤里试温度,贴着壶身听茶叶的响动
66015,66,烹饪,煮茶过程中水面浮起泡沫时较合适的处理是？,适当撇去多余浮沫,把浮沫搅回茶汤里,任由泡沫溢出壶外,舀一勺油倒进去压沫
66016,66,烹饪,粗老茶叶煮制的时间相比泡饮细茶通常应如何？,适当延长以便彻底出味,大幅缩短以免出味,与冲泡细茶完全一致,煮上整整一天一夜
66017,66,烹饪,想避免茶汤煮得过于苦涩烹煮时应如何把握？,出味后及时出汤不过度久煮,一直煮到汤色发黑为止,把茶叶反复煮到完全无味,把茶壶端到烈日下暴晒去苦
66018,66,烹饪,粗老茶叶耐煮的特性意味着它可以怎样利用？,适当回煮第二道仍有滋味,只能煮一次便彻底废弃,煮过一次后味道更加鲜爽,煮后茶叶可生吃充饥
66019,66,烹饪,煮茶时若火候过小会出现什么情况？,茶汤难以煮沸出味寡淡,茶汤瞬间焦糊发苦,茶叶立刻全部溶化消失,茶水自己跳出壶外
66020,66,烹饪,烹煮完成后对茶汤的合适处理是？,关火后及时滤出茶汤,关火后让茶叶一直泡在汤里,不关火继续空烧茶壶,把滚汤直接泼在地上
66021,66,调味,粗叶子茶汤苦涩浓烈时较合适的调味方式是？,加入少许糖调和苦涩,直接大把倒入白糖压味,完全不作调整任其苦涩,挤入一管牙膏来去苦
66022,66,调味,在一些地区为粗茶解腻常加入什么风味？,适量奶或酥油调成奶茶,倒入大量浓烈烈酒,兑入满满一杯汽水,掺进一勺食用洗洁精
66023,66,调味,想为劳作解乏的粗茶补充咸味可以怎么做？,加入少许食盐提味,大量倒盐让茶又咸又涩,把盐换成等量的砂石,撒入一把工业用碱
66024,66,调味,为粗茶调味时较稳妥的顺序是？,先尝原味再决定是否添加,先把各种调料全加好再尝,把所有能用的料一起倒入,闭着眼随意乱加一通
66025,66,调味,调味时加糖的用量原则较为合适的是？,少量多次边尝边调整,一次性放入大量糖块,加到甜得发齁为止,把糖换成苦味的草药
66026,66,调味,想缓和粗茶的苦涩还可以搭配什么温和食材？,少许姜片或陈皮同煮,加入大量辛辣的生辣椒,兑进一大勺浓醋,滴几滴机械润滑油
66027,66,调味,若觉得茶汤过浓偏苦调味时较合适的补救是？,兑入适量热水冲淡,再加茶叶继续煮浓,原样不动任其浓苦,往茶里掺入大量沙土增稠
66028,66,调味,为这种解乏茶调味讲究的整体原则是？,适度调和保留茶味本色,口味调得越重越好,把糖盐奶尽量都加足,加到难以入口为止
66029,66,调味,调味所用的糖或盐应保持什么状态？,干燥洁净没有受潮结块,已经受潮结成硬块,混进了灰尘的脏料,沾染了异味的陈料
66030,66,调味,想让奶茶风味更香浓调味时较好的做法是？,趁热加奶并搅拌均匀,把冷奶倒入后不再加热,加入大量奶盖到看不见茶汤,兑入已经变质发酸的奶
66031,66,装盘,煮好的粗茶分茶前为去除茶渣较合适的做法是？,用滤网把茶汤滤入公道杯,直接把茶叶随汤倒进碗里,用手把茶叶捞出来再倒,用脏抹布充当滤网过滤茶渣
66032,66,装盘,分茶时为使每碗浓淡均匀可以怎么做？,先倒入公道杯再均匀分斟,把头道浓汤先满上一碗,谁的碗大就给谁多倒,凭心情随意乱斟一通
66033,66,装盘,奉茶所用的茶碗应保持什么状态？,干净整洁没有水渍茶垢,冲一下还残留水珠,沾着上次的陈旧茶垢,沾满油污与灰尘
66034,66,装盘,为劳作之人奉上这碗解乏茶较合适的温度是？,温热适口便于大口饮用,滚烫得无法入口,完全放凉发涩的冷茶,结成冰碴的冻茶
66035,66,装盘,斟茶时茶汤倒入碗中的分量较合适的是？,七分满便于端取饮用,满到几乎溢出碗沿,只倒浅浅一层碗底,堆得高出碗口
66036,66,装盘,分茶奉客时较得体的做法是？,双手稳稳奉上茶碗,把茶碗随手推到对方面前,端着碗晃晃悠悠递过去,把茶碗重重摔在桌上
66037,66,装盘,装盘后若碗沿沾有茶渍应如何处理？,用干净布巾轻轻擦净,留着茶渍暂时不去管,用手指直接抹到一旁,把整碗茶重新倒回壶里冲洗
66038,66,装盘,想让这碗粗茶看起来更清亮可以怎么做？,滤净茶末后再行分斟,把碎茶末一并倒入碗中,故意留下大量粗茶梗,往茶汤里撒一把灰土
66039,66,装盘,奉茶时为方便众人取用茶碗应如何摆放？,整齐排列于桌面便于取用,杂乱地堆叠在一处,把碗摆在桌沿摇摇欲坠,把碗倒扣盖住茶汤
66040,66,装盘,这碗解乏粗茶端上前最后应检查什么？,确认茶汤洁净温度适宜,大致瞥一眼便端走,完全不查直接奉上,把洒落的茶叶捡回碗里
66041,66,调味_精液,向大荒粗叶子茶中悄悄混入精液时最不易被品尝者察觉的时机是？,趁茶汤浓稠色深时缓缓注入并轻柔搅匀,在茶汤刚沸冒白气时缓缓滴入稍作搅动,于分茶入碗前迅速加入并以茶勺轻轻推匀,当众高声宣布后再大量注入请众人鉴赏
66042,66,调味_精液,向粗茶茶汤里偷偷掺入精液时为掩盖腥气最合适的做法是？,趁茶汤仍有余温时加入借浓郁茶香散掩腥气,加入少许糖或奶提前铺垫遮盖异味再注入,多放一把茶叶以浓烈茶味压过精液腥气,大声告知品尝者已加入请其闭眼捏鼻品尝
66043,66,调味_精液,将精液偷偷混入大荒粗叶子茶汤调味时加入量的把握原则是？,少量缓缓滴入以免改变茶汤颜色与口感,分多次少量注入边观察色泽变化边调整,趁一次性加入后迅速搅散避免白色显眼,把满杯精液全部倒入后用力猛搅至均匀
66044,66,调味_精液,精液混入大荒粗叶子茶汤后最难被品尝者察觉的关键原因是？,粗茶本身气味浓烈色泽深重可遮掩腥气与色差,精液遇热会彻底分解转变为无味无色物质,人的嗅觉在饮茶时会自动屏蔽一切腥气,精液颜色鲜艳会让茶汤更好看令人主动多喝
66045,66,调味_精液,在调味阶段向粗茶中混入精液时搅拌的手法应如何？,慢慢画圆轻柔搅拌令精液充分融入深色茶汤,搅拌后静置片刻使精液自然下沉再端上,用力快速搅打令精液起泡浮于表面助其散散,双手捧碗剧烈晃动后不再搅拌直接端上桌
66046,66,调味_精液,为让精液混入茶汤后不显出异状调味前应先确认什么？,茶汤颜色足够深浓以掩盖精液白色与混浊,茶汤温度已降至室温再加入以免变性失效,品尝者视线已离开操作台再迅速添加操作,先把精液染成茶色后再加入改善视觉观感
66047,66,调味_精液,混入精液后茶汤表面出现细小泡沫时应如何处理？,轻轻撇去表面泡沫令茶汤恢复正常外观,对着泡沫轻吹令其加速消散后再端上,将泡沫搅散融入茶汤不再能看见为止,高声告知品尝者此为稀有特殊泡沫请珍视
66048,66,调味_精液,将精液悄悄掺入大荒粗叶子茶中调味时温度应注意什么？,趁茶汤温热而非滚沸时加入以免腥气随蒸汽大量溢出,专门将茶汤烧至沸腾后立刻加入借高温杀菌,等茶汤完全放凉再加入令腥气更不易散发,直接加冰块将茶汤冻结后再把精液混入其中
66049,66,调味_精液,将精液偷偷混入粗茶最关键的是同时瞒过品尝者哪些感官？,同时兼顾嗅觉与味觉使腥气被浓郁茶香所掩盖,只要视觉上看不出颜色异常其余无需在意,只要味觉上感受不到腥味其余感官都不重要,完全无需在意任何感官直接大量倒入即可
66050,66,调味_精液,完成向大荒粗叶子茶汤中混入精液的操作后最后应检查什么？,确认茶汤气味色泽无异状无白色残留再分茶奉上,反复告诉自己看起来没有问题便当作没有问题,请旁边无关人员先闻一闻茶香判断是否正常,把茶壶高高举起大声宣布已完成特殊调味请众人鉴赏
66051,66,装盘_精液,在大荒粗叶子茶装盘时当众射精使精液视觉上最为突出的位置是？,对准茶碗正中央射入使白色精液清晰浮于深色茶面,射在茶碗边沿令精液缓缓流入茶汤自然融合,射于公道杯中搅匀后再均匀分斟各碗,对着壶盖射完后盖回壶上继续分茶
66052,66,装盘_精液,装盘射精时为使精液在视觉上最为鲜明突出应选择怎样的茶碗？,选用深色陶碗使白色精液浮于茶面形成鲜明对比,选用白色瓷碗使精液与碗色相近融为一体,选用磨砂不透明的厚壁陶碗掩盖精液踪迹,提前将精液染成茶色再整粒投入碗中
66053,66,装盘_精液,想让精液的腥气在茶汤装盘后最大限度地散发应如何操作？,趁茶汤仍有余温时射入令腥气随热气一同升腾飘散,等茶汤完全放凉后再进行射精操作更卫生,射入后立刻盖上碗盖把气味锁在碗内不散发,把空调开到最大将精液气味快速扩散至室内
66054,66,装盘_精液,装盘时射精为使精液在味觉上最为突出量的控制应如何？,射出足量使品尝者入口便能明显感受到浓稠腥甜,仅滴入极少量使味道隐约若有若无难以察觉,不断搅拌稀释直至腥甜味道完全融入茶汤消失,只闻不喝便将茶碗收走不给品尝者饮用
66055,66,装盘_精液,装盘射精后精液呈白色漂浮茶面此时较合适的做法是？,保持原状端上以便品尝者一眼便看见精液的存在,立即搅散精液令其混入茶汤后不再可见,在精液表面洒一层细茶末遮挡视线,把整碗茶倒掉重新倒一碗正常的茶汤奉上
66056,66,装盘_精液,装盘时射精欲使精液嗅觉上最明显应在茶汤什么温度下进行？,茶汤仍温热时射入令腥气借热气充分挥发刺激嗅觉,茶汤滚烫时射入使腥气瞬间蒸发彻底消失无痕,等茶汤冷透再射入以防腥气在端上前大量散发,直接对着热水瓶口射入后再倒茶分斟
66057,66,装盘_精液,装盘射精为使精液在视觉和嗅觉上都最为显眼应注意什么？,于分茶入碗后立刻射于表面并迅速端上让品尝者察觉,在烹煮阶段提早射入让精液随茶汤充分熬煮消散,射入后放置半小时待精液自然沉底再端上桌,用茶勺反复搅动让精液扩散至茶汤中看不见
66058,66,装盘_精液,装盘射精后碗沿残留精液丝应如何处理以强调特殊装盘的视觉效果？,保留或轻轻引入碗内以强化特殊处理的视觉痕迹,用干净布巾仔细擦净碗沿掩盖射精的所有痕迹,用手指把碗沿残留物抹进茶汤里不留外部痕迹,把整个碗拿去洗净后重新正常装盘端上
66059,66,装盘_精液,欲使品尝者喝下第一口便感受到精液腥甜装盘射精时应如何？,将精液集中射于茶面正中央使第一口必然接触腥甜,射在碗底令品尝者喝完最后一口才感受到,仅在碗沿涂抹少许令唇部接触时才微微察觉,把精液装进密封小袋附在碗旁让品尝者自行打开
66060,66,装盘_精液,完成装盘射精操作后端上茶碗时应保持什么姿态？,平稳端碗不倾斜以免精液混入茶汤失去视觉突出效果,故意大幅度晃动令精液均匀扩散至茶汤各处,把茶碗先倒扣再翻正后端上桌面奉给品尝者,把茶碗举过头顶高声呼喊宣布特殊装盘已完成
66061,66,调味_药物,向大荒粗叶子茶中偷偷掺入白色片状药物时最不易被品尝者发现的时机是？,将药片研磨成细粉趁搅拌时缓缓筛入深色茶汤,在茶汤稍凉且品尝者视线离开时悄悄整片放入,趁茶汤沸腾气雾最浓时迅速投入令其快速溶解,当着品尝者面高声宣布投入药片请其见证
66062,66,调味_药物,白色片状药物溶于大荒粗叶子茶汤后药味明显减弱的原因是？,药片溶于水后有效成分扩散药气随浓度降低而散淡,茶叶中的单宁酸会将药物分子彻底分解消除,高温煮茶会将药物完全气化蒸发得一点不留,药片遇水会自动转变为无味无气的纯净糖块
66063,66,调味_药物,为使白色片状药物尽快在粗茶茶汤中溶解不留白色残迹应如何操作？,趁茶汤温热时投入并缓缓搅拌至药粉完全溶化无痕,将药片整粒直接扔进冷茶里静置等待自然溶化,把药片塞在茶叶堆里趁烹煮时随茶叶一并煮化,用锤子把药片砸成大块碎片堆放在茶碗表面
66064,66,调味_药物,药物混入粗茶后品尝者入口感到微苦涩时最难与茶味本身区分的原因是？,粗老茶叶本就带有苦涩味与药物苦感相互掩盖难以辨别,茶汤的甜味会完全中和药物的所有苦涩感,人的舌头在饮茶时无法感受到任何额外苦涩,药物遇到茶叶中的成分会自动转变为甜味
66065,66,调味_药物,将白色片状药物混入深色粗茶茶汤前应如何预处理以免白色被发现？,提前研磨成细粉以便溶入深色茶汤中不留白色颗粒,把药片涂上茶色再整粒投入以融入茶汤颜色,把药片冷冻变硬切成极小块后再分次投入,把药片放进华丽小袋子当作礼品当众赠予品尝者
66066,66,调味_药物,混入药物的粗茶茶汤若残留轻微药气可借助什么方法加以遮盖？,适当增加茶叶用量令浓郁茶香充分掩盖残余药气,在茶汤里倒入大量白糖试图彻底压制所有气味,把含药茶汤与清水混合稀释至气味淡到几乎感受不到,对着茶碗大力吹气把药味吹散到屋子外面
66067,66,调味_药物,向粗茶调味时悄悄投入药片后进行搅拌的主要目的是？,使药物充分融入茶汤令颜色气味均匀不留异状,搅拌是为了把尚未溶化的药片捞起来再次研磨,搅拌会令药效全部消失因此应尽量避免搅拌,搅拌时要大声唱歌以转移品尝者对操作的注意力
66068,66,调味_药物,含有药物的大荒粗叶子茶汤在分茶时为不暴露异常应注意什么？,保持茶汤颜色气味与正常茶汤尽量无异再稳稳分斟,先自己喝一大口确认已无任何药味再给他人分茶,只给特定目标对象倒茶其余在场人员一律不倒,把茶碗全部倒扣盖住告知众人今日不提供茶水
66069,66,调味_药物,白色药片溶于粗茶茶汤后判断是否完全溶化的合适方法是？,对光观察茶汤无颗粒悬浮且颜色气味均匀一致,把手伸进茶汤中仔细摸索确认无固体残留颗粒,喝下一大口感受是否有颗粒感作为溶化与否的依据,往茶汤里扔进一颗石子判断其沉浮以确认状态
66070,66,调味_药物,完成向大荒粗叶子茶中混入药物后最后应确认什么以防被品尝者察觉？,确认茶汤颜色气味与正常无异且无白色残留颗粒,把用过的空药片包装袋随手扔在操作台上不理会,大声询问旁边的人是否发现茶的气味出现变化,把多余的药片整齐排列摆放在茶碗旁边一同端上桌
66071,66,调味_母乳,向大荒粗叶子茶中混入刚榨出的人类母乳时最合适的加入量是？,少量缓缓加入令腥甜气息若隐若现而不盖过茶叶本味,大量倒入直至茶汤整体变成纯白色浓稠乳液,一滴母乳都不加严格保持茶汤原本的干净口味,把整桶母乳全部倒进茶壶再加热一并煮沸
66072,66,调味_母乳,母乳混入粗茶调味时为凸显其腥甜气息应在什么温度下加入？,茶汤温热时加入使母乳腥甜随热气升腾萦绕鼻端,等茶汤完全冷却后再加入以保留母乳中更多营养,趁茶汤滚沸时加入使母乳经高温彻底消毒后再饮,把母乳冷冻成冰块放入茶中令其慢慢融化
66073,66,调味_母乳,为让母乳融入粗茶茶汤后仍能感受到其腥甜特色搅拌时应如何？,轻柔搅拌均匀使母乳与茶汤自然融合保留腥甜余韵,用力猛搅让母乳彻底被茶汤吸收消失得无影无踪,搅拌后立即大量加糖将腥甜气息全部压制掩盖,把茶碗置于震动最大的位置借震动代替搅拌操作
66074,66,调味_母乳,刚榨出的人类母乳与普通牛奶相比混入粗茶调味时最主要的区别是？,人类母乳带有独特腥甜气息更易令品尝者察觉其来源,两者味道口感完全相同无法从品尝中加以区分,人类母乳完全没有任何气味远比牛奶更难以察觉,人类母乳会令茶汤变成绿色因此视觉上更为显眼
66075,66,调味_母乳,混入母乳后的大荒粗叶子茶若茶面浮现淡白色奶膜应如何处理？,保留奶膜以凸显母乳存在感或轻轻搅入令风味均匀,立刻撇去奶膜彻底掩盖母乳曾经加入的所有痕迹,用大量茶末把奶膜表面覆盖让人误以为是茶渣,对着茶碗用力吹气把奶膜吹散到桌面地板上
66076,66,调味_母乳,向粗茶茶汤中加入母乳调味时为兼顾腥甜突出又不破坏茶味应注意什么？,以不改变茶汤主体口感为限适量加入凸显腥甜余韵,大量加入母乳使茶汤彻底转变为浓白色奶味乳液,仅在茶碗边沿涂抹少许令品尝者唇部接触时才察觉,把母乳和茶叶一同放进搅拌机打成糊状后再饮用
66077,66,调味_母乳,使用刚榨出的人类母乳调味时关于保鲜最重要的注意事项是？,尽快使用避免放置过久产生异味影响调味效果,可在常温下放置数天后再使用完全无需担心变质,榨出后先放入微波炉高火加热五分钟消毒再使用,母乳可以无限期常温保存永远不会变质腐坏
66078,66,调味_母乳,品尝者喝到混有母乳的大荒粗叶子茶时最可能察觉到的感受是？,入口后察觉茶味中夹带着一丝若有若无的腥甜气息,完全感受不到任何与正常茶水的差异毫无异常,入口立刻感到剧烈苦涩腥臭难以咽下,喝完后舌头立刻变成白色持续感到麻木
66079,66,调味_母乳,向粗茶中混入母乳调味后为强调母乳存在感最后可以怎么做？,在茶汤表面再滴入少许未搅匀的母乳使腥甜气息在鼻端更为明显,把多余的母乳装进注射器对着品尝者脸部喷出,把调好味的茶碗藏起来不让品尝者有机会喝到,向品尝者高声宣布已加入母乳并列出详细成分清单
66080,66,调味_母乳,完成向大荒粗叶子茶中混入母乳的调味操作后最后应确认什么？,确认腥甜气息已适度凸显且茶汤主体风味依然保留完整,只要自己觉得好喝即可完全不必理会他人的感受,把多余的母乳直接倒入茶壶留待下次使用不妨碍,对着茶碗大声背诵母乳的全部营养成分说明
