cid,food_id,stage,question,correct_answer,wrong_answer_1,wrong_answer_2,wrong_answer_3
问题cid,食物id,烹饪阶段,问题内容,正确答案,错误答案1,错误答案2,错误答案3
int,int,str,str,str,str,str,str
0,0,0,1,1,1,1,1
香草冰淇淋烹饪问题库,,,,,,,
84001,84,备料,制作天然香草冰淇淋时最能体现风味的香草应选用什么？,完整饱满气味浓郁的天然香草荚,带有人工味的香草味食用香精,廉价的合成香草调味粉,一根随手捡来的晒干杂草
84002,84,备料,从香草荚中取出香草籽的正确做法是？,纵向剖开荚身用刀背刮下细小香草籽,把整根香草荚直接丢进锅里不作处理,将香草荚横切成小段一起煮,把香草荚塞进搅拌机打成碎渣
84003,84,备料,制作英式蛋奶酱基底应主要选用鸡蛋的哪一部分？,新鲜完整的蛋黄,带壳整颗鸡蛋一起打入,只取澄清的蛋清部分,已经发臭变质的坏蛋
84004,84,备料,选购用来增添奶香的奶油时较合适的是？,乳脂含量较高且新鲜的淡奶油,用脱脂牛奶完全替代奶油,挑选接近保质期临界的奶油,使用结块发酸的过期奶油
84005,84,备料,备料时挑选的鸡蛋应保持什么状态？,外壳完好新鲜且没有异味,在常温下敞放多日的鸡蛋,蛋壳已经出现裂纹的鸡蛋,内部已经孵化腐坏的蛋
84006,84,备料,制作冰淇淋蛋奶液时较合适的糖是？,易于溶解的细砂糖,整块不化的大冰糖直接投入,未经提纯的粗盐颗粒,一把混着泥土的沙子
84007,84,备料,保存得当的优质香草荚应当呈现什么样子？,柔软有光泽且香气醇厚浓郁,干硬开裂且几乎闻不到香味,表面布满白色霉斑,已经腐烂流出黏液
84008,84,备料,量取牛奶与奶油用量时正确的做法是？,按配方比例准确称量,凭手感随意倾倒不作计量,把牛奶和奶油都加上双倍的量,把奶类全部换成清水
84009,84,备料,熬煮蛋奶液所用的锅具应选择？,洁净无异味的厚底奶锅,表面沾满油污的旧锅,生锈掉漆的破损铁锅,锅底已经漏了洞的锅
84010,84,备料,分离蛋黄与蛋清时较稳妥的方式是？,小心操作避免蛋黄破裂或混入蛋壳,直接用脏手胡乱抓取分离,任由碎蛋壳留在蛋黄之中,把整颗鸡蛋一把捏碎
84011,84,备料,完成备料后各项食材应如何摆放？,分类整齐摆放并保持台面清洁,把所有食材随意堆在一处,生食材与熟食材混杂堆放,撒得满桌都是任其凌乱
84012,84,烹饪,熬煮香草蛋奶液时火候应如何控制？,全程用小火耐心慢慢加热,开大火快速把它煮沸省时,持续用中大火让液体翻滚,用喷枪直接对着锅底猛烧
84013,84,烹饪,加热英式蛋奶液过程中最关键的注意点是？,保持微温微冒热气而绝不煮至沸腾,一定要把蛋奶液煮到剧烈大滚,煮得越沸腾越能提升风味,一直烧到锅底焦黑发苦
84014,84,烹饪,蛋奶液若被加热到沸腾会出现什么后果？,蛋黄受热过度凝结成蛋花絮状,奶液反而会变得更加顺滑细腻,香草的香气会因此大幅增强,整锅蛋奶液会凭空消失
84015,84,烹饪,把热牛奶倒入蛋黄糖糊时正确的手法是？,少量分次缓缓倒入并不停搅拌,一口气全部倒入图个省事,把生蛋黄直接倒进沸腾牛奶里,隔着老远把热牛奶泼过去
84016,84,烹饪,判断英式蛋奶酱已经熬至恰好的标志是？,蛋奶液能均匀挂在勺背划线不合拢,蛋奶液依旧稀薄如水毫无变化,表面结出厚厚一层焦硬外壳,锅里开始升起阵阵黑烟
84017,84,烹饪,熬煮蛋奶液时为什么要持续不停搅拌？,防止蛋黄局部受热结块并避免糊底,只是为了让它更快地沸腾起来,目的是把大量空气搅打进去发泡,纯粹是闲着没事找点乐子
84018,84,烹饪,蛋奶酱熬好之后较合适的处理方式是？,过筛滤去可能的蛋花颗粒后再冷却,趁着滚烫立刻倒进冷冻室,把原锅继续留在火上加热,直接把蛋奶酱倒进下水道
84019,84,烹饪,想让熬好的蛋奶液降温较稳妥的方法是？,隔着冰水降温后再冷藏充分冷却,放在灶台上让它自己慢慢凉,趁着滚烫直接拿去冷冻搅拌,端到烈日下暴晒等它变凉
84020,84,烹饪,冷冻阶段对蛋奶液进行搅拌的主要目的是？,打入空气并打碎冰晶让口感更绵密,只是为了让它更快冻得坚硬,把已经冷却的奶液重新煮熟,顺便给冰淇淋染上鲜艳颜色
84021,84,烹饪,在没有冰淇淋机时想防止冰晶应当怎么做？,冷冻期间每隔一段时间取出搅打一次,放进冷冻室后完全不再去理会,反复化开再冻结这样来回多次,往里倒一大杯清水一起冻成冰
84022,84,烹饪,冷冻搅拌不充分通常会导致什么结果？,冰淇淋口感粗糙布满粗大冰碴,冰淇淋反而会变得格外细腻,对最终口感完全没有任何影响,冰淇淋会重新化回液体状态
84023,84,调味,香草冰淇淋的调味核心应当突出什么？,天然香草交织奶香的醇厚甜香,浓重压舌的咸味,刺激呛口的辣味,苦涩难咽的药味
84024,84,调味,给蛋奶液加糖时应遵循的用量原则是？,适量加糖并考虑冷冻后甜度会下降,糖越多越好完全不必控制,索性一点糖也不加,直接用等量的盐来代替糖
84025,84,调味,想进一步强化天然香草风味较好的做法是？,把刮空的香草荚壳也一并浸入加热,额外滴入大量化学合成香精,多加几勺白糖来充当香味,往锅里倒入一瓶香水增香
84026,84,调味,调味时发现蛋奶液甜度偏低应如何处理？,在加热阶段适量补糖使其充分溶解,等冻好后再往表面撒干燥糖粒,把冻硬的成品泡进糖水里,浇上整罐蜂蜜把它彻底淹没
84027,84,调味,想为香草冰淇淋增添一丝风味层次可少量加入什么？,极少量的盐用来衬托奶香与甜味,大量食盐让整体变得发咸,满满一勺火辣的辣椒粉,一大把气味冲鼻的孜然粉
84028,84,调味,为何更提倡使用天然香草荚而非人工香精？,天然香草荚的风味更醇厚自然,人工香精其实更加健康无害,人工香精完全没有任何味道,天然香草荚本身含有剧毒不能用
84029,84,调味,调味阶段对甜度的把握应当如何？,先尝过味道再决定是否补糖,一开始就加到极甜不管不顾,全凭运气随手乱加一通,加到齁甜发腻为止才肯停手
84030,84,调味,想搭配出清新果香较自然健康的选择是？,拌入少量新鲜果泥或天然果酱,倒进大量工业合成色素,加一勺洗涤剂来增添香气,滴入几滴汽油提味
84031,84,调味,调味用糖若溶解不完全通常会怎样？,成品口感发砂残留明显糖粒颗粒感,成品反而会变得更加顺滑,对最终口感完全没有影响,整罐冰淇淋会因此爆炸
84032,84,调味,香草冰淇淋整体调味追求的口感是？,奶香浓郁甜而不腻,又咸又苦层层堆叠,各种味道掺得越杂越好,调成难以下咽的古怪味道
84033,84,调味,调味之后想确认风味是否合适应当怎么做？,在冷冻前取少许蛋奶液尝味并微调,非要等完全冻硬之后再去尝,全程一口不尝纯靠感觉,让别人舔过的勺子再回锅搅一圈
84034,84,装盘,盛装冰淇淋前对器皿较合适的处理是？,提前冷藏过的洁净冰镇碗具,使用刚出炉的滚烫盘子,挑一只还沾着热水的碗,随手拿满是污渍的脏碗
84035,84,装盘,挖取冰淇淋球时较合适的工具是？,干净的专用冰淇淋勺,锈迹斑斑的破旧铁勺,刚切过生肉尚未清洗的刀,干脆用手直接抓取
84036,84,装盘,想挖出圆润漂亮的冰淇淋球应当怎么做？,勺子蘸一下温水后再挖取更顺滑,用蛮力硬铲直到冰淇淋碎裂,把整盒冰淇淋倒扣磕出来,抡起锤子把冰淇淋砸成碎块
84037,84,装盘,装盘时冰淇淋较为理想的状态是？,略微回温至易挖取又不化的程度,趁刚冻成坚硬冰块时勉强挖取,等完全化成液体后再盛入碗中,放到化成一摊水洼时才装盘
84038,84,装盘,想提升卖相可在冰淇淋旁点缀什么？,几片新鲜薄荷叶或时令水果,一坨颜色发暗的剩菜,几颗捡来的小石子,一支竖插的铅笔
84039,84,装盘,冰淇淋装盘的动作应当注意什么？,动作利落避免长时间停留室温融化,不慌不忙慢慢摆放任其融化,反复揉捏挤压冰淇淋球,把冰淇淋球放桌上滚来滚去
84040,84,装盘,想为香草冰淇淋搭配脆口层次可在旁边配什么？,一片薄脆的华夫饼或饼干,一小块生硬的石膏,一团揉皱的湿纸巾,一把锋利的铁钉
84041,84,装盘,多球冰淇淋装盘时较美观的摆放方式是？,错落有致地间隔摆放显得精致,全部挤压堆叠成黏在一起的一坨,胡乱散扔在盘子的各个角落,垒成摇摇欲坠的高塔
84042,84,装盘,装盘后若盘边沾有融化痕迹应如何处理？,用干净纸巾轻轻擦拭干净保持整洁,留着融化痕迹不管任其流淌,用手指随意抹到盘子一旁,使劲把它吹得满桌都是
84043,84,装盘,冰淇淋装盘完成后较合适的做法是？,尽快端给食客趁冰凉时享用,放在室温下久置慢慢欣赏,端到暖气片旁边搁着,搁置一整天后再端上桌
84044,84,装盘,选择盛装香草冰淇淋的器皿大小时应当？,选用与分量相称并留出点缀空间的器皿,用过大的盆子显得空空荡荡,用过小的碟子勉强堆满,用破口漏底的脏碗盛放
