cid,food_id,stage,question,correct_answer,wrong_answer_1,wrong_answer_2,wrong_answer_3
问题cid,食物id,烹饪阶段,问题内容,正确答案,错误答案1,错误答案2,错误答案3
int,int,str,str,str,str,str,str
0,0,0,1,1,1,1,1
玻利瓦尔风卷饼烹饪问题库,,,,,,,
89001,89,备料,制作卷饼薄饼皮的面粉应保持什么状态？,干燥洁净没有结块的面粉,略微受潮但还能过筛的面粉,接近保质期但尚未变质的面粉,已经生虫发霉的陈年面粉
89002,89,备料,调制薄饼面糊时较合适的稠度是？,调成顺滑能均匀摊开的面糊,调得偏稠勉强才能摊开的面糊,稀得近乎清水的寡淡面糊,干脆和成硬邦邦的面团
89003,89,备料,准备卷饼肉馅时选用的肉应是什么状态？,新鲜有光泽且气味正常的肉,解冻后略微出水的冷冻肉,颜色稍暗但尚可勉强用的肉,已经发黏发臭的变质肉
89004,89,备料,处理卷饼要用的蔬菜前应先做什么？,清洗干净并沥去多余水分,只简单冲一下不沥水就切,不清洗直接切省去这一步,用带泥未洗的蔬菜直接下锅
89005,89,备料,把肉处理成卷饼肉馅时较合适的做法是？,切成大小均匀的肉末或细丁,随意剁成大小不一的肉块,切成偏大的厚块凑合着用,整块肉不切直接塞进薄饼
89006,89,备料,备料阶段为保证卫生首先应当做什么？,洗净双手与所用刀具砧板,只用清水快速冲一下双手,戴上手套却不洗手套下的手,用刚摸过地面的手直接操作
89007,89,备料,准备卷饼配菜时蔬菜较合适的切法是？,切成细长丝便于卷入并包紧,切成偏大的滚刀块来凑数,整片不切就直接铺进薄饼,把蔬菜捣成稀烂的菜泥
89008,89,备料,调制面糊时若出现小面疙瘩应如何处理？,充分搅拌或过筛使其顺滑,留着疙瘩不理会直接去摊,再倒入大量干面粉继续搅,把面糊全倒掉另买现成饼皮
89009,89,备料,备料时肉馅与蔬菜的取用量应如何把握？,按食用人数适量取用,凭手感多备出满满一大盆,担心不够而取出双倍的量,把整袋食材全部拆开堆着
89010,89,备料,完成备料后操作台面应保持什么状态？,整洁有序且食材分类摆放,把食材一股脑堆在一处待用,生肉与蔬菜混放在同一处,台面洒满污水与食材残渣
89011,89,烹饪,摊薄饼时平底锅的火候应如何控制？,用中小火使饼皮受热均匀,全程大火快速把饼烙上色,用极小火慢慢烘到饼皮发干,用喷枪对着面糊直接喷烧
89012,89,烹饪,往锅里倒面糊摊薄饼时较好的做法是？,倒入面糊后晃动锅子摊成薄圆片,倒入后任面糊堆在中央不晃动,一次倒入过多面糊摊成厚饼,把面糊直接泼满整个灶台
89013,89,烹饪,判断薄饼一面是否烙好可以看什么？,饼皮边缘微微翘起且底面上色,只凭下锅的固定时间来判断,饼面一冒热气就立刻判定熟了,贴着耳朵听饼皮发出的声响
89014,89,烹饪,炒制卷饼肉馅时较合适的做法是？,热锅下油把肉馅炒散至变色,冷锅冷油下肉慢慢煮出水,不放油干炒肉馅直到焦糊,往锅里抹一层洗洁精再炒肉
89015,89,烹饪,炒肉馅时如何让肉受热更均匀？,用锅铲不断翻炒把肉拨散,倒入后压实不动任其慢煎,全程只翻动一次任肉成块,盖上锅盖长时间焖到大量出水
89016,89,烹饪,薄饼烙制时若火太大容易出现什么问题？,饼面焦糊发苦而内里仍未熟,饼皮整体偏软而难以上色,面糊久烙始终无法定型,薄饼会凭空从锅里消失
89017,89,烹饪,给肉馅搭配蔬菜一起翻炒时合适的顺序是？,先炒熟肉馅再下易熟的蔬菜,把肉与蔬菜同时倒入一起猛炒,先把蔬菜炒到软烂再下肉,等肉彻底炒糊后才加蔬菜
89018,89,烹饪,摊好的薄饼从锅中取出时较好的做法是？,趁热用铲子轻轻揭起整张取出,等饼完全冷却变硬后再揭,用力撕扯把饼皮拽成几块,直接把锅倒扣让饼摔到桌上
89019,89,烹饪,炒肉馅判断是否炒熟可以怎么做？,观察肉色全部由红转白无血色,只凭翻炒的固定时间来判断,看一眼表面没焦就当作熟了,用尺子量一量肉馅的厚度
89020,89,烹饪,多张薄饼烙好后暂时存放较好的方式是？,叠放并盖布保温以防变干,一张张摊开晾在台面上吹凉,趁热卷成团塞进密封袋压实,直接泡进冷水里防止变硬
89021,89,调味,给卷饼肉馅调味时盐的用量原则是？,少量多次边尝边调整,凭经验一次性放足全部分量,先放偏多再用清水稀释,把盐换成等量的白糖块
89022,89,调味,想为卷饼肉馅增添香气可以加入什么？,少许孜然粉或现磨黑胡椒,大量辣椒粉盖过肉本身的味道,一整勺味精提鲜到发苦,滴入几滴机械润滑油
89023,89,调味,玻利瓦尔风卷饼想带点微酸口味可加什么？,挤上少许新鲜柠檬汁,倒入大量白醋酸到刺鼻,加一大勺白糖凑出酸甜,挤一管牙膏进肉馅里
89024,89,调味,调味时若肉馅本身已经偏咸应如何处理？,减少额外添加的盐量,照常按平时的分量加盐,再补一点盐让味道更浓,把肉馅泡进盐水里腌
89025,89,调味,想让卷饼风味更有层次可以搭配什么酱料？,抹少量番茄莎莎酱或酸奶油,把多种重口酱料一起厚厚抹上,浇满一整碗浓稠的甜面酱,挤入一管护手霜调味
89026,89,调味,为卷饼肉馅调味时较稳妥的顺序是？,先尝原味再决定补哪种调料,把全部调料一次倒入后再尝,闭着眼随手乱撒一通调料,不尝味直接照搬别人的配方
89027,89,调味,想增添辛香风味的卷饼可适量加入什么？,少许洋葱碎或蒜末,把整颗大蒜直接塞进肉馅,大把生姜末盖过其他味道,撒入一把不可食用的香薰碎
89028,89,调味,调味后发现肉馅味道偏淡较合适的补救是？,再少量补一点盐和香料,一次性加入大量的浓调料,把整盘再蘸满厚厚的酱料,倒上一整瓶酱油泡着
89029,89,调味,调味所用的香料应保持什么状态？,干燥洁净没有受潮结块,已经轻微受潮但还能凑合用,香气挥发殆尽的陈年香料,混进了灰尘的脏香料
89030,89,调味,这道街头卷饼调味讲究的整体原则是？,咸鲜适口并突出肉香与蔬菜清新,把口味调得越浓重越好,把能用上的调料尽量都加,加到齁咸难以下咽才罢手
89031,89,装盘,卷制卷饼时把馅料放在薄饼的什么位置较好？,铺在薄饼偏下方中间并留出边距,堆在薄饼正中央高高一大团,散铺到薄饼最外侧的边缘,把馅料全倒在薄饼外的盘子里
89032,89,装盘,想让卷饼卷得紧实不散开应如何操作？,先折起两侧再从下往上卷紧,直接松松一卷而不折两侧,把饼皮随意揉成一团裹住,卷好后再用力拍扁压散
89033,89,装盘,馅料放得过多对卷制会有什么影响？,难以卷紧且容易撑破饼皮漏馅,卷起来反而会更紧实更好看,完全不影响卷制和最终外形,馅料会自动减少到合适的量
89034,89,装盘,卷好的卷饼为方便食用通常如何处理？,从中间斜切成两段,整条不切直接堆着不便拿取,切成许多零碎的小段散落,随手揉成一个面团球
89035,89,装盘,装盘所用的盘子应保持什么状态？,干净整洁没有水渍油污,用厨房纸随意擦一下就用,冲洗后盘上仍残留着水珠,沾满上一道菜的剩菜残渣
89036,89,装盘,想让卷饼成品看起来更美观可以怎么做？,切面朝上展示饱满的馅料层次,把切面朝下盖住里面的馅料,把卷饼歪斜地堆在盘边,在卷饼上插一支铅笔做装饰
89037,89,装盘,装盘时为防止卷饼散开可以怎么做？,让饼皮收口处朝下压住固定,把卷饼竖着立起来摆放,让收口朝上任其自然散开,用透明胶带把卷饼缠绕粘住
89038,89,装盘,给卷饼搭配蘸酱一同上桌较好的做法是？,用小碟另盛蘸酱置于一旁,把蘸酱整勺浇满整条卷饼,把蘸酱直接淋在盘底积成一滩,把蘸酱泼得整盘到处都是
89039,89,装盘,卷饼装盘配色上较为协调的搭配是？,旁边点缀少许翠绿生菜或番茄,整盘只摆放同样颜色的食材,旁边堆放几样颜色发暗的剩菜,用鲜艳颜料给卷饼上色
89040,89,装盘,卷饼成品端上桌前最后应检查什么？,确认卷紧不漏馅且摆盘整洁,只大致扫一眼便端走上桌,完全不检查就直接端上桌,把掉在地上的馅料捡回盘中
