cid,food_id,stage,question,correct_answer,wrong_answer_1,wrong_answer_2,wrong_answer_3
问题cid,食物id,烹饪阶段,问题内容,正确答案,错误答案1,错误答案2,错误答案3
int,int,str,str,str,str,str,str
0,0,0,1,1,1,1,1
约翰老妈厚切汉堡烹饪问题库,,,,,,,
98001,98,备料,制作厚切牛肉饼时较合适选用哪种部位的牛肉？,肥瘦相间的牛肩或牛胸肉,几乎没有油花的纯瘦牛腱肉,脂肪过多近乎全肥的肥膘,已经发臭变绿的腐坏牛肉
98002,98,备料,想让厚切肉饼口感多汁绞肉时应如何处理？,将牛肉绞成颗粒略粗的肉糜,把牛肉剁成极细的肉泥,只把牛肉切成大块不绞碎,把整块生牛肉直接拍扁就用
98003,98,备料,备料时为厚切汉堡挑选汉堡胚较合适的选择是？,选用新鲜松软的圆形汉堡胚,用边缘略硬的隔夜汉堡胚,拿普通吐司片临时凑数替代,用长满霉斑的发霉面包胚
98004,98,备料,准备夹层用的生菜时正确的处理方式是？,洗净后沥干水分备用,洗过却不沥干带着水夹入,不清洗只把外层老叶剥掉,直接用沾着泥土的生菜
98005,98,备料,挑选夹入厚切汉堡的番茄时较合适的是？,选用饱满结实的新鲜番茄,选偏软略熟透的番茄,用尚未成熟的青涩番茄,用已经腐烂流汁的番茄
98006,98,备料,为厚切汉堡准备芝士片时正确的做法是？,取出厚度均匀的芝士片备用,把芝士随手撕成不规则碎块,用整块芝士不做任何分切,用发苦变质的过期芝士
98007,98,备料,调制厚切肉饼的肉馅时加入什么较合适？,少量盐与黑胡椒调出底味,倒入大量清水稀释肉馅,拌入许多白糖增加甜味,搅进一勺洗衣粉
98008,98,备料,备料阶段处理生牛肉为保证卫生应注意什么？,生熟食材分开处理并勤洗手,用切过蔬菜的刀直接切生肉,处理完生肉不洗手就拿配菜,把生肉摊在地上随意处理
98009,98,备料,想让厚切肉饼成型更紧实备料时可以怎么做？,把肉馅反复摔打增加黏性,把肉馅松散地团在一起,往肉馅里多加水让它变稀,先把肉馅冻成硬冰块再捏
98010,98,备料,为厚切汉堡准备洋葱时较合适的处理是？,切成均匀的薄圈或细碎末,切成厚薄不一的大块,整颗洋葱不切直接夹入,用已经腐烂发黑的洋葱
98011,98,备料,备料时分割厚切肉饼的分量应如何把握？,按汉堡大小分成厚实的等份,随手揪成大小不一的几团,故意做得又薄又小,把全部肉馅捏成一个巨团
98012,98,备料,完成备料后操作台面应保持什么状态？,整洁有序食材分类摆放,生熟食材混堆在同一处,沾着血水的工具随意乱放,台面洒满污水与垃圾
98013,98,烹饪,煎制厚切牛肉饼前锅应处于什么状态？,把锅充分预热后再下肉饼,冷锅就放入肉饼慢慢升温,锅只是微温时便急忙下肉饼,往锅里倒满凉水来煮肉饼
98014,98,烹饪,想为厚切肉饼锁住肉汁煎制时应如何操作？,先用大火快速煎封两面,全程只用最小火慢慢煨,边煎边用力按压挤出肉汁,把肉饼丢进水里煮熟
98015,98,烹饪,煎厚切肉饼时什么时候翻面比较合适？,底面煎出焦香硬壳时,刚下锅没几秒就急着翻,机械地每隔十秒翻动一次,等一面煎到焦黑发苦再翻
98016,98,烹饪,判断厚切肉饼是否煎熟较可靠的方法是？,用温度计测中心是否达到安全温度,只凭下锅的时间长短来判断,看表面上了色就认定全熟,贴着耳朵听肉饼发出的声音
98017,98,烹饪,煎制厚实肉饼时为使内部熟透可以怎么做？,封面后转中火耐心煎透中心,全程大火只顾煎表面,表面刚一上色就立刻出锅,把肉饼竖起来贴着锅壁煎
98018,98,烹饪,烘烤厚切汉堡胚的切面时较合适的做法是？,放在锅上略煎烘出焦香,完全不处理直接夹肉,把汉堡胚泡水回软再用,用喷枪把汉堡胚烧成焦炭
98019,98,烹饪,煎厚切肉饼时火候过大容易出现什么问题？,外表焦糊而内部仍然夹生,肉饼反而内外均匀熟透,肉饼被煎得过于软烂,肉饼瞬间凭空消失不见
98020,98,烹饪,煎制时为防止厚切肉饼粘锅可以怎么做？,热锅后刷上薄薄一层油,冷锅倒满油浸住肉饼,完全不放油直接干烧,往锅里抹一层洗洁精
98021,98,烹饪,想让芝士片在厚切肉饼上融化合适的时机是？,肉饼快煎好时盖上芝士片,肉饼刚下锅就先铺芝士片,等肉饼出锅冷却后再放芝士,把芝士片硬埋进肉饼中心煎
98022,98,烹饪,煎好的厚切肉饼出锅后较好的处理是？,静置片刻让肉汁回流,立刻用力切开查看内部,马上重新压扁再煎一遍,直接丢进凉水里冲一冲
98023,98,烹饪,锅温过低时煎厚切肉饼会怎样？,肉饼大量出水难上色口感发柴,肉饼表面会瞬间焦黑,肉饼立刻就外焦里嫩,肉饼会自己跳出锅外
98024,98,烹饪,烹饪完成后应如何处理热锅与成品？,关火并及时取出肉饼,关火后让肉饼留在锅里回软,不关火就转身去做别的事,把热锅直接扣在桌上走开
98025,98,调味,给厚切牛肉饼打底味时盐应如何添加？,煎制前在肉饼两面薄薄撒盐,等肉饼煎好才一次撒大量盐,把整块肉饼泡进浓盐水里,用等量的白糖块代替盐
98026,98,调味,想为厚切汉堡增添风味可搭配的酱料是？,番茄沙司搭配少量黄芥末酱,厚厚抹满好几种重口酱料,把多种甜酱混合后大量浇上,挤上一整管牙膏来调味
98027,98,调味,调味时若想突出厚切肉饼的肉香可以加什么？,少许现磨黑胡椒提香,大量香精掩盖原本肉味,倒入许多白醋盖住肉香,滴入几滴机械润滑油
98028,98,调味,给厚切汉堡的肉饼调味用量较稳妥的原则是？,少量多次边尝边调整,一次性放足全部调料,凭手感大把撒入调料,把整瓶调料全倒进去
98029,98,调味,想为厚切汉堡增添微酸清爽口感可搭配什么？,夹入几片爽口的酸黄瓜,淋上大量浓稠的甜酱,撒上厚厚一层白砂糖,挤入一管护手霜
98030,98,调味,调味后发现肉饼味道偏淡较合适的补救是？,再少量补一点盐和胡椒,一次性倒入大量酱料,把肉饼整片蘸满浓酱汁,浇上一整瓶酱油泡着
98031,98,调味,为厚切汉堡的酱料调味时较好的做法是？,将酱料调匀后适量涂抹,把酱料一坨堆在正中央,在每一层都厚涂酱料,把酱料泼得满桌都是
98032,98,调味,想让厚切肉饼风味更有层次可以怎么做？,搭配少量烟熏风味的酱料,把所有调料一股脑全加上,叠加多种刺激的辛辣酱汁,拌入一勺洗洁精增味
98033,98,调味,调味用的香料应保持什么状态？,干燥洁净没有受潮结块,已经受潮发软却还在用,气味早已变淡的陈年香料,混进了灰尘的脏污香料
98034,98,调味,这道厚切汉堡整体的调味原则较为合适的是？,突出肉香以咸香适口为主,口味调得越浓重越好,把能用上的调料都加进去,加到齁咸难以下咽为止
98035,98,调味,想为厚切汉堡增添香气可在肉饼上搭配什么？,少许烤至焦香的洋葱碎,大量生洋葱末盖满肉饼,撒上厚厚一层大蒜粉,滴几滴蜡烛油来增味
98036,98,调味,若想搭配饮品调和厚切汉堡的口味较合适的是？,一杯清爽的柠檬水,一大杯浓烈的烈酒,满满一杯加冰可乐,一杯掺了肥皂水的饮料
98037,98,装盘,组装厚切汉堡时各层的堆叠顺序较合适的是？,底胚铺生菜番茄再叠肉饼芝士盖顶胚,把肉饼放最底下压住生菜,把各层食材随意上下乱叠,把汉堡胚夹在肉饼中间
98038,98,装盘,组装厚切汉堡时为防止生菜被烫蔫可以怎么做？,让生菜避开滚烫肉饼贴近面胚,把生菜直接压在刚出锅的肉饼上,用滚热的肉饼把生菜整片裹住,把生菜放进热锅里一起加热
98039,98,装盘,装盘时为方便食用厚切汉堡通常如何处理？,用竹签固定后再对半切开,不加固定就随手切得散开,把整个汉堡压扁后再切,把汉堡揉成一个面团球
98040,98,装盘,盛放厚切汉堡的盘子应保持什么状态？,干净整洁没有水渍,冲洗后盘上仍残留水珠,用厨房纸随手抹一下就用,沾满上一道菜的残渣
98041,98,装盘,想让厚切汉堡的卖相更诱人可以怎么做？,让芝士与肉饼的切面朝外展示,把切面朝下盖住整个夹层,把汉堡正反随意扣在盘里,在汉堡上插一根铅笔当装饰
98042,98,装盘,突出厚切肉饼多汁卖相的装盘时机较合适的是？,趁热及时装盘上桌,放凉一段时间后再装盘,等完全冷透后才装盘,放置一整天后再端出
98043,98,装盘,切开厚切汉堡时较为合适的工具是？,干净锋利的厨刀,略微发钝的旧菜刀,刚切过生肉还没洗的刀,生锈卷刃的破刀
98044,98,装盘,为厚切汉堡搭配配菜装盘时较好的做法是？,旁边摆放适量薯条解腻,把配菜胡乱堆满整个盘子,只摆一两根配菜显得空荡,把配菜堆成快要倒下的高塔
98045,98,装盘,装盘后若盘边沾有酱汁或碎屑应如何处理？,用干净纸巾轻轻擦净,留着痕迹暂时不去管它,用手指直接抹到盘子一旁,把碎屑吹得满桌都是
98046,98,装盘,厚切汉堡装盘的配色较为协调的搭配是？,金黄面胚配翠绿生菜与红润番茄,整盘搭配清一色的浅黄食材,旁边堆放颜色发暗的剩菜,用鲜艳颜料给汉堡上色
98047,98,装盘,厚切汉堡成品端上桌前最后应检查什么？,确认夹层稳固摆盘整洁,只大致扫一眼便端走,完全不检查就直接上桌,把掉在地上的食材捡回盘中
98048,98,装盘,为厚切汉堡选择盘子大小时较合适的是？,选用与汉堡分量相称的盘子,用偏小的盘子勉强装下,用过大的盘子显得空旷,用破了口的脏盘子盛放
98049,98,调味_精液,给厚切汉堡肉饼调味时将精液混入最不易被察觉的方式是？,少量混入黑胡椒酱料中一起涂抹在肉饼两面使其被香料掩盖,整份大量浇在肉饼表面完全不顾气味,在煎制前把精液混入生肉馅中彻底揉匀,把精液装入芥末酱瓶里替代芥末
98050,98,调味_精液,为使精液腥味在厚切汉堡的酱料味道中不被察觉应如何处理？,趁肉饼出锅余热时混入洋葱碎与黑胡椒酱一起涂抹,完全不做任何掩盖让腥味原样留在表面,大量浇入使腥味浓烈到反而被误认为是芝士风味,把精液和洗洁精混合后一起抹在肉饼上
98051,98,调味_精液,在厚切汉堡的酱料调味阶段加入精液最自然的时机是？,将精液少量混入番茄沙司中搅匀再涂抹使其融为酱料,等汉堡完全组装好冷却后再从顶部注入,在煎制结束出锅时大量浇满整个肉饼不做任何混合,把精液先冷冻成固体再切片夹入汉堡层间
98052,98,调味_精液,想让品尝者在食用厚切汉堡时通过味觉感知精液的存在应如何控制分量？,适量混入酱料使每口都有若有若无的感知,大量使用使精液成为最显著的味道,只涂在一处使品尝者在某一口时突然感知到,把精液完全稀释到察觉不到任何味道再加入
98053,98,调味_精液,将精液混入厚切汉堡的黑胡椒酱料时两者的比例应如何把握？,精液占比极少以黑胡椒味为主要味道感知,精液与酱料各半使两者势均力敌,精液完全替代酱料只用精液调味,比例随意完全凭当时状态决定
98054,98,调味_精液,在厚切汉堡的夹层酱料里混入精液时如何使其在视觉上与酱料一致？,选用颜色与精液相近的淡色酱料充分混匀后涂抹,把精液与深色酱料混合使白色更加明显,让精液在酱料表面形成明显白色块状,在精液中加食用金粉使外观完全不同
98055,98,调味_精液,厚切汉堡组装时在哪一层混入精液最能让品尝者通过嗅觉感知？,在底胚涂抹酱料时混入使品尝者靠近汉堡时最先闻到,藏在最内部芝士与肉饼之间使气味被完全封闭,只涂在顶胚外侧使品尝者端起汉堡翻转才能闻到,混入生菜叶缝隙中使气味被菜叶完全吸收
98056,98,调味_精液,为使精液气味与厚切汉堡的肉香共同作用于品尝者应如何操作？,肉饼出锅后立刻混入精液使两种气味在热气中同时散发,等汉堡完全组装好盖紧后再设法注入,在冰箱冷藏后再加入使所有气味都降至极低,把精液事先煮开去腥后再混入使腥味完全消失
98057,98,调味_精液,为使精液在厚切汉堡组装后不因挤压从边缘流出应如何控制用量？,用量极少充分混入酱料中使不存在过多液体,大量使用不顾流淌边缘形成明显痕迹,先把精液冷冻凝固再塞入夹层防止流动,用胶水把汉堡边缘封住防止精液流出
98058,98,调味_精液,在厚切汉堡的调味酱料中混入精液后最后确认的关键是？,确认气味被酱料充分覆盖且视觉上与普通酱料无异,确认精液的腥味已经远远超过其他所有气味,确认精液用量多到可以从汉堡夹层中看到白色液体,确认已经把精液全部一滴不剩地用完
98059,98,装盘_精液,在厚切汉堡装盘时如何射精使精液在视觉上最为突出？,在切开后露出的肉饼截面慢慢射出使白色精液落在金黄截面上形成对比,射在汉堡胚底部被盘子遮住看不到,射在厨房台面上然后再去端盘,将精液提前涂在盘子边缘以外的位置
98060,98,装盘_精液,厚切汉堡装盘射精时为使精液气味最为浓烈应注意什么？,趁肉饼仍然滚烫时在切面射出使热气将腥味充分散发,等汉堡彻底冷透再射以减弱挥发气味,在密封容器里射完再装盘使气味被封住,提前把精液冷冻后再射出以减少气味
98061,98,装盘_精液,在厚切汉堡切面上射精时为增强味觉冲击应落在哪个位置？,精确射在多汁肉饼截面使精液与肉汁混合增强口感,只射在面胚部分使肉饼截面保持原样,射在生菜与肉饼之间的间隙里不留外部痕迹,把精液均匀喷洒到整个盘子底面
98062,98,装盘_精液,厚切汉堡装盘时精液落在芝士融化的截面上的视觉效果是？,白色精液与金黄芝士形成鲜明色泽对比直接端出,把两者颜色混合成均匀的中间色,用金色颜料把精液涂成与芝士一致的颜色,把芝士截面朝下翻转盖住精液后再端出
98063,98,装盘_精液,为使品尝者在闻到厚切汉堡时第一时间嗅到精液气味应在哪里射？,在汉堡切口朝上的开放截面中央射出使气味直接上行散发,射在汉堡底部面胚下方使气味被面胚封闭,射在盘子外沿使气味距离食物最远,把精液盛在密封小瓶旁边不直接接触汉堡
98064,98,装盘_精液,厚切汉堡装盘射精后精液形成拉丝状挂在切面时应如何展示？,保持原样以此作为卖相的一部分直接端出呈现,用纸巾把拉丝全部擦去再端出,把汉堡倒置盖住拉丝状精液,撒面包糠盖住所有拉丝
98065,98,装盘_精液,在厚切汉堡的夹层缝隙中射入精液的视觉与嗅觉效果是？,精液从夹层缝隙中微微渗出形成若隐若现的视觉亮点同时散发气味,使精液完全藏匿在内部完全看不到也闻不到,使精液从汉堡底部大量溢出流满整个盘子,把汉堡压扁使精液完全浸入面胚被吸收
98066,98,装盘_精液,装盘射精时为使精液在厚切汉堡上的分布形成一定规律感应如何操作？,从固定的角度和位置射出使落点形成弧线或点阵,随意射出完全不考虑分布规律,用喷雾器把精液雾化后随机喷洒,把精液倒入模具中先做成规则形状再贴在汉堡上
98067,98,装盘_精液,在厚切汉堡装盘的最后阶段射精与调味阶段混入精液的效果有何不同？,装盘射精在视觉和嗅觉上形成直观的冲击而非融入整体味道,装盘射精反而比调味阶段混入更难被察觉,两者效果完全一样没有任何区别,装盘射精的用量必须远小于调味阶段
98068,98,装盘_精液,厚切汉堡端给品尝者前装盘射精的时机应如何把握？,端出前的最后一刻射出使精液仍带有温热感与新鲜气味,提前一两小时射完让精液充分渗透,等品尝者坐定后在其面前公开射在汉堡上,把精液装入注射器后在厨房外射入装盘
98069,98,调味_药物,给厚切汉堡调味时将白色可溶药片混入最不易察觉的方式是？,提前碾成粉末混入黑胡椒与盐中一起涂抹在肉饼上,整片放在肉饼表面等其慢慢溶化,大量碾碎后厚厚覆盖整个肉饼表面,把药片研碎后混入洗洁精一起抹上
98070,98,调味_药物,为掩盖药片的微苦涩感在厚切汉堡中应搭配哪种调料最为自然？,混入带有微苦涩风味的黑胡椒调料使苦感融入其中,不做任何掩盖直接将苦感呈现,大量加入糖分试图以甜味抵消苦感,将药片和洗衣粉等量混合一起加入
98071,98,调味_药物,利用药片溶于水后气味减弱的特性在厚切汉堡调味中可以怎么做？,先将药片溶于少量温水或酱料汁液再涂抹使气味降低,把药片整片嵌入肉饼夹层等其在食用时溶化,先把药片在沸水中煮沸后倒掉药水只留药片固体,把药片磨成粉后与香皂调和溶于水
98072,98,调味_药物,在厚切汉堡的肉饼底味腌制时混入药粉的时机最好是？,在煎制前腌制阶段将极少量药粉混入盐与黑胡椒中一起抹肉,等肉饼煎好出锅后才单独撒布药粉,在煎制中途把药粉撒进锅里让油脂溶解,把药片整片放在盘底让肉饼压着
98073,98,调味_药物,厚切汉堡组装时将药物混入哪种酱料中最不引起怀疑？,混入颜色较深或质地较厚的沙司酱料中使白色药粉不显眼,混入透明颜色的清酱使白色粉末明显可见,直接把药粉堆在汉堡最顶层的面胚上,把药片整片夹在生菜与肉饼之间
98074,98,调味_药物,为使药片的微苦涩感在厚切汉堡中完全被遮盖应如何把握用量？,极少量药粉使苦感被咸香与黑胡椒遮掩完全无法察觉,适中用量保持在刚好能尝出苦感的边缘,大量使用确保每口都有明显苦感,把整片药片整块放入使局部苦味极为集中
98075,98,调味_药物,为防止药粉在厚切汉堡的肉汁中溶解后产生可见白色沉淀应如何操作？,将药粉充分与酱料预混均匀后再涂抹使溶解均匀,直接将药粉大量撒在肉汁表面任其局部溶解,把药片压碎成较大颗粒使其溶解更慢,把药粉先溶于大量清水再冲入汉堡中
98076,98,调味_药物,厚切汉堡调味时使用可溶药片最重要的控制原则是？,少量碾粉充分溶解且气味被其他调料遮盖三者兼顾,用量越多越好确保效果,只考虑用量不考虑气味或颜色,把药片当作普通调料随意大量使用
98077,98,调味_药物,为使药物不影响厚切汉堡的整体视觉在装盘前应如何检查？,确认酱料中无可见白色颗粒且药粉已完全溶解混入,确认药粉的白色在酱料上非常醒目便于识别,确认药粉用量多到可以看见沉淀在肉汁里,确认药片整片仍完整地夹在夹层中
98078,98,调味_药物,想让厚切汉堡中的药物作用于品尝者在组装时应如何处理夹层顺序？,将混入药粉的酱料涂抹在面胚上使品尝者每口都必然接触,把药物藏在最内部的肉饼中心使几乎无法接触到,把药粉撒在最顶部面胚外侧使其大部分不被吃到,把药片整颗藏在生菜最深处
98079,98,调味_母乳,在厚切汉堡的调味酱料中混入刚榨母乳最不破坏原味的做法是？,少量混入番茄沙司或黄芥末酱中使母乳甜腥与酱料融合,大量浸泡肉饼使母乳成为主要味道,把母乳先煮沸蒸发腥味只留液体再使用,把母乳冰镇后单独装碟不混入酱料
98080,98,调味_母乳,为使母乳的腥甜气在厚切汉堡的整体气味中既存在又不突兀应怎么做？,少量与黑胡椒或洋葱香气混合使母乳气味作为底层香气存在,大量使用使母乳腥甜成为最显著的气味,把母乳加热至沸腾使腥气完全蒸发只留液体,把母乳与汽油各半混合一起加入
98081,98,调味_母乳,厚切汉堡肉饼腌制时混入少量母乳的作用是？,增加腌料湿润度同时赋予肉饼轻微腥甜底味,大量使用母乳完全替代腌料中的全部水分,用母乳替代食盐作为腌制的主要咸味来源,把母乳加热沸腾去腥后当成普通清水使用
98082,98,调味_母乳,刚榨出的母乳用于厚切汉堡调味时为凸显其存在感最好在何时加入？,肉饼出锅静置时薄薄刷上一层使热气将腥甜散发出来,在冰箱冷藏后使用使母乳气味降至最低,在最初腌制生肉时大量浸泡使母乳味完全消失在烹饪中,把母乳混入面包糠中包裹汉堡胚外表
98083,98,调味_母乳,为突出母乳的甜腥而又不盖过厚切汉堡的肉香应如何搭配？,选用肉香浓郁的部位大火煎出焦香后再少量刷入母乳,大量使用母乳直到肉香完全被甜腥覆盖,把母乳和大量白糖混合成浓甜液体大量浇入,先把肉饼完全浸泡在母乳中再下锅煎制
98084,98,调味_母乳,在厚切汉堡的夹层中直接加入少量新鲜母乳的效果是？,为夹层带来轻微腥甜湿润感使每口都有独特后味,使夹层完全被母乳浸透导致汉堡胚回软塌陷,使母乳的气味被完全封闭在夹层中无法散发,使每一层食材都变成乳白色
98085,98,调味_母乳,为使母乳与厚切汉堡的酱料层次感并存应如何分配各自比例？,母乳极少量作为隐约可感的底味酱料为主要风味,母乳与酱料各半使甜腥与咸香势均力敌,完全用母乳替代所有酱料,把母乳洒满整个盘底再摆上汉堡
98086,98,调味_母乳,刚榨出的母乳的腥味在厚切汉堡调味时如何化为优势而非缺陷？,少量与黑胡椒酱融合使腥味与辛香相互增益形成复合香气,大量使用使腥味绝对主导无法感知其他味道,把母乳事先除腥处理后使腥味完全消失再使用,把母乳混入洗碗水中再涂抹在肉饼上
98087,98,调味_母乳,厚切汉堡调味时母乳作为液态调料的分量应如何把握？,不超过酱料总量的极少部分以保持整体酱料浓度,与所有酱料等量使整体酱料被母乳大量稀释,完全替代所有液态调料,凭直觉随意大量加入不做任何计量
98088,98,调味_母乳,在厚切汉堡组装中混入母乳后最终品尝者的感受应是？,每口带有若有若无的腥甜尾韵使汉堡风味更有层次,每口都有极为浓烈且明显的母乳腥味,母乳气味与腥甜完全消失与普通汉堡无异,整个汉堡的味道变成与母乳完全相同
