cid,behavior_id,adv_id,context
45,304,2,凯尔希的耳朵不属于敏感部位，但它关乎自尊，所以她不会允许他人轻易触摸。\n然而，你对罗德岛的兽耳亦有强迫症的执着，立誓要rua遍罗德岛干员的耳朵。\n凯尔希不能幸免，于是你毛茸茸的、微痒的触感在手心扩散。\n至于凯尔希怎么想，管她呢，先rua个爽再说。
46,304,2,凯尔希头顶支起的耳朵让你格外在意，你伸手摸了摸，凯尔希一脸嫌弃的看着你，无声警告随意出手的代价。
47,304,2,你想要伸手抚摸凯尔希的耳朵时，凯尔希抬起头来，吓的你缩手。\n岂料，凯尔希主动抓住你的手，放在她耳朵边，主动蹭向你的手心。\n温暖和瘙痒在手心划过，你配合凯尔希的节奏，让她也露出舒服的表情。
48,311,2,“小心地滑。”\n你一个趔趄差点摔倒，凯尔希伸手抓住你，然后没有再松开。\n她牵着你的手，明明没有暧昧的要素，但你的心却砰砰的跳。
49,311,2,“牵手……这样？”\n当你提出牵手的请求后，凯尔希不能理解，但还是把手伸给你。\n你握住她的手，被某些部位存在的手茧刮痛。\n“你那无聊的好奇心满足了吗？”\n凯尔希作势抽手，你却握紧，冲她摇摇头，她瞪大眼睛，低头看着你们相合的手掌，让静谧主宰了你们相处的时间。
50,311,2,在无人之初，凯尔希与你并肩的时候，她会主动伸手勾住你的手指，而后把整个手掌纳入她的掌控里。\n她不看你，你不看她，你任由她主动。\n凯尔希是富有进攻性的女子，无论牵手时，还是在床上，都是如此。
51,312,2,“凯尔希，能给我一个拥抱吗？”\n你撒娇式的向凯尔希索求拥抱，凯尔希不知道你发什么神经，用看待草履虫的目光看待你。\n你管不了那么多，强硬的把凯尔希抱在怀里，但只是抱着。\n因为Mon3tr在看着你。
52,312,2,你发现落单的凯尔希，袭击，被凯尔希一个过肩摔放倒在地。\n“一时手滑。”凯尔希说。\n这无论如何也不用手滑解释，但凯尔希愿意给你补偿，于是你抱住她。
53,312,2,看见凯尔希，你的心中多出一股柔情，紧接着化作冲动，紧紧拥抱凯尔希。\n“干嘛啊。”\n凯尔希身体紧绷，又慢慢放松下来，她胸口鼓鼓囊囊的触感印在你的胸脯上，她腰肢和背脊的线条在你的手臂与手掌的掌握中。\n你埋首凯尔希的颈部，她奶白色的发丝令你感到瘙痒，而发丝上则残留着和你同款洗发水的香味。
54,312,2,“凯尔希。”\n“？”\n“你站在这里不要走动。”\n凯尔希面露讥讽:“你有那种变态的爱好，想当我的爸爸？”\n“不。”\n你的椅子滑动过来，身体前倾，以坐姿抱住了站姿的凯尔希。\n你的脑袋贴在凯尔希的肚皮上，那扁平的线条向你诉说她尚未受孕的事。\n“凯尔希，我们要个孩子吧。”你说。\n你的脑袋旋即被敲了一下，抬起头来，看到凯尔希俏脸绯红。
55,313,2,“凯尔希，别动，你的脸上有东西。”\n凯尔希抬起头来一动不动，她给予你信任，你却飞快的啄了一下她的嘴唇，转身就跑。\n当然，你也为你的恶作剧付出代价，凯尔希向你摊派了更多工作。\n这个可恶的老猞猁！
56,313,2,“凯尔希，你已走过漫长的人生，可知道接吻是什么滋味？”\n自从知道凯尔希是老处女后，你一直拿性的话题撩逗对方。\n“我没时间去探究这些庸俗的小事。”凯尔希说。\n你坏笑道:“但我很在意，那我就找其他女干员，比如安洁莉娜或者艾雅法拉去试一试，她们真的纯情又可爱呢，想来滋味有所不同。”\n你刚说完，凯尔希就揪住你的衣领，粗暴的吻印在你嘴唇上。
57,313,2,“博士，你已经失去了过去的记忆，可曾知道接吻是什么滋味？”\n在两人独处的时刻，凯尔希卸下严肃的面具，平静的走到你面前。\n你笑着回答:“凯尔希老师能让我知道吗？”\n凯尔希应允，她在情爱上总是慷慨的，于是她搂住你的腰肢，扬起头颅，她的唇瓣，她的发丝，她的眸子在你眼里放大……绯色，奶白，草绿色。\n你们的呼吸交融，朦胧而暧昧的气团拂过你们的脸颊，带来微痒的触感。\n你闭上眼睛，她的唇瓣比你想象的更柔软。
58,313,2,在成为情侣后，凯尔希对你的亲吻没有任何抵触，在大部分时候，你都能品尝凯尔希的滋味。\n但请小心，亲吻会唤来凯尔希的欲火，她的胃口极大，以至于在厕所中，在浴室里，在无人的角落，总是回响你粗重的喘息，以及她压抑的尖叫。
59,314,2,看到你卖力工作，作为奖励，凯尔希伸手拉着你枕在她的膝盖上。\n凯尔希大腿的触感不如暗索，但她身上的气味，却如同调香师的熏香治疗一样让人安心。\n你闭上眼睛，享受这静谧安详的时光。
60,314,2,看凯尔希坐着读报纸，无事可做的你在她身边坐下，侧躺，枕在了凯尔希的大腿上。\n凯尔希手摁在你的后脑勺，想要把你推开，你顽固的据守阵地，表明自己的态度。\n“像个长不大的孩子。”\n她一声叹息，把报纸拍在你脸颊上。油墨味的黑暗降临，枕下凯尔希大腿的触感变得更加真实。
61,314,2,你累了，休息一会儿，醒来的时候发现自己睡在凯尔希的大腿上。\n你回身向里，脸颊贴着凯尔希的肚子，感觉暖洋洋的。
62,315,2,一阵风吹过，凯尔希的裙摆掀起，你聚精会神，看裙摆下凯尔希洁白的大腿，以及屁股与大腿之间那条褐色的线。\n就差一点，你就能看到凯尔希的内裤。\n于是，你快步向前，伸手掀起凯尔希的裙摆，如愿看到裙下的景色。
63,315,2,看着严肃的凯尔希，你对她生出恶作剧的念头，于是装作从她身边经过，趁机伸手一把把她的裙摆掀起。\n你满足了，但凯尔希没有，接下来她说教了你好一会儿。
64,315,2,“凯尔希，能把裙子掀起来吗？”\n你深情的叫着凯尔希的名字，凯尔希脸色微红，她瞪着你，却满足了情郎变态的要求。\n裙摆一点点掀起，在她肌肤和内裤上摩擦发出细碎的声音。\n你瞪大眼睛，看着凯尔希肌肤一寸寸裸露出来，最后，她的内裤出现在你眼里。\n内裤的底部已经变成半透明的形状，凯尔希的汗液与爱液把布料浸润，告诉你她已经情动。
65,317,2,你挽着凯尔希靠在墙边，手不老实的伸进她的裙摆里，插进内裤。\n在你的挑逗下，凯尔希的阴蒂膨胀，变成硬硬的小豆豆。\n凯尔希原本想要说什么，但她最后闭上嘴巴，靠在墙上任你施为。
66,317,2,你把手伸进坐着的凯尔希双腿之间，娴熟的找到她阴蒂所在的位置，轻拢慢捻抹复挑。\n凯尔希双腿夹住你的手腕，但没有用力，她靠在你的肩膀上，身体随着你的动作变得火热起来。
67,318,2,你和凯尔希站在办公室的一端，听着另一边的阿米娅和你们交谈。\n趁着凯尔希专注阿米娅，你的手伸进凯尔希的裙子里。\n凯尔希扭动屁股想要甩开你，但你的手已经探入内裤里，沿着凯尔希下体的肉缝滑动。\n凯尔希瞪了你一眼，继续和阿米娅说话了，你则肆无忌惮的侵攻凯尔希的小穴。\n待你的指尖被凯尔希涌出的爱液打湿，你的食指顺势钻进凯尔希的蜜穴里。\n凯尔希的蜜穴已经湿哒哒的，你的手指顺利滑入，摸索到凯尔希阴道前段的凸起，那是凯尔希的G点。\n你的手指温柔的触及G点，凯尔希发出一声呻吟，阿米娅奇怪的看过来，她慌张的摇头:“没什么，阿米娅，我只是有些累了。”\n“哦，那凯尔希医生注意休息。”\n阿米娅离开了，凯尔希踮着脚向外看，确认情况后回头狠狠瞪了你一眼。
68,318,2,在无人且充满情趣的时刻，已成爱侣的凯尔希与你会玩些别样的游戏。\n此刻，凯尔希坐在单人沙发上，她上身包裹严实，表情庄严，而腰身以下却是赤裸的。\n她的双腿张开，搭在扶手上，阳光打在她卷曲的、稀疏的毛发上，打在插入她阴户的手指上。\n当你拔出手指的时候，凯尔希的花瓣闭合，从中挤出几滴油亮的汁水，而那些汁水，也出现在你的手指上。
69,319,2,“肛门是肮脏的，是隐秘的，是羞于展示的，而对某些科室的医生来说，他们与肛门打交道已经成为日常。”凯尔希说。\n“凯尔希也是吗？”\n凯尔希笑的不怀好意:“是啊，毕竟博士的那东西根本就没闲下来过，或许有一天，你需要我深入你的肛门，为你做前列腺按摩。”\n“那么凯尔希呢，介意你的后门被人插入吗？”\n“当然，如果没有事先周密的准备，我绝不允许别人碰我的后门。”\n所谓周密准备，第一步从手指插入开始。凯尔希把自己后门洗净，教导你该如何温柔的侵入她的后门。
70,319,2,你从凯尔希那里得知，早在婴儿时代，人们便在排泄的时候，从肛门那里收获快感。\n你好奇的瞄向凯尔希的后门，不同于你进出凯尔希小穴的随意，凯尔希要求你从手指开始。
71,401,2,你搂抱着凯尔希，手掌在她的身躯上游走，进攻她的耳垂，抚摸她的脖颈与肩膀。\n凯尔希有些难为情的躲闪，因为她的身躯上有源石结晶。但你丝毫不在意，用手轻轻摩挲，向下滑动，她的乳房、小腹、大腿与屁股没能逃过你的蹂躏。\n凯尔希的表情正在忍耐，凯尔希的欲望正在燃烧。
72,401,2,凯尔希是炉火，她在燃烧时最为美丽销魂，而现在，你则需要添加燃料，并点燃引火之物。\n所以，你极速靠近凯尔希，用你灵巧的手指进攻凯尔希的身体，她微微颤抖着说了什么。\n你没听见，你靠近之后，听到她克制但仍然发颤的声音——\n“用力一些，改变我。”
73,401,2,你的手掌在凯尔希身上游走的时候，一阵神情恍惚。\n“你在想什么？”凯尔希问。\n“凯尔希，你太美了，一直是我性幻想的对象，而当幻想变成现实的时候，我在怀疑自己做梦。”\n你的手指在凯尔希的腰肢上滑动:“太好了，这不是梦。”\n凯尔希哑然失笑，嘟囔道:“博士……你这个没出息的！”
74,401,2,一场完美的性爱先从调情开始，所以你和凯尔希亲吻相拥\n你们贪婪而粗暴的撕扯对方的衣服，抚摸对方的肌肤，快感让你们眼睛赤红，呼吸沉重，心跳如鼓。\n你的肉棒已从沉睡中苏醒，隔着布料顶在凯尔希的小腹上，凯尔希吃吃的笑了起来。
75,401,2,你的手指进攻凯尔希每个隐秘的角落，从胸部向四周扩散，凯尔希的手无力的搭在你的肩膀上，不时传来几声应景的呻吟。
76,401,2,在凯尔希专注自慰的时候，你的手在她游走，捏捏她的耳垂，抚摸她的脖颈与长发，自然，你也不会放过她的大腿。\n在你的助攻下，凯尔希的情绪越发高涨。
77,401,2,凯尔希侧身躺在你怀里，为你手交的时候，你搂着凯尔希的身体，在她的背脊和屁股上滑动，轻轻抚摸她的尾椎骨。
78,401,2,凯尔希跪在你面前口交的时候，你的手放在她的脑袋上，轻轻摩挲。\n如果凯尔希系着双马尾就好了。你想，这样，你就能抓住她的马尾，在她嘴巴里奋力耕耘。
79,401,2,凯尔希跪在地上，在你的双腿之间，用乳肉包裹住你的肉棒上下滑动的时候。\n你身体前倾，从凯尔希的后脑勺开始抚摸，沿着她背脊的线条向下，一路直抵她的尾椎骨。
80,401,2,凯尔希躺在你怀里，伸脚摆着你的肉棒前后滑动，你的前列腺液成为她脚底与你肉棒之间的润滑。\n你的手也没闲着，伸手在凯尔希的肌肤上游走，让她的躯壳越来越热。
81,401,2,凯尔希在你双腿之间用手握住你的肉棒，用舌尖刺激你的马眼。\n作为她卖力工作的奖赏，你摸了摸她的头发，玩弄她的耳垂。
82,401,2,凯尔希在你双腿之间用乳肉包裹你的肉棒，用舌尖刺激你的马眼。\n看她低头卖力工作的模样，你伸手摸了摸她支棱起来的兽耳，把发丝从她肩膀上拨开。
83,401,2,凯尔希低下头颅，让你的肉棒顶到她喉咙深部，你被湿滑的软肉包裹，触感好像在侵犯苏苏洛。\n一想到苏苏洛，你的肉棒又胀大了一点，你伸手抚摸凯尔希的后脑勺，将其当做苏苏洛的小穴进出。
84,401,2,凯尔希的脸颊干瘪，脑袋飞快的前后摇晃，强大的吸力似乎表明，她非要从你的马眼里榨出什么。\n被她控制不是你的风格，于是你伸手抚摸凯尔希的身体，企图打断她的节奏。
85,401,2,你把凯尔希抱在怀里，以最亲密的姿态交合时，你的手掌在凯尔希身体上游走滑动，感受她逐渐变得火热和湿润的肌肤，还有心脏强劲有力的跳动。
86,401,2,凯尔希背对着，她的背脊和不断上下活动的桃臀在你眼里一览无余，你伸手抚摸着她被汗水浸润的背脊，有几缕长发黏在上面。\n若凯尔希留长发就好了，你想。
87,401,2,凯尔希趴在你身上，她那松软像是棉花的乳房在你胸口扩散柔软的触感。\n你伸手抚摸，从她的后脑勺划过，路过汗津津的脖颈，感受她背脊优美的曲线，最后抓住她的屁股，揉搓拉扯。
88,402,2,你搂着凯尔希，靠近，微微偏转头颅，凯尔希默契的调整角度，于是你们的唇瓣以完美的角度贴合。\n凯尔希的唇瓣上涂抹着唇膏，你伸出舌头，撬开凯尔希的牙冠，把唇膏的味道一起分享。
89,402,2,你和凯尔希亲吻相拥，令凯尔希眼神迷离，目光湿润，在气尽之时，你与凯尔希分离，企图喘息一会儿再卷土重来。\n“别想逃。”\n凯尔希起身，伸手抱住你的脑袋，以居高临下的亲吻封住你的嘴唇。\n她湿热的气息喷洒在你脸上，而你则在她漫长的亲吻里融化。\n在你几乎窒息的时候，你抗议的拍了拍她的手臂，她的眉眼弯成欢欣的形状，终于放开你。\n“哈，哈。”\n你大口大口喘息着，凯尔希用手指戳着你的脸颊，问道:“亲吻可不止你来施加激情哦，博士，你欺负别的小姑娘惯了，可不要把经验搬到我头上。”
90,402,2,你托着凯尔希的后背，俯身去亲吻，凯尔希手臂搭在你的手臂上，昂起头颅张开嘴巴，承载你的欲望。\n你们的舌头纠缠在一起，相互挑逗，发出啧啧的声音，口水滴落，凯尔希的胸口变得闪亮，溪流蜿蜒奔向她深邃的乳沟。
91,402,2,你一边揉搓凯尔希的乳房，一边靠过去和她接吻。\n凯尔希微微躲闪，你的亲吻落空，但你在性事上是一个好猎手，锲而不舍是你最大的优点。\n你在凯尔希的乳房上加重力道，凯尔希因为痛苦而动作停滞的时候，你终于如愿以偿的吻上她的唇。
92,402,2,凯尔希的乳头在你的念搓下已经挺翘，快感让她眼神迷离，唇瓣微张，湿热的吐息从中泄露。\n你被那唇瓣诱人的色泽所吸引，凑过去吻住凯尔希。
93,402,2,你侧身搂着凯尔希，一边揉搓她的阴蒂，一边亲吻她的嘴唇。\n“轻一些，那里很敏感。”\n凯尔希皱眉推了推你，你放松力道，快感取代痛苦，于是你和凯尔希的亲吻越发情热。
94,402,2,你的手指搅动凯尔希的蜜穴，如同搅动她的心，但你发觉，你给凯尔希带来的快感还不够。\n于是，你凑近依偎在你怀里的凯尔希，舌头搅动她的唇舌。
95,402,2,你的手指在凯尔希的股沟滑动，指尖轻轻刺激凯尔希菊花的同时，亲吻她嘴唇。
96,402,2,凯尔希跪在你双腿之间，用手撸动你肉棒的时候，你则伸手挑起凯尔希的下巴，脸庞凑过去亲吻她。\n你们的气息融合在一起，凯尔希恶作剧的加快套弄你肉棒的速度，于是你的呼吸变得紊乱。
97,402,2,你抱住凯尔希，肉棒一边在她双腿缝隙里错进错出，一边亲吻她的嘴唇，两条灵巧的舌头棋逢对手。
98,402,2,传教士体位令你和凯尔希亲密无间，你看着身下的凯尔希云鬓散乱的模样，心生怜爱，吻上她的唇瓣。
99,402,2,你压在凯尔希身上驰骋，而她的头发则是你的缰绳。\n你揪住她的发丝，令这头高傲的牝马回头，粗暴的亲上去，正如你的肉棒粗暴的侵犯着她湿的一塌糊涂的肉穴。
100,402,2,女骑士凯尔希用肉穴将你的肉棒牢牢嵌套，她俯下身来，降下一片阴影，面庞在你眼里慢慢放大。\n而后，她捧住你汗津津的面颊，把咸涩的味道和你分享。
101,402,2,当你和凯尔希抱在一起做爱的时候，时而是她腰肢摇动，让自己的蜜穴前后吞吐你的肉棒。\n时而是你托着她的臀部挺送，每一下都带着粘稠的爱液。\n不过，在亲吻这事上，居高临下的凯尔希始终掌握着节奏:\n她时而双手抚摸你的肩膀，留下蜻蜓点水的一吻；\n时而揽着你的后脑勺，留下情人般缠绵的一吻；\n时而捧住你的面颊，像霸道的女王给予你粗暴且窒息的吻。
102,402,2,凯尔希背对着你，以慵懒的姿态斜握在你身上。\n你与她面颊相贴，默契让你们同时转动头颅，吻在一处。
103,402,2,你把凯尔希粗暴的压在墙上，肉棒自下而上深深嵌合在凯尔希的体内。\n在下一轮征伐之前，你吻住凯尔希，既是调情，也是为了积蓄体力。
104,402,2,你把凯尔希压在墙上，大腿顶着大腿，胸脯贴着后背，仿佛要融为一体。\n你贴在墙上，凯尔希转头，直至你们之间再无缝隙。\n你们的亲吻如此煽情，墙壁上湿漉漉的痕迹可以作证。
105,402,2,你的肉棒刺激凯尔希阴道里凸起的敏感之点，凯尔希像缺氧的鱼般张开嘴巴，你暂时停止动作，俯身堵住她的嘴唇，舌头勾住她的舌头，发出啧啧的声音。
106,402,2,你的肉棒顶到凯尔希阴道尽头的一片软肉，凯尔希吃痛的皱起眉头，对于女性来说，男人的那东西太大也不是好事。\n你俯身亲吻凯尔希，希望通过这种方式减少她的不适。