cid,behavior_id,adv_id,context
口上id,触发口上的行为id,口上限定的剧情npcid,口上内容
str,int,int,str
0,0,0,1
口上配置数据,,,
0,101,2,凯尔希总是忙碌的，你的声音把她从沉思里唤醒。\n她平静的看着你，目光中带着审视——\n“博士，是有任何疑惑吗？\n还是说失去记忆的你，对每个人都有强烈且平等的好奇？”她问。\n你当然好奇，如果罗德岛是铸炉，那么凯尔西便是铸炉里的火，驱动罗德岛不断改变。\n干员——特别是医疗干员，经过其灼烧，无人能保持不变。\n“我对罗德岛的一切都保持好奇，但凯尔希，你说错了一件事。”\n你说：“好奇并不平等，我对你的好奇比其他干员更强烈。”\n“为什么？”\n“不知道，只是我的本能……或许是人类对火的好奇？”\n凯尔希嘴角上扬却并无笑意：“那你应该知道，博士，与火同舞的人，最后绝大部分都会变成灰烬。”\n你谨记凯尔希的教导，但你同样知晓：\n无论巴别塔还是罗德岛，“博士”这个词汇都意味着万中无一。
1,101,2,你向凯尔希搭话，凯尔希的回应却并不热切。\n你的不满写在脸上，她抬头，草绿色的眸子里有一丝嘲弄——\n“言辞，有时是倾诉者的钥匙，拧转聆听者的心灵门扉，使其洞开。\n不过我想，博士你的心灵不会为我开放。”她说。\n你回答：“如果你不是故意找茬，凶巴巴的命令我做事的话，我觉得我们关系应该不错。”\n“你我的年纪不再是少男少女，你我的关系不必如此礼貌客气。\n博士，从前我们就是如此。”凯尔希说。\n失忆究竟是你的借口还是凯尔希的借口？\n你不知道，并期待着取回记忆的那一天。
2,101,2,阿米娅与黑钢国际的专员在走廊边走边谈，阿米娅冲你和凯尔希嫣然一笑，然后追上对方。\n你和凯尔希的目光追随着阿米娅的背影，直到阿米娅消失在转角。\n正因为陪伴在阿米娅身边，你才能理解阿米娅娇小的身影承受多少重担。\n你看向凯尔希，凯尔希也把面庞对准你，她面颊的线条十分柔和。\n你以为她的柔和是对阿米娅情感的残余，几秒之后，你发现这柔和里有属于自己的一分。\n你笑着说：“有点受宠若惊？”\n凯尔希摇摇头：“你在想什么？”\n“我还以为你会摆出扑克脸。”\n凯尔希看向别处：“我对你抱有敌意？不，从没有。\n我只是希望阿米娅能够保护罗德岛，你来保护阿米娅，而我来保护你。”
4,101,2,凯尔希与你偶遇时，绝大部分情况都是与你擦肩而过，但偶尔，她也愿意停下来和你聊一聊。\n“听说铸铁接手了饲养你的工作？”她问。\n你抗议饲养这种说法，凯尔希却径直在你肩膀上拍了拍。\n“比以前结实了，看起来她们说你在健身房锻炼是真的。”\n你有点惊奇：“你……还关心我的八卦？”\n“为什么不关心？”凯尔希反问，“你于我是特别的存在。”\n这话令你的心跳如同战鼓，因为这只老猞猁也是你心中特别的存在。\n凯尔希上前一步，为你整理衣领，小声说道：\n“其他你尽可以随意，但对你进行更进一步的医学检查是仅属于我的权利。”\n是的，凯尔希在博士的其他事上表现冷漠，但唯独对此事十分执着。\n即便最狂傲的罗德岛干员也知道，不要在博士这件事上挑战凯尔希的权威。
5,101,2,“W向你提起了‘特蕾西娅’这个名字？”\n凯尔希放下医疗报告，她的表情最初是惊讶，三秒之后是悲伤，一秒之后又变成镇定。\n“博士，现在你还不需要知道她，知道也没用……我不是在骗你。”\n“她是谁？”你问。\n“对罗德岛，对你我都很重要的人。”\n“对W也是吗？”\n“她？”凯尔希露出一丝轻蔑，“她对特蕾西娅一无所知，只是为王者着迷。”\n“王者……萨卡兹的王者？”\n“她曾是。”凯尔希眼眸低垂，“而后，她的理念便在罗德岛上延续。”\n凯尔希的伤感也成了你的伤感，对你如此重要的人物，你却想不起来。
6,103,2,凯尔希的强力使得你对她的感想超越性别，但她的姿色让你重新意识到她是一名女性。\n她裸露的肩膀对你是种诱惑，你伸手触摸，奶白色的肌肤如同海洋，而源石结晶是近海的礁石。\n凯尔希抬头看着你，不喜悦不愤怒，玩火的诱惑促使你摸向她的脖颈。\n“给个解释，博士？”\n她语气平静，你却感受到些许杀气，你急忙说道:“是按摩！”\n凯尔希看了你几秒，才低头说道:“那就来按摩吧，博士，希望你能规规矩矩，不然Mon3tr会把你掷出窗外。”\n之后，你来到凯尔希背后，老老实实为她做了按摩。
7,103,2,柏喙想给凯尔希设计蕾丝花边超短裙，这一想法得到了你的大力支持。\n为了取得关键的身体数据，你找到凯尔希，拿出卷尺时，Mon3tr的阴影把你覆盖。\n“给你三分钟，不然我就把你挂到舰桥上和极境、荆棘与华法林作伴。”\n你知道凯尔希的威胁不是空穴来风，罗德岛的舰桥真的会挂人。\n“听着凯尔希。”\n你摆出无害的表情:“我们都希望你有一件新衣服，你是罗德岛的体面，不能总穿一件衣服。”\n“那就不劳你费心了。”\n凯尔希反应冷淡:“旅行者，女仆，勋爵……博士，你以为过去的人生扮演过多少角色！”\n“想来你不会介意再扮演一种角色，我真的很想看你穿新衣服。”你小声说。\n凯尔希摇摇头，张开手臂让你测量数据。令你惊讶的是，这只老猞猁身材相当有料。\n你已经在期待她穿蕾丝花边超短裙，在午夜滑入你被窝的场景。
8,101,2,在夕阳坠落，月亮初升的时间，凯尔希的忙碌还在继续，那些与死神赛跑的神圣事业，从不区分白天黑夜。\n你有一件事要和凯尔希商量，凯尔希一边用手帕擦汗，一边说道:“这事你来决定。”\n“你确定让我这个失忆的人独力来做？”\n“博士的话，我完全不担心你会失败，这不是敷衍你，而是客观的评价。”\n能从眼高于顶的凯尔希那里得到称赞，你十分高兴，决定放手去做，做的漂亮，让凯尔希对你刮目相看。
9,101,2,你在办公的时候，凯尔希来你这里转了一圈，你问道:“有事？”\n“之前阿米娅说过，某人在办公的时候，和小姑娘调情，还有偷懒睡觉的事。”\n“苏苏洛不算小姑娘了吧。”你嘀咕道。\n在凯尔希的眼睛眯起，投射危险的视线后，你连连保证自己不会随便和看起来像小孩子的干员调情。\n等她走后，你立刻让早露过来。
10,101,2,在两段繁重的公务之间，是你用以休息的时间，你在走廊散步的时候遇到凯尔希，顺手分走了她怀抱里一半的资料。\n“我抱得动。”凯尔希说。\n“主要是找个借口和你一起，”你厚着脸皮说，“我觉得……我们亲近亲近，才方便沟通交流。”\n凯尔希看了你几秒，给了你一个后脑勺，向前迈开脚步，你急忙跟上去，来到与她并排的位置。
11,102,2,你试着向凯尔希搭话，凯尔希却并不理睬。你摸摸鼻子，转身离开。
12,102,2,你找到凯尔希的时候，后者正在忙碌，她手中的笔在纸页上划下黑色的轨迹。\n你转到侧面，看到头顶的灯光映出她苍白的面容，坚毅的眼神无法遮掩疲惫。\n你试着触摸水杯，发觉是凉的，于是你把它换成温开水送到凯尔希面前。\n“等我五分钟，”凯尔希不抬头的说道，“以及谢谢你，博士。”
13,103,2,凯尔希正在沉思，恶作剧的欲望让你从背后扑向她。\n幽绿色的菱形晶体炸裂，在你无法理解的原理运作下，Mon3tr的触角刺穿你的外衣。\n凯尔希回头，抬头看到挂在半空的你，你摆摆手，和她打了个招呼。\n想要惊吓凯尔希，但最后收到惊吓的是自己，你的尴尬溢于言表。\n凯尔希抿嘴一笑，让Mon3tr把你放下，你亲自为你抚平衣摆上的褶皱。\n她温柔体贴，而你噤若寒蝉，但可怕的事并没有发生，凯尔希离开了。
14,103,2,你与凯尔希在对角处撞了个满怀，凯尔希手里抱着的文件散落一地。\n你蹲下来帮她捡东西，凯尔希对你毫无防备，她无袖连衣裙的领口下坠，前扣式内衣撑起的滚圆乳球纳入你眼中。\n不知道脱掉胸罩之后，凯尔希自然状态下的胸形又是什么样子呢？\n你这么想着，不觉心猿意马，灼热的呼吸喷薄在凯尔希头顶。\n凯尔希抬头看到你色眯眯的表情，又低头，她冷静的遮掩住胸口，站起来，从你身边经过时踩了你一脚。\n如果这是笔交易，你还觉得挺合算。
15,103,2,罗德岛的通道与舱室禁止奔跑，但孩子的天性难以约束，而罗德岛恰好是雇佣童工的重灾区。\n你看到“大”孩子刻俄柏和泡泡、泡普卡等人玩耍，小刻在泡泡，泡泡跑到你的身后，冲刻俄柏比了个鬼脸。\n小刻有些生气的抓泡泡，两个人绕着你斗智斗勇，不幸的是，你这个障碍物并不坚挺。\n小刻与泡泡在你腰上施加的相反的、无法违抗的力量让你的世界开始旋转、倾倒。\n你的后脑勺马上要砸在墙壁上，自知犯错的小刻想要扑过去给你当人肉靠垫，却晚了一步。\n然后，你的世界停止了，你回头，看向稳稳托住你的人，凯尔希的面容被头顶的光模糊。\n她酷的像块冰，但偶尔，她也会成为你眼里的天使。
16,104,2,凯尔希会亲自处理那些伤重的感染者，在连台手术的间隙，她坐在长椅上大口咀嚼饼干的时候，路过的你递上一杯咖啡。\n凯尔希与泰拉的历史紧密联系在一起，她在不同时期有着截然不同的面貌，而在这里，而在此刻，她则是一位白衣天使。\n她抓紧时间补充能量，某种意义上，她在和时间赛跑，所以她劈手夺走了你手里的咖啡，顾不得烫，张嘴喝下。\n这下，她可不能拿你凌晨四点往嘴里塞泡面灌热水的事打趣了。\n等她喝完，你又给她续了一杯，第二杯她没有喝完，就被医疗干员叫走了。
17,105,2,凯尔希没有工作，没有会客计划，有充裕的支配时间……你知道这些后，立刻拜访了凯尔希。\n你和她东拉西扯，说的口干舌燥，所以自然去接两杯咖啡。\n凯尔希没有怀疑你的动力，也没有看到你下药时手臂抖动的动作。\n最后，你为咖啡加糖，用勺子充分搅拌后把用问题的那杯递给凯尔希。\n你看着凯尔希一饮而尽，目光带着期待。凯尔希不明所以，但不久之后，你看到她身体不自在的扭动一下，伸手解开衣领的第一颗纽扣。
18,105,2,凯尔希对你的信任，被你以不合时宜放置在咖啡中的东西回报，它们或许能够令凯尔希沉睡，或许能唤起凯尔希的情欲。\n背叛令人不齿，然而背叛总能收获价值。
19,106,2,你在办公室忙碌，口中干渴，思绪困顿，繁多的文件把你压在办公桌上，让你不得离开，不得抬头。\n所以你常会拜托访客为你做些事，这次也不例外，当你听到有人进入房间的时候，你随意吩咐让对方给你冲杯咖啡。\n当咖啡放到桌子上的时候，那只抓住杯把的手纳入你的视野，这是一只你无比熟悉的手。\n你抬起头，看到凯尔希正在看你，光芒刺穿玻璃穹顶，铺满她的面容，她的发丝闪闪发光。\n她吸引你的是面容，你吸引她的却是文件署名与批改意见。她满意于你工作的态度，自己坐在沙发上等待。
20,107,2,“博士，最近工作做的不错，我允许你向我申请一项奖励。”凯尔希说。\n你想了想，听闻凯尔希有无所不知的传闻，有心刁难她一下，于是回答:“做饭。”\n凯尔希难以置信:“嗯，这么简单的要求？”\n你更难以置信:“不，凯尔希医生竟然会做饭？”\n“我曾在泰拉游荡，穿过一个又一个荒野，你指望有一支补给队伍提供专业服务？”\n她看穿你的心思，回以略显轻蔑的笑容，然后系上围裙为你做饭。\n她的身影多出烟火的味道，而烟火让她从女强人变成小妇人。\n凯尔希一定也是位好太太。\n望着凯尔希的背景，你产生这样的念头。
21,108,2,漫长的岁月成就凯尔希的“无所不知”，然而，你的舌头确认，凯尔希的厨艺不过是刚刚脱离难吃的程度。\n你的胃口已经被铸铁养叼，凯尔希的饭菜自然难以下咽。\n“不想吃就不要吃了。”她平静的说。\n你识破了她的口是心非，她是高明的骗子，但骗不过你，她的微表情显示她渴望得到赞美。\n于是，你把餐盘的食物与汤碗里汤水吃的干净，凯尔希托着腮看着你，忽然偏开了目光。\n“怎么了？”你问。\n“没什么，只是在你身上看到故人的影子罢了。”
22,110,2,繁忙的工作让你嘴唇干燥，喉咙发炎，头脑昏沉，似有火焰焚烧你的身体。\n你的感觉很糟糕，而责任心让你继续，当你抽出下一份文件的时候，忽然有只手摁在你的手背上。\n“休息十五分钟，站起来去窗边呼吸新鲜空气，活动一下身体。”\n常与凯尔希打交道的你知道，这是来自凯尔希的命令，她不容违抗。\n于是你站起来，却眼前一黑，双腿发麻，身体向前倾倒，凯尔希稳稳接住了你。\n“劳逸结合，不要搞坏自己的身体，阿米娅、罗德岛……还有我，我们都需要你。”\n你撑住桌子静待取回双腿的感觉，来到窗前，凯尔希与你并肩而立，欣赏同样的风景。\n凯尔希的头发被风吹乱，你伸手为她归拢耳边散乱的鬓发，她安静的接受你的好意。
23,111,2,你打了一个又一个哈欠，虽是白天，但你的思绪已经坠向梦境。\n此刻，唯一能阻止你入梦的便是坐在沙发上的凯尔希，出乎意料的是，她让出了自己的位置，让你小憩一会儿。\n“博士，去睡吧，工作我来帮你完成。”她说。\n“谢谢……”你有些犹豫的说，“我还以为你会催我。”\n“阿米娅那孩子太心急，且下意识的依赖你，在她的世界里，你无所不能，所以她才催你工作。”\n你将信将疑的接受了这番解释，管它呢，反正能休息了。\n你舒服的躺在沙发上，以靠垫为枕，推进之王留下的毯子裹在你身上。\n推王的气味令你安心，阳光从你眼皮的缝隙钻入，温暖的风抚慰你的脸颊。\n你的头脑放空，身体放松，凯尔希沙沙的写字声伴你入梦。
24,109,2,罗德岛食堂按时供应三餐，分量十足，然而加班的人总渴望摄取更多热量。\n你背着铸铁从可露希尔的商店购买食物，碰巧看到凯尔希在速食披萨与泡面之间纠结。\n你路过的时候，抽走凯尔希手里的泡面，又挑选了一些食材，在柜台处结账，回头对凯尔希潇洒一笑。\n凯尔希无奈叹了口气，她结账后追出来说道:“博士，你至少要用正确的容器泡方便面。”
25,115,2,你有事要做，以你的武力和在罗德岛的重要性，携带一位护卫是必要之举。\n恰好，你遇到凯尔希，于是你邀请她同行。凯尔希确认自己的日程后，答应此事。\n“你觉得我们像是约会吗？”你问。\n凯尔希什么都没说，一脸嫌弃的看着你。
26,116,2,诸事已毕，与凯尔希的同行已非必要之举，于是你们原地解散。\n你的身体劳累，却拥有一段美好的回忆，你希望凯尔希能有类似的感觉，也希望共同的回忆在你们今晚的梦境重现。
27,125,2,如果你对凯尔希的情欲是火，此刻，你已经烈火焚心。\n恰好，凯尔希愿意被你燃烧，于是你们极速靠近，墙壁上投下两个重合在一起的身影。
28,126,2,“啊！”\n凯尔希如同被拉上岸的溺水之人，大口大口喘息着。\n她眼神朦胧，嘴角粘着发丝，汗水让她的肌肤闪亮，情欲的潮红在她身体上绽放朵朵梅花。\n你欣赏自己的战利品，犹如猎人欣赏自己捕获的猎物。\n“真……快活啊，仿佛世界没有烦恼的只剩性与爱。”凯尔希嘟囔道。\n你倒了两杯水，回身递给凯尔希，凯尔希爬起来靠在床头啜饮。\n她看着你，你看着他，你们相视一笑，心中无比甜蜜。
29,126,2,凯尔希的身体火热且胃口极大，你的囊袋已经被她下身的湿热嘴巴掏空。\n看到你再起不能，凯尔希略感遗憾的拿来毛巾，擦拭你们俩交合的痕迹。\n“博士，你应该明白锻炼身体的重要性了吧。”她说。
30,201,2,凯尔希协助你处理罗德岛的公务，当你诚恳地请求她给出建议时，她说:\n“罗德岛的核心部门是医疗部门，理论研究与实践救治都需要医学人才，外勤行动所需的医护人员也在不断增加。\n请记住，之后的时间里，你需要招募更多的医疗干员。”\n说完之后，她想起什么，略显恼怒的说道:\n“但是，请不要对医疗干员动手动脚，也不要让医疗干员对你动手动脚！”\n凯尔希的补充有的放矢，前者，你已经睡过了绝大多数医疗干员。\n后者，华法琳被你的血液吸引。\n在医疗部门做爱是被禁止的，而被禁止的事带来快感——\n此即你和华法琳在病床上交合的故事。
31,201,2,你好奇又害怕的发现，凯尔希对你有着极强的控制欲。\n在工作中，哪怕你和送来文件的干员说笑，她都会以视线给予压力。\n你暗笑这老猞猁醋吃的飞起，揭破这件事，凯尔希却一本正经的回答:\n“你每天都会接触很多干员，与他们交谈时，你必须警惕那些试图影响你意志的话语。\n保持你的自我，必要时，建议你向我求助。当然，你的话......你是不需要我的，对吗？”\n凯尔希对你的能力很乐观，对你们之间的关系却很悲观，是什么造成了她截然不同的态度？
32,201,2,罗德岛常在泰拉诸邦巡回，旅途中，荒芜与空旷是窗外的景象，逼得人们把视线转向室内，投向最在意的人。\n“你会质疑自己存在的意义吗，博士？”\n凯尔希说:“我会，大地上的生命十分顽强，它们在演化有着自己的位置，后天的驯化与对抗往往只是徒劳。\n我们的归宿会在何方，博士？你会有自己的答案，我只能这样坚持。”\n在这一点，凯尔希和其他罗德岛干员没什么区别，她希望你能给她一个答案，哪怕你才是迷茫的那一个。
33,121,2,凯尔希是一团火焰，带来温暖，同时焚尽一切。\n人们因渴求光明与温暖而靠近她，又因为害怕被焚烧殆尽，与她保持距离。\n而那些已被火焰席卷的人物，则在惊惧里对她下达诅咒。\n因而，凯尔希被众人环绕，她却十分孤独，漫长的生命锻造了凯尔希的智慧与坚定的意志，也留下一道道伤口。\n凯尔希令岁月燃烧，以灰烬覆盖伤口，于是她的生命留下许多条伤疤。\n伤疤愈多，这只老猞猁的脾气愈坏，她的火焰越是旺盛，带来温暖……以及畏惧。\n你害怕凯尔希，害怕她一月给你安排的七次检查，害怕她对人对己的严厉，害怕她的坏脾气，害怕她令你难堪的直率言辞。\n只是，本能驱动你去拥抱这团火焰。火焰致人疼痛，而你例外——\n因为博士同样是历史的见证者，岁月把博士沉淀为不焚之物。\n“我爱你，凯尔希。”\n第一遍告白被凯尔希忽视，你提高嗓音，第二遍告白令她讶然的抬起头颅。\n显然，你的突然袭击让凯尔希有些手足无措，但她很快板起面孔，企图强装镇定。\n你说出了许多土味情话，炸穿了凯尔希的防御，她草绿色的眸子里写满动摇，发出叹息一样的声音。\n“你吃错药了？还是我在做噩梦？”凯尔希问。\n“我很好，这一幕发生在现实里，凯尔希，逃避不是你的风格。”你说。\n她微微偏开头颅:“现在不是谈这些的时候。”\n“那么是什么时候呢，在我回到石棺再度沉睡的时候？”\n凯尔希怔住了，你的话唤醒她某些不好的回忆，她低声说道:“我们已经是非常亲密的关系……”\n“那就让我们的关系正当化！凯尔希，我的直觉告诉我，如果我在此时退缩，我未来一定会悔恨这段时光！”\n凯尔希咀嚼着“悔恨”这个词汇，她想起和失忆前博士的点点滴滴，悔恨的滋味为何，罗德岛没人比她更懂。\n“好……我同意了，如果你不介意你的恋人年长，无趣，且情绪暴躁的话。”\n凯尔希虚弱的同意声旋即被你的欢呼淹没，你冲过来，亲热的搂着凯尔希，凯尔希绷紧身体，不知所措，眼神迷茫，反应像小女孩一样可爱……直到Mon3tr把你分开。\n“爱情究竟是什么样子呢？”凯尔希喃喃的说。\n“诶？”你有些吃惊的看着对方，“老处……唔。”\n凯尔希收回踩住你脚掌的脚:“不许笑，我没谈过恋爱，只是有些好奇……这也不行吗？”\n“当然，这再好不过了，我占有了凯尔希你又一个第一次。”你愉快的说。\n促使凯尔希答应博士告白的不是爱情，而是悔恨；\n促使凯尔希答应博士告白的不是悔恨，而是懦弱；\n促使凯尔希答应博士告白的不是懦弱，而是好奇；\n促使凯尔希答应博士告白的不是好奇，终究还是爱。
34,122,2,你情难自抑，冲动的向凯尔希告白，凯尔希的反应却相当冷淡。\n“玩笑话到此为止，博士，泰拉的动向，天灾的窜变，感染者的存续，罗德岛的运转……还有阿米娅。\n这些事都比你我的私人感情重要。”\n你讪讪的摸了摸脑袋，从凯尔希的视野里消失了。
35,301,2,“你在做什么？”凯尔希问。\n“确认凯尔希你的发际线。”\n你有些惊奇的说道:“真亏你活了那么久，又时常熬夜，发际线还能如此坚挺。”\n凯尔希的视线顿时变得冰冷如乌萨斯的冰原，你讪讪的松开手。
36,301,2,凯尔希闭上眼睛的时候，她的五官放松，表情变得柔和，这时她从铸炉变回女人。\n你已经rua过不少罗德岛干员的头颅，凯尔希是为数不多你不没有得手的人物。\n而现在，机会来了。\n你的手放在凯尔希的头顶轻轻摩挲，感受她的发丝丝滑犹如绸缎——尽管保养有些堪忧。\n你收回手掌细嗅，能在洗发液廉价的人工香精味中，闻出消毒水的味道。\n但才是凯尔希，不是吗。
37,301,2,你摸了摸凯尔希的头，凯尔希轻哼一声，你以为她生气了，但手挪开之后，只看到她失望的表情。
38,302,2,你一直想要知道凯尔希的胸部有多大，以及有没有下垂。\n这份危险的好奇平常被你的理智压制，可众所周知，博士总是没有理智，而最优秀的博士力图保持没有理智。\n所以，趁着凯尔希对你没有防备的功夫，你的手摁在凯尔希的胸部。\n你来不及品味它，就被凯尔希拧住手腕。
39,302,2,趁着凯尔希昏昏欲睡的时候，你偷摸对她的胸部出手。\n薄薄的衣料下是内衣硬质的触感，沿着内衣的脉络向上，你摸到了被胸罩托起的胸部，饱满，柔软，只是……\n凯尔希已经睁开眼睛，她需要你做出解释。
40,302,2,“凯尔希，我想摸你的胸部。”\n你和凯尔希告白之后，某种程度的身体接触便成了日常的一部分。\n凯尔希应允了，你颤巍巍的伸出手包裹住她的奈子，在手里不住揉搓。\n凯尔希发出一声低低的呻吟，她的眼睛被雾气朦胧，显得格外魅惑。
41,302,2,你从背后抱住凯尔希，手指沿着她的肋部滑动，抓住凯尔希的胸脯，感受她的高耸和绵软。\n“你会是个好母亲。”你称赞道。\n“以胸识人可不是什么好习惯，博士。”凯尔希回答。\n随后，凯尔希挣脱了你，开始对你一番说教。
42,302,2,你向凯尔希索求工作后的慰劳品，凯尔希答应了，于是你伸手扒开她的衣领。\n被朴实无华的草绿色胸罩勾勒出的乳球纳入你眼中。\n你伸出一根手指，插入凯尔希深邃的沟壑里，上下滑动。\n“嗤，像小孩子一样。”凯尔希说。
43,303,2,凯尔希的衣领遮掩了她宝藏般的胸部，既然如此，她的衣摆下是否藏着另一个宝藏？\n于是，你伸手摸向凯尔希的屁股，尽管很快就被凯尔希推开，但你确认，凯尔希是好生养的体型。
44,303,2,凯尔希蹲下来捡东西，蜜桃形状的臀部清晰的映在她的裙摆下。\n你按捺不住，伸手摸向凯尔希的屁股，结实、沉重，富有弹性，但皮肤的触感略显粗糙，不及巫恋、铃兰细腻。\n凯尔希起身，你转身就逃，却被Mon3tr捆住。\n“博士，给我一个说法，不然你今天就去挂舰桥。”
